title,score,developer,publisher,rom_name,size,running_total
Super Mario Galaxy,9.7,Nintendo,Nintendo,"Super Mario Galaxy (USA) (En,Fr,Es).iso",4.4 GiB,4.4 GiB
Super Mario Galaxy 2,9.7,Nintendo EAD Tokyo ,Nintendo,"Super Mario Galaxy 2 (USA) (En,Fr,Es).iso",4.4 GiB,8.8 GiB
The Legend of Zelda: Twilight Princess,9.5,Nintendo,Nintendo,"Legend of Zelda, The - Twilight Princess (USA) (En,Fr,Es) (Rev 2).iso",4.4 GiB,13.1 GiB
World of Goo,9.4,2D Boy,2D Boy,World of Goo (USA) (WiiWare).wad,43.9 MiB,13.2 GiB
Super Smash Bros. Brawl,9.3,Game Arts,Nintendo,Super Smash Bros. Brawl (USA) (Rev 2).iso,7.9 GiB,21.1 GiB
The Legend of Zelda: Skyward Sword,9.3,Nintendo,Nintendo,"Legend of Zelda, The - Skyward Sword (USA) (En,Fr,Es) (Rev 2).iso",4.4 GiB,25.5 GiB
Rayman Origins,9.2,UBlart Montpellier,Ubisoft,"Rayman Origins (USA) (En,Fr,Es).iso",4.4 GiB,29.9 GiB
Rock Band 2,9.2,Harmonix Music Systems,MTV Games,Rock Band 2 (USA).iso,4.4 GiB,34.2 GiB
Xenoblade Chronicles,9.2,Monster Games Inc.,Nintendo,"Xenoblade Chronicles (USA, Asia) (En,Fr,Es).iso",7.9 GiB,42.2 GiB
Metroid Prime Trilogy,9.1,Retro Studios,Nintendo,Metroid Prime Trilogy (USA).iso,7.9 GiB,50.1 GiB
Resident Evil 4 (2005),9.1,Capcom,Capcom,Resident Evil 4 - Wii Edition (USA).iso,4.4 GiB,54.5 GiB
Rock Band 3,9.1,Harmonix Music Systems,MTV Games,Rock Band 3 (USA).iso,4.4 GiB,58.8 GiB
Metroid Prime 3: Corruption,9.0,Retro Studios,Nintendo,Metroid Prime 3 - Corruption (USA).iso,4.4 GiB,63.2 GiB
Okami,9.0,Clover Studio,Capcom,Ookami (USA).iso,4.4 GiB,67.6 GiB
Cave Story,8.9,Nicalis,Nicalis,Cave Story (USA) (v258) (WiiWare).wad,28.0 MiB,67.6 GiB
Guitar Hero 5,8.9,Neversoft Entertainment,Activision,"Guitar Hero 5 (USA) (En,Fr).iso",4.4 GiB,72.0 GiB
The Beatles: Rock Band,8.9,Harmonix Music Systems,MTV Games,"Beatles, The - Rock Band (USA) (En,Fr,Es).iso",4.4 GiB,76.4 GiB
Art of Balance,8.8,Shin'en,Shin'en,Art of Balance (USA) (WiiWare).wad,35.0 MiB,76.4 GiB
DJ Hero 2,8.8,FreeStyleGames,Activision,"DJ Hero 2 (USA) (En,Fr).iso",4.4 GiB,80.8 GiB
Tiger Woods PGA Tour 10,8.8,EA Tiburon,Electronic Arts,Tiger Woods PGA Tour 10 (USA) (Rev 1).iso,4.4 GiB,85.2 GiB
DJ Hero,8.7,FreeStyleGames,Activision,"DJ Hero (USA) (En,Fr).iso",4.4 GiB,89.5 GiB
Donkey Kong Country Returns,8.7,Retro Studios,Nintendo,"Donkey Kong Country Returns (USA) (En,Fr,Es) (Rev 1).iso",4.4 GiB,93.9 GiB
La-Mulana,8.7,Pygmy Studio,Rising Star Games,La-Mulana (USA) (WiiWare).wad,42.9 MiB,94.0 GiB
Little King's Story,8.7,Cing,XSEED Games,"Little King's Story (USA) (En,Fr,Es).iso",4.4 GiB,98.3 GiB
New Super Mario Bros. Wii,8.7,Nintendo,Nintendo,"New Super Mario Bros. Wii (USA) (En,Fr,Es) (Rev 2).iso",4.4 GiB,102.7 GiB
Sin & Punishment: Star Successor,8.7,Treasure,Nintendo,Sin & Punishment - Star Successor (USA).iso,4.4 GiB,107.1 GiB
Zack & Wiki: Quest for Barbaros' Treasure,8.7,Capcom,Capcom,Zack & Wiki - Quest for Barbaros' Treasure (USA).iso,4.4 GiB,111.5 GiB
Bomberman Blast,8.6,Hudson,Hudson Soft,Bomberman Blast (USA) (WiiWare).wad,31.0 MiB,111.5 GiB
Boom Blox Bash Party,8.6,EA LA,Electronic Arts,"Boom Blox Bash Party (USA) (En,Fr,Es).iso",4.4 GiB,115.9 GiB
Fluidity,8.6,Curve Studios,Nintendo,Fluidity (USA) (WiiWare).wad,33.9 MiB,115.9 GiB
Guitar Hero III: Legends of Rock,8.6,Neversoft Entertainment,RedOctane,Guitar Hero III - Legends of Rock (USA) (Rev 1).iso,4.4 GiB,120.3 GiB
Guitar Hero World Tour (2008),8.6,Neversoft Entertainment,Activision,"Guitar Hero World Tour (USA) (En,Fr).iso",4.4 GiB,124.7 GiB
JumpStart Pet Rescue,8.6,Knowledge Adventure Inc.,Knowledge Adventure Inc.,JumpStart Pet Rescue (USA).iso,4.4 GiB,129.0 GiB
Kirby's Epic Yarn,8.6,Good-Feel,Nintendo,"Kirby's Epic Yarn (USA) (En,Fr,Es).iso",4.4 GiB,133.4 GiB
LostWinds: Winter of the Melodias,8.6,Frontier Developments,Frontier Developments,LostWinds - Winter of the Melodias (USA) (WiiWare).wad,43.4 MiB,133.5 GiB
Punch-Out!!,8.6,Next Level Games,Nintendo,"Punch-Out!! (USA) (En,Fr,Es) (Rev 1).iso",4.4 GiB,137.8 GiB
Tetris Party,8.6,Hudson Soft,"Tetris Online, Inc",Tetris Party (USA) (WiiWare).wad,34.2 MiB,137.9 GiB
Boom Blox,8.5,EA LA,Electronic Arts,"Boom Blox (USA) (En,Fr,Es).iso",4.4 GiB,142.2 GiB
Guitar Hero: Metallica,8.5,Neversoft Entertainment,Activision,"Guitar Hero - Metallica (USA) (En,Fr).iso",4.4 GiB,146.6 GiB
Maboshi's Arcade,8.5,Mindware,Nintendo,Maboshi's Arcade (USA) (WiiWare).wad,21.4 MiB,146.6 GiB
Super Paper Mario,8.5,Intelligent Systems,Nintendo,Super Paper Mario (USA) (Rev 2).iso,4.4 GiB,151.0 GiB
Tatsunoko vs. Capcom: Ultimate All-Stars,8.5,Eighting,Capcom,Tatsunoko vs. Capcom - Ultimate All-Stars (USA).iso,4.4 GiB,155.4 GiB
Tiger Woods PGA Tour 12: The Masters,8.5,Electronic Arts,Electronic Arts,Tiger Woods PGA Tour 10 (USA) (Rev 1).iso,4.4 GiB,159.8 GiB
Bit.Trip Complete / THE BIT.TRIP,8.4,Gaijin Games,Aksys Games,Bit.Trip Complete (USA).iso,4.4 GiB,164.2 GiB
Monster Hunter Tri,8.4,Capcom,Capcom,"Monster Hunter Tri (USA) (En,Fr,Es).iso",4.4 GiB,168.5 GiB
No More Heroes 2: Desperate Struggle,8.4,Grasshopper Manufacture,Ubisoft,"No More Heroes 2 - Desperate Struggle (USA) (En,Fr,Es).iso",4.4 GiB,172.9 GiB
Pro Evolution Soccer 2009,8.4,KCET,Konami,"PES 2013 - Pro Evolution Soccer (USA) (En,Fr,Es,Pt).iso",4.4 GiB,177.3 GiB
Swords & Soldiers,8.4,Ronimo Games,Ronimo Games,Swords & Soldiers (USA) (WiiWare).wad,21.3 MiB,177.3 GiB
Tales of Monkey Island Chapter 4: The Trial and Execution of Guybrush Threepwood,8.4,Telltale Games,Telltale Games,Tales of Monkey Island - Chapter 4 - The Trial and Execution of Guybrush Threepwood (USA) (WiiWare).wad,43.7 MiB,177.4 GiB
Tiger Woods PGA Tour 11,8.4,EA Sports,Electronic Arts,Tiger Woods PGA Tour 10 (USA) (Rev 1).iso,4.4 GiB,181.7 GiB
And Yet It Moves,8.3,Broken Rules,Broken Rules,And Yet It Moves (USA) (WiiWare).wad,39.0 MiB,181.8 GiB
Bully: Scholarship Edition,8.3,Rockstar Vancouver,Rockstar Games,"Bully - Scholarship Edition (USA) (En,Fr,Es).iso",4.4 GiB,186.1 GiB
Call of Duty: World at War,8.3,Treyarch,Activision,Call of Duty - World at War (USA).iso,4.4 GiB,190.5 GiB
Mega Man 9,8.3,Inti Creates,Capcom,Mega Man 9 (USA) (WiiWare) (DLC).wad,356.1 KiB,190.5 GiB
MLB Power Pros,8.3,Konami,2K Sports,MLB Power Pros (USA).iso,4.4 GiB,194.9 GiB
No More Heroes,8.3,Grasshopper Manufacture,Ubisoft,"No More Heroes (USA) (En,Fr,Es).iso",4.4 GiB,199.3 GiB
Pro Evolution Soccer 2008,8.3,Konami,Konami,"PES 2013 - Pro Evolution Soccer (USA) (En,Fr,Es,Pt).iso",4.4 GiB,203.7 GiB
Rhythm Heaven Fever,8.3,Nintendo,Nintendo,Rhythm Heaven Fever (USA).iso,4.4 GiB,208.0 GiB
Tales of Monkey Island Chapter 5: Rise of the Pirate God,8.3,Telltale Games,Telltale Games,Tales of Monkey Island - Chapter 5 - Rise of the Pirate God (USA) (WiiWare).wad,43.5 MiB,208.1 GiB
WarioWare: Smooth Moves,8.3,Intelligent Systems,Nintendo,"WarioWare - Smooth Moves (USA) (En,Fr,Es).iso",4.4 GiB,212.5 GiB
Art Style: ORBIENT,8.2,Nintendo,Nintendo,Art Style - ORBIENT (USA) (WiiWare).wad,22.7 MiB,212.5 GiB
de Blob,8.2,Blue Tongue Entertainment,THQ,"de Blob (USA) (En,Fr,Es).iso",4.4 GiB,216.8 GiB
Dead Space: Extraction,8.2,Visceral Games,Electronic Arts,"Dead Space - Extraction (USA) (En,Fr).iso",4.4 GiB,221.2 GiB
Kirby's Dream Collection: Special Edition,8.2,HAL Labs,Nintendo,Kirby's Dream Collection - Special Edition (USA).iso,4.4 GiB,225.6 GiB
Madden NFL 09,8.2,EA Tiburon,Electronic Arts,Madden NFL 10 (USA).iso,4.4 GiB,230.0 GiB
Mario Kart Wii,8.2,Nintendo,Nintendo,"Mario Kart Wii (USA) (En,Fr,Es).iso",4.4 GiB,234.4 GiB
MotoHeroz,8.2,RedLynx,RedLynx,MotoHeroz (USA) (WiiWare).wad,30.1 MiB,234.4 GiB
NyxQuest: Kindred Spirits,8.2,Over the Top Games,Over the Top Games,NyxQuest - Kindred Spirits (USA) (WiiWare).wad,37.7 MiB,234.4 GiB
Pinball Hall of Fame: The Williams Collection,8.2,Farsight Studios,System 3,Pinball Hall of Fame - The Williams Collection (USA).iso,4.4 GiB,238.8 GiB
Pro Evolution Soccer 2010,8.2,Konami,Konami,"PES 2013 - Pro Evolution Soccer (USA) (En,Fr,Es,Pt).iso",4.4 GiB,243.2 GiB
Trauma Team,8.2,Atlus,Atlus,Trauma Team (USA).iso,4.4 GiB,247.6 GiB
Bit.Trip Flux,8.1,Gaijin Games,Aksys Games,Bit. Trip Flux (USA) (WiiWare).wad,46.3 MiB,247.6 GiB
Dawn of Discovery,8.1,Blue Byte,Ubisoft,Dawn of Discovery (USA).iso,4.4 GiB,252.0 GiB
EA Sports Active,8.1,EA Canada,EA Sports,"EA Sports Active - More Workouts (USA) (En,Fr).iso",4.4 GiB,256.4 GiB
escapeVektor: Chapter 1,8.1,Nnooo,Nnooo,escapeVektor - Chapter 1 (USA) (WiiWare).wad,23.2 MiB,256.4 GiB
GoldenEye 007 (2010),8.1,Eurocom,Activision,"GoldenEye 007 (USA) (En,Fr).iso",4.4 GiB,260.8 GiB
LostWinds,8.1,Frontier Developments,Frontier Developments,LostWinds (USA) (WiiWare).wad,35.1 MiB,260.8 GiB
Madden NFL 07,8.1,EA Tiburon,EA Sports,Madden NFL 07 (USA).iso,4.4 GiB,265.2 GiB
MadWorld,8.1,PlatinumGames,Sega,"MadWorld (USA) (En,Fr,Es).iso",4.4 GiB,269.5 GiB
Mega Man 10,8.1,Inti Creates,Capcom,Mega Man 10 (USA) (WiiWare) (DLC).wad,390.4 KiB,269.5 GiB
Muramasa: The Demon Blade,8.1,Vanillaware,Ignition Entertainment,Muramasa - The Demon Blade (USA).iso,4.4 GiB,273.9 GiB
Rage of the Gladiator,8.1,Ghostfire Games,Ghostfire Games,Rage of the Gladiator (USA) (WiiWare).wad,40.1 MiB,274.0 GiB
Skylanders: Spyro's Adventure,8.1,Toys for Bob,Activision,"Skylanders - Spyro's Adventure (USA) (En,Fr) (Rev 1).iso",4.4 GiB,278.3 GiB
Sonic the Hedgehog 4: Episode 1,8.1,Dimps Corporation,Sega,Sonic the Hedgehog 4 - Episode I (USA) (WiiWare).wad,46.5 MiB,278.4 GiB
Tiger Woods PGA Tour 09,8.1,EA Tiburon,Electronic Arts,Tiger Woods PGA Tour 10 (USA) (Rev 1).iso,4.4 GiB,282.8 GiB
You Don't Know Jack (2011),8.1,Jellyvision,THQ,You Don't Know Jack (USA).iso,4.4 GiB,287.1 GiB
A Boy and His Blob,8.0,WayForward,Majesco,"Boy and His Blob, A (USA).iso",4.4 GiB,291.5 GiB
Bit.Trip Beat,8.0,Gaijin Games,Aksys Games,Bit. Trip Beat (USA) (v256) (WiiWare).wad,46.5 MiB,291.6 GiB
Bit.Trip Core,8.0,Gaijin Games,Aksys Games,Bit. Trip Core (USA) (WiiWare).wad,41.3 MiB,291.6 GiB
Call of Duty: Black Ops,8.0,Treyarch,Activision,Call of Duty - Black Ops (USA).iso,4.4 GiB,296.0 GiB
EA Sports Active More Workouts,8.0,Electronic Arts,Electronic Arts,"EA Sports Active - More Workouts (USA) (En,Fr).iso",4.4 GiB,300.4 GiB
Final Fantasy Crystal Chronicles: My Life as a King,8.0,Square Enix,Square Enix,Final Fantasy Crystal Chronicles - My Life as a King (USA) (WiiWare) (DLC).wad,3.6 MiB,300.4 GiB
Geometry Wars: Galaxies,8.0,Kuju Entertainment,Sierra Entertainment,Geometry Wars - Galaxies (USA).iso,4.4 GiB,304.7 GiB
LEGO Star Wars: The Complete Saga,8.0,Traveller's Tales,LucasArts,"LEGO Star Wars - The Complete Saga (USA) (En,Fr,Es) (Rev 1).iso",4.4 GiB,309.1 GiB
Red Steel 2,8.0,Ubisoft Paris,Ubisoft,"Red Steel 2 (USA) (En,Fr,Es).iso",4.4 GiB,313.5 GiB
Rock Band,8.0,Harmonix Music Systems,MTV Games,Rock Band (USA).iso,4.4 GiB,317.9 GiB
Tales of Monkey Island Chapter 3: Lair of the Leviathan,8.0,Telltale Games,Telltale Games,Tales of Monkey Island - Chapter 3 - Lair of the Leviathan (USA) (WiiWare).wad,43.6 MiB,317.9 GiB
The Last Story,8.0,Mistwalker,XSEED Games,"Last Story, The (USA) (En,Fr,Es).iso",7.9 GiB,325.8 GiB
Trauma Center: Second Opinion,8.0,Atlus,Atlus,Trauma Center - Second Opinion (USA).iso,4.4 GiB,330.2 GiB
Wii Fit,8.0,Nintendo,Nintendo,"Wii Fit (USA) (En,Fr,Es) (Rev 1).iso",4.4 GiB,334.6 GiB
Wii Fit Plus,8.0,Nintendo,Nintendo,"Wii Fit Plus (USA) (En,Fr,Es).iso",4.4 GiB,339.0 GiB
Wii Sports Resort,8.0,Nintendo,Nintendo,"Wii Sports Resort (USA) (En,Fr,Es) (Rev 1).iso",4.4 GiB,343.3 GiB
Band Hero,7.9,Neversoft Entertainment,Activision,Band Hero (USA).iso,4.4 GiB,347.7 GiB
Bit.Trip Void,7.9,Gaijin Games,Aksys Games,Bit. Trip Void (USA) (WiiWare).wad,42.9 MiB,347.8 GiB
de Blob 2,7.9,Blue Tongue Entertainment,THQ,"de Blob 2 (USA) (En,Fr).iso",4.4 GiB,352.1 GiB
EA Sports Active 2,7.9,EA Canada,EA Sports,"EA Sports Active - More Workouts (USA) (En,Fr).iso",4.4 GiB,356.5 GiB
LEGO Harry Potter: Years 1-4,7.9,Traveller's Tales,Warner Bros. Interactive Entertainment,"LEGO Harry Potter - Years 1-4 (USA) (En,Fr,Es) (Rev 1).iso",4.4 GiB,360.9 GiB
Mario Strikers Charged,7.9,Next Level Games,Nintendo,"Mario Strikers Charged (USA) (En,Fr,Es) (Rev 1).iso",4.4 GiB,365.3 GiB
Metroid: Other M,7.9,Team Ninja,Nintendo,"Metroid - Other M (USA) (En,Fr,Es) (Rev 1).iso",7.9 GiB,373.2 GiB
Mini Ninjas,7.9,Io Interactive,Eidos Interactive,"Mini Ninjas (USA) (En,Fr,Es).iso",4.4 GiB,377.6 GiB
MLB Power Pros 2008,7.9,Konami,2K Sports,MLB Power Pros 2008 (USA).iso,4.4 GiB,382.0 GiB
NBA Jam (2010),7.9,EA Canada,EA Sports,NBA Jam (USA).iso,4.4 GiB,386.3 GiB
NHL 2K10,7.9,Take-Two Interactive,Take-Two Interactive,NHL 2K10 (USA).iso,4.4 GiB,390.7 GiB
Pro Evolution Soccer 2012,7.9,Konami,Konami,"PES 2013 - Pro Evolution Soccer (USA) (En,Fr,Es,Pt).iso",4.4 GiB,395.1 GiB
Rubik's Puzzle Galaxy: RUSH,7.9,Two Tribes,The Game Factory,Rubik's Puzzle Galaxy - RUSH (USA) (WiiWare).wad,17.7 MiB,395.1 GiB
Rune Factory Frontier,7.9,Neverland,XSEED Games,Rune Factory - Frontier (USA).iso,4.4 GiB,399.5 GiB
Silent Hill: Shattered Memories,7.9,Climax Studios,Konami,"Silent Hill - Shattered Memories (USA) (En,Fr,Es).iso",4.4 GiB,403.9 GiB
Tales of Monkey Island Chapter 1: Launch of the Screaming Narwhal,7.9,Telltale Games,Telltale Games,Tales of Monkey Island - Chapter 1 - Launch of the Screaming Narwhal (USA) (WiiWare).wad,43.7 MiB,403.9 GiB
Tales of Monkey Island Chapter 2: The Siege of Spinner Cay,7.9,Telltale Games,Telltale Games,Tales of Monkey Island - Chapter 2 - The Siege of Spinner Cay (USA) (WiiWare).wad,43.1 MiB,403.9 GiB
Toki Tori,7.9,Two Tribes,Two Tribes,Toki Tori (USA) (WiiWare).wad,39.0 MiB,404.0 GiB
WWE SmackDown vs. Raw 2009,7.9,Yuke's,THQ,"WWE SmackDown vs. Raw 2009 (USA) (En,Fr).iso",4.4 GiB,408.4 GiB
"You, Me, and the Cubes",7.9,fyto,Nintendo,"You, Me, and the Cubes (USA) (WiiWare).wad",22.7 MiB,408.4 GiB
"Blast Works: Build, Trade, Destroy",7.8,BudCat,Majesco,"Blast Works - Build, Trade, Destroy (USA).iso",4.4 GiB,412.8 GiB
Castlevania: The Adventure ReBirth,7.8,M2,Konami,Castlevania - The Adventure ReBirth (USA) (WiiWare).wad,35.2 MiB,412.8 GiB
Disney Guilty Party,7.8,Wideload Games Inc.,Disney Interactive Studios,"Disney Sing It - Party Hits (USA) (En,Fr,Es).iso",4.4 GiB,417.2 GiB
Donkey Kong Jungle Beat,7.8,Nintendo EAD Tokyo ,Nintendo,"Donkey Kong Jungle Beat (USA) (En,Fr,Es).iso",4.4 GiB,421.5 GiB
Fire Emblem: Radiant Dawn,7.8,Intelligent Systems,Nintendo,Fire Emblem - Radiant Dawn (USA) (Rev 1).iso,4.4 GiB,425.9 GiB
Grand Slam Tennis (2012),7.8,EA Canada,Electronic Arts,"Grand Slam Tennis (USA) (En,Fr).iso",4.4 GiB,430.3 GiB
Lego Indiana Jones: The Original Adventures,7.8,Traveller's Tales,LucasArts,"LEGO Indiana Jones - The Original Adventures (USA) (En,Fr,Es).iso",4.4 GiB,434.7 GiB
MySims Agents,7.8,Electronic Arts,Electronic Arts,"MySims Agents (USA) (En,Fr,Es).iso",4.4 GiB,439.1 GiB
Pro Evolution Soccer 2011,7.8,Konami,Konami,"PES 2013 - Pro Evolution Soccer (USA) (En,Fr,Es,Pt).iso",4.4 GiB,443.4 GiB
Rabbids Go Home,7.8,Ubisoft Montpellier,Ubisoft,"Rabbids Go Home (USA) (En,Fr,Es).iso",4.4 GiB,447.8 GiB
Shaun White Snowboarding,7.8,Ubisoft Montreal,Ubisoft,"Shaun White Skateboarding (USA) (En,Fr,Es).iso",4.4 GiB,452.2 GiB
Skylanders Giants,7.8,Toys for Bob,Activision,"Skylanders - Giants (USA) (En,Fr).iso",4.4 GiB,456.6 GiB
Sonic & Sega All-Stars Racing,7.8,Sumo Digital,Sega,"Sonic & Sega All-Stars Racing (USA) (En,Fr,Es).iso",4.4 GiB,460.9 GiB
Sonic Colors,7.8,Sonic Team,Sega,"Sonic Colors (USA) (En,Ja,Fr,De,Es,It).iso",4.4 GiB,465.3 GiB
The House of the Dead: Overkill,7.8,Headstrong Games,Sega,"House of the Dead, The - Overkill (USA) (En,Fr,Es).iso",4.4 GiB,469.7 GiB
The Magic Obelisk,7.8,Game Arts,Game Arts,"Magic Obelisk, The (USA) (WiiWare).wad",31.0 MiB,469.7 GiB
Wario Land: Shake It!,7.8,Good-Feel,Nintendo,"Wario Land - Shake It! (USA) (En,Fr,Es).iso",4.4 GiB,474.1 GiB
WWE SmackDown vs. Raw 2010,7.8,Yuke's,THQ,"WWE SmackDown vs. Raw 2010 (USA) (En,Fr,Es).iso",4.4 GiB,478.5 GiB
Excitebots: Trick Racing,7.7,Monster Games Inc.,Nintendo,ExciteBots - Trick Racing (USA).iso,4.4 GiB,482.9 GiB
Guitar Hero: Warriors of Rock,7.7,Neversoft Entertainment,Activision,"Guitar Hero - Warriors of Rock (USA) (En,Fr).iso",4.4 GiB,487.2 GiB
Kirby's Return to Dream Land,7.7,HAL Labs,Nintendo,"Kirby's Return to Dream Land (USA) (En,Fr,Es).iso",4.4 GiB,491.6 GiB
Klonoa: Door to Phantomile,7.7,Paon Corporation,Namco Bandai Games,Kaze no Klonoa - Door to Phantomile (Japan).iso,4.4 GiB,496.0 GiB
Madden NFL 10,7.7,EA Tiburon,Electronic Arts,Madden NFL 10 (USA).iso,4.4 GiB,500.4 GiB
Mercury Meltdown Revolution,7.7,Ignition Entertainment,Ignition Entertainment,"Mercury Meltdown Revolution (USA) (En,Fr,Es).iso",4.4 GiB,504.7 GiB
Pikmin,7.7,Nintendo,Nintendo,"Pikmin (USA) (En,Fr,Es).iso",4.4 GiB,509.1 GiB
Prince of Persia: The Forgotten Sands,7.7,Ubisoft Montreal,Ubisoft,"Prince of Persia - The Forgotten Sands (USA) (En,Fr,Es) (Rev 1).iso",4.4 GiB,513.5 GiB
Project Zero 2: Wii Edition,7.7,Koei Tecmo Games,Nintendo,"Project Zero 2 - Wii Edition (Europe) (En,Fr,De,Es,It).iso",4.4 GiB,517.9 GiB
The Godfather,7.7,Page 44 Studios,Electronic Arts,,,
Tomena Sanner,7.7,Konami,Konami,Tomena Sanner (USA) (WiiWare).wad,32.7 MiB,517.9 GiB
Trauma Center: New Blood,7.7,Atlus,Atlus,Trauma Center - New Blood (USA).iso,4.4 GiB,522.3 GiB
Art Style: light trax,7.6,Skip Ltd.,Nintendo,Art Style - light trax (USA) (WiiWare).wad,21.5 MiB,522.3 GiB
Bit.Trip Runner,7.6,Gaijin Games,Aksys Games,Bit. Trip Runner (USA) (WiiWare).wad,46.9 MiB,522.4 GiB
Bubble Bobble Neo!,7.6,Taito Corporation,Square Enix,Bubble Bobble (USA) (NES) (Virtual Console).wad,12.2 MiB,522.4 GiB
Call of Duty 4: Modern Warfare,7.6,Infinity Ward,Activision,Call of Duty - Modern Warfare 3 (USA).iso,4.4 GiB,526.7 GiB
Contra ReBirth,7.6,M2,Konami,Contra ReBirth (USA) (WiiWare).wad,36.7 MiB,526.8 GiB
Endless Ocean: Blue World,7.6,Arika,Nintendo,Endless Ocean - Blue World (USA).iso,4.4 GiB,531.2 GiB
Final Fantasy Fables: Chocobo's Dungeon,7.6,h.a.n.d. Inc.,Square Enix,Final Fantasy Fables - Chocobo's Dungeon (USA).iso,4.4 GiB,535.5 GiB
Ghostbusters: The Video Game,7.6,Terminal Reality,Atari SA,"Ghostbusters - The Video Game (USA) (En,Fr,Es) (Rev 1).iso",4.4 GiB,539.9 GiB
Green Day: Rock Band,7.6,Harmonix Music Systems,MTV Games,"Green Day - Rock Band (USA) (En,Fr,Es).iso",4.4 GiB,544.3 GiB
Guilty Gear XX Accent Core Plus,7.6,Arc System Works,Aksys Games,Guilty Gear XX Accent Core Plus (USA).iso,4.4 GiB,548.7 GiB
Harvest Moon: Animal Parade,7.6,Marvelous Entertainment,Natsume,Harvest Moon - Animal Parade (USA).iso,4.4 GiB,553.0 GiB
Jungle Speed,7.6,Next Level Games,"Playful Entertainment, Inc.",Jungle Speed (USA) (WiiWare).wad,39.3 MiB,553.1 GiB
LEGO Harry Potter: Years 5-7,7.6,Traveller's Tales,Warner Bros. Interactive Entertainment,"LEGO Harry Potter - Years 5-7 (USA) (En,Fr,Es,Pt) (Rev 1).iso",4.4 GiB,557.5 GiB
LEGO Star Wars III: The Clone Wars,7.6,Traveller's Tales,LucasArts,"LEGO Star Wars III - The Clone Wars (USA) (En,Fr,Es) (Rev 1).iso",4.4 GiB,561.8 GiB
Madden NFL 08,7.6,EA Tiburon,EA Sports,Madden NFL 08 (USA).iso,4.4 GiB,566.2 GiB
Max & the Magic Marker,7.6,Press Play,Press Play,Max & the Magic Marker (USA) (WiiWare).wad,40.9 MiB,566.2 GiB
NEVES Plus,7.6,Yuke's,Yuke's,Neves Plus (USA) (WiiWare).wad,11.4 MiB,566.3 GiB
NHL Slapshot,7.6,EA Sports,EA Sports,NHL Slapshot (USA).iso,4.4 GiB,570.6 GiB
Order Up!,7.6,SuperVillain Studios,Zoo Games,Order Up! (USA) (Rev 1).iso,4.4 GiB,575.0 GiB
Phantom Brave,7.6,Nippon Ichi Software,NIS America,Phantom Brave Wii (Japan).iso,4.4 GiB,579.4 GiB
Phineas and Ferb: Across the 2nd Dimension,7.6,High Impact Games,Disney Interactive Studios,Disney Phineas and Ferb - Across the 2nd Dimension (USA).iso,4.4 GiB,583.8 GiB
Rayman Raving Rabbids,7.6,Ubisoft Montpellier,Ubisoft,"Rayman - Raving Rabbids (USA) (En,Fr,Es) (Rev 2).iso",4.4 GiB,588.1 GiB
Resident Evil (Remake),7.6,Capcom,Capcom,,,
Scooby-Doo! and the Spooky Swamp,7.6,Torus Games,Warner Bros. Interactive Entertainment,"Scooby-Doo! and the Spooky Swamp (USA) (En,Fr,Es).iso",4.4 GiB,592.5 GiB
Strong Bad's Cool Game for Attractive People Episode 1: Homestar Ruiner,7.6,Telltale Games,Telltale Games,Strong Bad's Cool Game for Attractive People - Episode 1 - Homestar Ruiner (USA) (WiiWare).wad,43.6 MiB,592.6 GiB
Disney/Pixar Toy Story 3,7.6,Avalanche Software,Disney Interactive Studios,"Disney-Pixar Toy Story 3 (USA) (En,Fr,Es) (Toy Box Special Edition).iso",4.4 GiB,596.9 GiB
Wii Sports,7.6,Nintendo,Nintendo,Wii Sports (USA) (Rev 1).iso,4.4 GiB,601.3 GiB
Battalion Wars 2,7.5,Kuju Entertainment,Nintendo,Battalion Wars 2 (USA).iso,4.4 GiB,605.7 GiB
Bit.Trip Fate,7.5,Gaijin Games,Aksys Games,Bit. Trip Fate (USA) (WiiWare).wad,44.7 MiB,605.7 GiB
Bonsai Barber,7.5,Zoonami Ltd.,Nintendo,Bonsai Barber (USA) (WiiWare).wad,19.5 MiB,605.8 GiB
Elebits,7.5,Konami,Konami,Elebits (USA).iso,4.4 GiB,610.1 GiB
FIFA Soccer 10,7.5,EA Sports,Electronic Arts,"FIFA Soccer 13 (USA) (En,Fr,Es).iso",4.4 GiB,614.5 GiB
Groovin' Blocks,7.5,Empty Clip Studios,Empty Clip Studios,"Groovin' Blocks (USA) (En,Fr,Es).iso",4.4 GiB,618.9 GiB
Guilty Gear XX Accent Core,7.5,Arc System Works,Aksys Games,Guilty Gear XX Accent Core (USA).iso,4.4 GiB,623.3 GiB
Ice Age: Dawn Of The Dinosaurs,7.5,Activision,Activision,"Ice Age - Dawn of the Dinosaurs (USA) (En,Fr).iso",4.4 GiB,627.6 GiB
Madden NFL 11,7.5,EA Tiburon,Electronic Arts,Madden NFL 11 (USA) (Rev 1).iso,4.4 GiB,632.0 GiB
Resident Evil: The Darkside Chronicles,7.5,Cavia Inc.,Capcom,Resident Evil - The Darkside Chronicles (USA).iso,4.4 GiB,636.4 GiB
Resident Evil: The Umbrella Chronicles,7.5,Cavia Inc.,Capcom,Resident Evil - The Umbrella Chronicles (USA).iso,4.4 GiB,640.8 GiB
"Sakura Wars: So Long, My Love",7.5,Idea Factory,NIS America,"Sakura Wars - So Long, My Love (USA).iso",7.9 GiB,648.7 GiB
Spider-Man: Shattered Dimensions,7.5,Beenox,Activision,Spider-Man - Shattered Dimensions (USA).iso,4.4 GiB,653.1 GiB
We Love Golf!,7.5,Camelot Software Planning,Capcom,"We Love Golf! (USA) (En,Fr,Es).iso",4.4 GiB,657.5 GiB
Broken Sword: Shadow of the Templars,7.4,Revolution Software,Ubisoft,"Broken Sword - Shadow of the Templars - The Director's Cut (USA) (En,Fr,Es).iso",4.4 GiB,661.8 GiB
Dive: The Medes Islands Secret,7.4,Over the Top Games,Cosmonaut Games,Dive - The Medes Islands Secret (USA) (WiiWare).wad,35.6 MiB,661.9 GiB
Guitar Hero: Smash Hits,7.4,Beenox,Activision,"Guitar Hero - Smash Hits (USA) (En,Fr).iso",4.4 GiB,666.2 GiB
Ivy the Kiwi?,7.4,Prope,XSEED Games,"Ivy the Kiwi (USA) (En,Fr,Es).iso",4.4 GiB,670.6 GiB
Just Dance 2,7.4,Ubisoft,Ubisoft,"Just Dance 2 (USA) (En,Fr,Es) (Best Buy Edition).iso",4.4 GiB,675.0 GiB
Just Dance 3,7.4,Ubisoft,Ubisoft,"Just Dance 3 (USA) (En,Fr,Es) (Target Exclusive Edition) (Rev 1).iso",4.4 GiB,679.4 GiB
Just Dance 4,7.4,Ubisoft,Ubisoft,"Just Dance 4 (USA) (En,Fr,Es).iso",4.4 GiB,683.8 GiB
LEGO Batman: The Videogame,7.4,Traveller's Tales,Warner Bros. Interactive Entertainment,"LEGO Batman - The Videogame (USA) (En,Fr,Es).iso",4.4 GiB,688.1 GiB
LIT,7.4,WayForward,WayForward,LIT (USA) (WiiWare).wad,32.6 MiB,688.2 GiB
Marble Saga: Kororinpa,7.4,Hudson Entertainment,Konami,"Marble Saga - Kororinpa (USA) (En,Fr,Es).iso",4.4 GiB,692.5 GiB
Naruto: Clash of Ninja Revolution,7.4,Eighting,Tomy Corporation,Naruto - Clash of Ninja Revolution (USA).iso,4.4 GiB,696.9 GiB
Naruto Shippuden: Clash of Ninja Revolution III,7.4,Eighting,Tomy Corporation,Naruto Shippuden - Clash of Ninja Revolution III (USA).iso,4.4 GiB,701.3 GiB
Sam & Max: Save the World,7.4,Telltale Games,The Adventure Company,,,
Samurai Shodown Anthology,7.4,SNK Playmore,SNK Playmore,Samurai Shodown Anthology (USA).iso,4.4 GiB,705.7 GiB
SSX Blur,7.4,EA Montreal,EA Sports Big,"SSX Blur (USA) (En,Fr).iso",4.4 GiB,710.1 GiB
Super Monkey Ball: Banana Blitz,7.4,Sega,Sega,Super Monkey Ball - Banana Blitz (USA).iso,4.4 GiB,714.4 GiB
The Biggest Loser,7.4,Blitz Games,THQ,"Biggest Loser, The (USA).iso",4.4 GiB,718.8 GiB
The Sky Crawlers: Innocent Aces,7.4,Access Games,XSEED Games,"Sky Crawlers, The - Innocent Aces (USA) (En,Fr,Es).iso",4.4 GiB,723.2 GiB
TrackMania: Build to Race,7.4,Firebrand Games,City Interactive,"TrackMania - Build to Race (USA) (En,Fr,Es).iso",4.4 GiB,727.6 GiB
Vampire Crystals,7.4,Shanblue Interactive,Shanblue Interactive,Vampire Crystals (USA) (WiiWare).wad,39.4 MiB,727.6 GiB
WWE '12,7.4,Yuke's,THQ,"WWE '12 (USA) (En,Fr,Es).iso",4.4 GiB,732.0 GiB
WWE '13,7.4,Yuke's,THQ,"WWE '13 (USA) (En,Fr,Es).iso",4.4 GiB,736.4 GiB
Animal Crossing: City Folk,7.3,Nintendo,Nintendo,"Animal Crossing - City Folk (USA, Asia) (En,Fr,Es) (Rev 1).iso",4.4 GiB,740.7 GiB
Art Style: CUBELLO,7.3,Nintendo,Nintendo,Art Style - CUBELLO (USA) (WiiWare).wad,12.9 MiB,740.7 GiB
Dance Dance Revolution Hottest Party,7.3,Konami,Konami,Dance Dance Revolution - Hottest Party (USA).iso,4.4 GiB,745.1 GiB
Disney Epic Mickey,7.3,Junction Point,Disney Interactive Studios,"Disney Epic Mickey (USA) (En,Fr,Es).iso",4.4 GiB,749.5 GiB
Dokapon Kingdom,7.3,Sting,Atlus,Dokapon Kingdom (USA).iso,4.4 GiB,753.9 GiB
FAST - Racing League,7.3,Shin'en,Shin'en,FAST - Racing League (USA) (WiiWare).wad,44.3 MiB,753.9 GiB
FIFA Soccer 11,7.3,EA Sports,Electronic Arts,"FIFA Soccer 11 (USA) (En,Fr,Es).iso",4.4 GiB,758.3 GiB
Final Fantasy Crystal Chronicles: My Life as a Darklord,7.3,Square Enix,Square Enix,Final Fantasy Crystal Chronicles - My Life as a Darklord (USA) (WiiWare) (DLC).wad,4.7 MiB,758.3 GiB
Flowerworks,7.3,Nocturnal Entertainment,Nocturnal Entertainment,Flowerworks (USA) (WiiWare).wad,18.4 MiB,758.3 GiB
Guitar Hero: Aerosmith,7.3,Neversoft Entertainment,Activision,"Guitar Hero - Aerosmith (USA) (En,Fr).iso",4.4 GiB,762.7 GiB
LEGO Pirates of the Caribbean: The Video Game,7.3,Traveller's Tales,Disney Interactive Studios,"LEGO Pirates of the Caribbean - The Video Game (USA) (En,Fr,Es) (Rev 1).iso",4.4 GiB,767.1 GiB
