title,score,developer,publisher,rom_name,size,running_total
Mario Party 9,7.3,Nd Cube,Nintendo,"Mario Party 8 (USA, Asia) (Rev 2).iso",4.4 GiB,771.4 GiB
Marvel: Ultimate Alliance,7.3,Raven Software,Activision,Marvel - Ultimate Alliance (USA).iso,4.4 GiB,775.8 GiB
Medal of Honor Heroes 2,7.3,EA Canada,Electronic Arts,Medal of Honor - Heroes 2 (USA).iso,4.4 GiB,780.2 GiB
Metal Slug Anthology,7.3,Terminal Reality,SNK Playmore,Metal Slug Anthology (USA).iso,4.4 GiB,784.6 GiB
Monster Lab,7.3,Backbone Entertainment,Eidos Interactive,"Monster Lab (USA) (En,Fr,Es).iso",4.4 GiB,789.0 GiB
Pandora's Tower,7.3,Ganbarion,XSEED Games,"Pandora's Tower (USA) (En,Fr,Es).iso",4.4 GiB,793.3 GiB
Rayman Raving Rabbids: TV Party,7.3,Ubisoft Paris,Ubisoft,"Rayman - Raving Rabbids - TV Party (USA) (En,Fr,Es) (Rev 1).iso",4.4 GiB,797.7 GiB
SNK Arcade Classics Vol. 1,7.3,SNK Playmore,SNK Playmore,SNK Arcade Classics Vol. 1 (USA).iso,4.4 GiB,802.1 GiB
The Sims 2: Castaway,7.3,Maxis,Electronic Arts,"Sims 2, The - Castaway (USA).iso",4.4 GiB,806.5 GiB
ThruSpace,7.3,Keys Factory,Nintendo,ThruSpace (USA) (WiiWare).wad,11.3 MiB,806.5 GiB
Tomb Raider: Anniversary,7.3,Crystal Dynamics,Eidos Interactive,"Lara Croft Tomb Raider - Anniversary (USA) (En,Fr,Es).iso",4.4 GiB,810.9 GiB
TV Show King 2,7.3,Gameloft,Gameloft,TV Show King 2 (USA) (WiiWare).wad,46.3 MiB,810.9 GiB
Virtua Tennis 2009,7.3,Sumo Digital,Sega,"Virtua Tennis 2009 (USA) (En,Fr,Es).iso",4.4 GiB,815.3 GiB
WarioWare D.I.Y. Showcase,7.3,Intelligent Systems,Nintendo,WarioWare D.I.Y. Showcase (USA) (WiiWare).wad,13.9 MiB,815.3 GiB
Water Warfare,7.3,Hudson Soft,Hudson Soft,Water Warfare (USA) (WiiWare).wad,37.7 MiB,815.3 GiB
Yu-Gi-Oh! 5D's Wheelie Breakers,7.3,Konami,Konami,Yu-Gi-Oh! 5D's - Wheelie Breakers (USA).iso,4.4 GiB,819.7 GiB
chick chick BOOM,7.2,Tons of Bits,Tons of Bits,Chick Chick BOOM (USA) (WiiWare).wad,26.6 MiB,819.7 GiB
Deadly Creatures,7.2,Rainbow Studios,THQ,"Deadly Creatures (USA) (En,Fr,Es).iso",4.4 GiB,824.1 GiB
Disney's Chicken Little: Ace in Action,7.2,DC Studios,Buena Vista Games,Disney's Chicken Little - Ace in Action (USA).iso,4.4 GiB,828.5 GiB
Dr. Mario Online RX,7.2,Arika,Nintendo,Dr. Mario Online Rx (USA) (v256) (WiiWare).wad,15.0 MiB,828.5 GiB
Dragon Ball Z: Budokai Tenkaichi 2,7.2,Spike,Atari SA,Dragon Ball Z - Budokai Tenkaichi 3 (USA) (Rev 1).iso,4.4 GiB,832.9 GiB
Dragon Ball Z: Budokai Tenkaichi 3,7.2,Spike,Atari SA,Dragon Ball Z - Budokai Tenkaichi 3 (USA) (Rev 1).iso,4.4 GiB,837.3 GiB
Endless Ocean,7.2,Arika,Nintendo,"Endless Ocean (USA) (En,Fr,Es).iso",4.4 GiB,841.6 GiB
Excite Truck,7.2,Monster Games Inc.,Nintendo,Excite Truck (USA).iso,4.4 GiB,846.0 GiB
Lego Indiana Jones 2: The Adventure Continues,7.2,Traveller's Tales,LucasArts,"LEGO Indiana Jones 2 - The Adventure Continues (USA) (En,Fr,Es) (Rev 1).iso",4.4 GiB,850.4 GiB
Mario & Sonic at the Olympic Winter Games,7.2,Sega Sports R&D,Sega,"Mario & Sonic at the Olympic Winter Games (USA) (En,Ja,Fr,Es).iso",4.4 GiB,854.8 GiB
Mushroom Men: The Spore Wars,7.2,Red Fly Studio,SouthPeak Games,"Mushroom Men - The Spore Wars (USA) (En,Fr,Es).iso",4.4 GiB,859.1 GiB
Naruto: Clash of Ninja Revolution 2,7.2,Eighting,Tomy Corporation,"Naruto - Clash of Ninja Revolution 2 (USA) (En,Fr,Es).iso",4.4 GiB,863.5 GiB
Rock N' Roll Climber,7.2,Vitei,Nintendo,Rock N' Roll Climber (USA) (WiiWare).wad,18.1 MiB,863.5 GiB
ShadowPlay,7.2,Deep Fried Entertainment,Deep Fried Entertainment,ShadowPlay (USA) (WiiWare).wad,30.8 MiB,863.6 GiB
Shaun White Snowboarding: World Stage,7.2,Ubisoft,Ubisoft,"Shaun White Snowboarding - World Stage (USA) (En,Fr,Es).iso",4.4 GiB,867.9 GiB
Super Swing Golf,7.2,Ntreev Soft,Tecmo,Super Swing Golf (USA).iso,4.4 GiB,872.3 GiB
Tetris Party Deluxe,7.2,"Tetris Online, Inc",Majesco,"Tetris Party Deluxe (USA) (En,Fr,Es).iso",4.4 GiB,876.7 GiB
Tiger Woods PGA Tour 08,7.2,EA Salt Lake,EA Sports,Tiger Woods PGA Tour 10 (USA) (Rev 1).iso,4.4 GiB,881.1 GiB
WWE SmackDown vs. Raw 2011,7.2,Yuke's,THQ,"WWE SmackDown vs. Raw 2011 (USA) (En,Fr,Es).iso",4.4 GiB,885.5 GiB
Arkanoid Plus!,7.1,Taito Corporation,Square Enix,Arkanoid Plus! (USA) (WiiWare) (DLC).wad,192.5 KiB,885.5 GiB
Death Jr.: Root of Evil,7.1,Backbone Entertainment,Eidos Interactive,"Death Jr. - Root of Evil (USA) (En,Fr,Es).iso",4.4 GiB,889.8 GiB
Magnetis,7.1,Yullaby,Yullaby,Magnetis (USA) (WiiWare).wad,18.0 MiB,889.8 GiB
Mortal Kombat: Armageddon,7.1,Midway,Midway,Mortal Kombat - Armageddon (USA).iso,4.4 GiB,894.2 GiB
Mr. Driller W,7.1,Bandai Namco Games,Namco Bandai Games,Mr. Driller W (USA) (WiiWare).wad,19.4 MiB,894.2 GiB
Phoenix Wright: Ace Attorney - Justice for All,7.1,Capcom,Capcom,Phoenix Wright - Ace Attorney Justice for All (USA) (WiiWare).wad,34.9 MiB,894.3 GiB
Pictionary (2010),7.1,Page 44 Studios,THQ,"Pictionary (USA) (En,Fr,Es).iso",4.4 GiB,898.7 GiB
Puzzle Quest: Challenge of the Warlords,7.1,1st Playable Productions,D3Publisher,Puzzle Quest - Challenge of the Warlords (USA).iso,4.4 GiB,903.0 GiB
Scarface: The World Is Yours,7.1,Radical Entertainment,Vivendi Games,Scarface - The World Is Yours (USA).iso,4.4 GiB,907.4 GiB
Sega Superstars Tennis,7.1,Sumo Digital,Sega,"Sega Superstars Tennis (USA) (En,Fr,Es).iso",4.4 GiB,911.8 GiB
Shiren the Wanderer,7.1,ChunSoft,Atlus,Shiren the Wanderer (USA).iso,4.4 GiB,916.2 GiB
Sniper Elite,7.1,Rebellion,Namco,"Sniper Elite (USA) (En,Fr,Es).iso",4.4 GiB,920.5 GiB
Spectrobes: Origins,7.1,Genki,Disney Interactive Studios,Spectrobes - Origins (USA).iso,4.4 GiB,924.9 GiB
Star Wars: The Force Unleashed,7.1,LucasArts,LucasArts,"Star Wars - The Force Unleashed (USA) (En,Fr).iso",4.4 GiB,929.3 GiB
Star Wars: The Force Unleashed II,7.1,LucasArts,LucasArts,"Star Wars - The Force Unleashed II (USA) (En,Fr,Es).iso",4.4 GiB,933.7 GiB
The Munchables,7.1,Now Production,Namco Bandai Games,"Munchables, The (USA) (En,Fr,Es).iso",4.4 GiB,938.0 GiB
Tiger Woods PGA Tour 07,7.1,EA Redwood Shores,EA Sports,Tiger Woods PGA Tour 10 (USA) (Rev 1).iso,4.4 GiB,942.4 GiB
Tornado Outbreak,7.1,Loose Cannon Studios,Konami,"Tornado Outbreak (USA) (En,Fr,Es).iso",4.4 GiB,946.8 GiB
uDraw Studio,7.1,THQ,THQ,"uDraw Studio (USA) (En,Fr,Es).iso",4.4 GiB,951.2 GiB
2010 FIFA World Cup South Africa,7.0,Electronic Arts,EA Sports,"2010 FIFA World Cup South Africa (USA) (En,Es).iso",4.4 GiB,955.6 GiB
Art Style: ROTOHEX,7.0,Nintendo,Nintendo,Art Style - ROTOHEX (USA) (WiiWare).wad,20.4 MiB,955.6 GiB
Batman: The Brave and the Bold - The Videogame,7.0,WayForward,Warner Bros. Interactive Entertainment,"Batman - The Brave and the Bold - The Videogame (USA) (En,Fr,Es).iso",4.4 GiB,960.0 GiB
Bejeweled 2,7.0,PopCap,PopCap,Bejeweled 2 (USA) (WiiWare).wad,19.8 MiB,960.0 GiB
Block Breaker Deluxe,7.0,Gameloft,Gameloft,Block Breaker Deluxe (USA) (WiiWare).wad,35.8 MiB,960.0 GiB
Bust-A-Move Plus!,7.0,Taito Corporation,Square Enix,Bust-a-Move Plus! (USA) (WiiWare) (DLC).wad,147.8 KiB,960.0 GiB
Call of Duty: Modern Warfare 3,7.0,Infinity Ward,Activision,Call of Duty - Modern Warfare 3 (USA).iso,4.4 GiB,964.4 GiB
Crash: Mind Over Mutant,7.0,Radical Entertainment,Activision,"Crash - Mind over Mutant (USA) (En,Fr).iso",4.4 GiB,968.8 GiB
Excitebike: World Rally,7.0,Monster Games Inc.,Nintendo,Excitebike - World Rally (USA) (v512) (WiiWare).wad,28.7 MiB,968.8 GiB
FIFA Soccer 12,7.0,Electronic Arts,Electronic Arts,"FIFA Soccer 12 (USA) (En,Fr,Es).iso",4.4 GiB,973.2 GiB
Heron: Steam Machine,7.0,Triangle Studios,Triangle Studios,Heron - Steam Machine (USA) (WiiWare).wad,21.3 MiB,973.2 GiB
Jett Rocket,7.0,Shin'en,Shin'en,Jett Rocket (USA) (WiiWare).wad,43.3 MiB,973.2 GiB
DreamWorks Kung Fu Panda,7.0,"Luxoflux, Inc.",Activision,"DreamWorks Kung Fu Panda (USA) (En,Fr).iso",4.4 GiB,977.6 GiB
Lego Rock Band,7.0,TT Fusion,Warner Bros. Interactive Entertainment,"LEGO Rock Band (USA) (En,Fr,Es).iso",4.4 GiB,982.0 GiB
Let's TAP,7.0,Prope,Sega,"Let's Tap (USA) (En,Fr,Es).iso",4.4 GiB,986.4 GiB
Little League World Series Baseball 2008,7.0,Now Production,Activision,Little League World Series Baseball 2008 (USA).iso,4.4 GiB,990.7 GiB
Magnetica Twist,7.0,Mitchell,Nintendo,Magnetica Twist (USA) (WiiWare).wad,18.4 MiB,990.8 GiB
Monopoly (2008),7.0,Electronic Arts,Electronic Arts,"Monopoly (USA) (En,Fr,Es).iso",4.4 GiB,995.1 GiB
MX vs. ATV Untamed,7.0,Rainbow Studios,THQ,MX vs. ATV Untamed (USA).iso,4.4 GiB,999.5 GiB
NASCAR Kart Racing,7.0,Electronic Arts,Electronic Arts,NASCAR Kart Racing (USA).iso,4.4 GiB,1003.9 GiB
Pearl Harbor Trilogy - 1941: Red Sun Rising,7.0,Arcade Moon,Legendo Entertainment,Pearl Harbor - Episode 1 - Red Sun Rising (USA) (WiiWare).wad,40.8 MiB,1003.9 GiB
Prince of Persia Rival Swords,7.0,Ubisoft Montreal,Ubisoft,"Prince of Persia - Rival Swords (USA) (En,Fr,Es).iso",4.4 GiB,1008.3 GiB
Rogue Trooper: Quartz Zone Massacre,7.0,Rebellion,Graffiti Entertainment,"Rogue Trooper - Quartz Zone Massacre (USA) (En,Fr,Es).iso",4.4 GiB,1012.7 GiB
Secret Files 2: Puritas Cordis,7.0,Animation Arts,Deep Silver,"Secret Files 2 - Puritas Cordis (Europe) (En,Fr,De,Es,It).iso",4.4 GiB,1017.1 GiB
Skate It,7.0,Electronic Arts,Electronic Arts,"Skate It (USA) (En,Fr,Es).iso",4.4 GiB,1021.4 GiB
Super Mario All-Stars,7.0,Nintendo,Nintendo,Super Mario All-Stars (USA).iso,4.4 GiB,1.0 TiB
Super Swing Golf Season 2,7.0,Tecmo,Tecmo,Super Swing Golf Season 2 (USA).iso,4.4 GiB,1.0 TiB
Tenchu: Shadow Assassins,7.0,Acquire,Ubisoft,"Tenchu - Shadow Assassins (USA) (En,Fr,Es).iso",4.4 GiB,1.0 TiB
The Dog Island,7.0,Yuke's,Ubisoft,"Wing Island (USA) (En,Fr,Es).iso",4.4 GiB,1.0 TiB
The King of Fighters Collection: The Orochi Saga,7.0,M2,SNK Playmore,"King of Fighters Collection, The - The Orochi Saga (USA).iso",4.4 GiB,1.0 TiB
The Kore Gang,7.0,Snap Dragon Games,Atari SA,"Kore Gang, The (Europe) (En,Fr,De,Es).iso",4.4 GiB,1.0 TiB
Thrillville: Off the Rails,7.0,Frontier Developments,LucasArts,Thrillville - Off the Rails (USA).iso,4.4 GiB,1.0 TiB
Tomb Raider: Underworld,7.0,Crystal Dynamics,Eidos Interactive,"Tomb Raider - Underworld (USA) (En,Fr,Es).iso",4.4 GiB,1.0 TiB
Active Life: Outdoor Challenge,6.9,h.a.n.d. Inc.,Namco Bandai Games,"Active Life - Outdoor Challenge (USA) (En,Fr).iso",4.4 GiB,1.0 TiB
Alice in Wonderland (2010),6.9,Etranges Libellules,Disney Interactive Studios,"Disney Alice in Wonderland (USA) (En,Fr,Es).iso",4.4 GiB,1.0 TiB
Call of Duty 3,6.9,Treyarch,Activision,Call of Duty 3 (USA).iso,4.4 GiB,1.0 TiB
Disney/Pixar Cars 2,6.9,Avalanche Software,Disney Interactive Studios,"Disney-Pixar Cars 2 (USA) (En,Fr,Es).iso",4.4 GiB,1.0 TiB
Crash of the Titans,6.9,Radical Entertainment,Sierra Entertainment,Crash of the Titans (USA).iso,4.4 GiB,1.1 TiB
Dance Dance Revolution: Hottest Party 2,6.9,Konami,Konami,Dance Dance Revolution - Hottest Party 2 (USA).iso,4.4 GiB,1.1 TiB
Disaster: Day of Crisis,6.9,Monolith Soft,Nintendo,Disaster - Day of Crisis (Japan).iso,4.4 GiB,1.1 TiB
Disney G-Force,6.9,Eurocom,Disney Interactive Studios,"Disney G-Force (USA) (En,Fr,Es).iso",4.4 GiB,1.1 TiB
DreamWorks Monsters vs. Aliens,6.9,Beenox,Activision,"DreamWorks Monsters vs. Aliens (USA) (En,Fr).iso",4.4 GiB,1.1 TiB
F1 2009,6.9,Sumo Digital,Codemasters,"F1 2009 (USA) (En,Fr,Es).iso",4.4 GiB,1.1 TiB
Final Fantasy IV: The After Years,6.9,Matrix Software,Square Enix,Final Fantasy IV - The After Years (USA) (WiiWare) (DLC).wad,5.2 MiB,1.1 TiB
Fishing Resort,6.9,Prope,XSEED Games,Fishing Resort (USA).iso,4.4 GiB,1.1 TiB
Ghost Squad,6.9,Polygon Magic,Sega,Ghost Squad (USA).iso,4.4 GiB,1.1 TiB
Gradius ReBirth,6.9,M2,Konami,Gradius ReBirth (USA) (v257) (WiiWare).wad,29.0 MiB,1.1 TiB
Gyrostarr,6.9,High Voltage Software,High Voltage Software,Gyrostarr (USA) (WiiWare).wad,38.9 MiB,1.1 TiB
Harry Potter and the Order of the Phoenix,6.9,EA Games,EA Games,Harry Potter and the Order of the Phoenix (USA).iso,4.4 GiB,1.1 TiB
Harvest Moon: Magical Melody,6.9,Marvelous Entertainment,Natsume,Harvest Moon - Magical Melody (USA).iso,4.4 GiB,1.1 TiB
HoopWorld,6.9,Virtual Toys,Virtual Toys,HoopWorld (USA) (WiiWare).wad,43.5 MiB,1.1 TiB
Kororinpa: Marble Mania,6.9,Hudson,Konami,Kororinpa - Marble Mania (USA).iso,4.4 GiB,1.1 TiB
Mario Super Sluggers,6.9,Namco Bandai Games,Nintendo,"Mario Super Sluggers (USA) (En,Fr,Es).iso",4.4 GiB,1.1 TiB
Military Madness: Nectaris,6.9,Backbone Entertainment,Hudson Entertainment,Military Madness - Nectaris (USA) (WiiWare).wad,43.6 MiB,1.1 TiB
Need for Speed: Nitro,6.9,EA Montreal,EA Games,"Need for Speed - Nitro (USA) (En,Fr,Es).iso",4.4 GiB,1.1 TiB
NiGHTS: Journey of Dreams,6.9,Sonic Team,Sega,"Nights - Journey of Dreams (USA) (En,Ja,Fr,De,Es,It).iso",4.4 GiB,1.1 TiB
Sonic and the Secret Rings,6.9,Sonic Team,Sega,"Sonic and the Secret Rings (USA) (En,Ja,Fr,De,Es,It).iso",4.4 GiB,1.1 TiB
Speed Racer,6.9,Sidhe Interactive,Warner Bros. Interactive Entertainment,Speed Racer (Japan).iso,4.4 GiB,1.1 TiB
Tony Hawk's Downhill Jam,6.9,Toys for Bob,Activision,Tony Hawk's Downhill Jam (USA).iso,4.4 GiB,1.1 TiB
Art Style: Rotozoa,6.8,Skip Ltd.,Nintendo,Art Style - light trax (USA) (WiiWare).wad,21.5 MiB,1.1 TiB
Big Brain Academy: Wii Degree,6.8,Nintendo,Nintendo,"Big Brain Academy - Wii Degree (USA) (En,Fr,Es).iso",4.4 GiB,1.1 TiB
Chronos Twins DX,6.8,EnjoyUp Games,EnjoyUp Games,Chronos Twins DX (USA) (WiiWare).wad,37.5 MiB,1.1 TiB
Cloudy With a Chance of Meatballs,6.8,Ubisoft Shanghai,Ubisoft,"Cloudy with a Chance of Meatballs (USA) (En,Fr,Es).iso",4.4 GiB,1.1 TiB
Fortune Street,6.8,Marvelous AQL,Nintendo,Fortune Street (USA).iso,4.4 GiB,1.1 TiB
JumpStart: Escape From Adventure Island,6.8,Knowledge Adventure Inc.,Knowledge Adventure Inc.,JumpStart Escape from Adventure Island (USA).iso,4.4 GiB,1.1 TiB
Link's Crossbow Training,6.8,Nintendo,Nintendo,"Link's Crossbow Training (USA) (En,Fr,Es) (Rev 1).iso",4.4 GiB,1.1 TiB
Lost in Shadow,6.8,Hudson Soft,Hudson Soft,"Lost in Shadow (USA) (En,Fr,Es) (Rev 1).iso",4.4 GiB,1.1 TiB
My Word Coach,6.8,Ubisoft,Ubisoft,My Word Coach (USA).iso,4.4 GiB,1.2 TiB
MySims Racing,6.8,EA Games,EA Games,"MySims Racing (USA) (En,Fr,Es).iso",4.4 GiB,1.2 TiB
Overlord: Dark Legend,6.8,Climax Studios,Codemasters,"Overlord - Dark Legend (USA) (En,Fr,Es).iso",4.4 GiB,1.2 TiB
Pop 'Em Drop 'Em Samegame,6.8,Hudson Entertainment,Hudson Entertainment,"Pop 'Em, Drop 'Em SameGame (USA) (WiiWare).wad",9.2 MiB,1.2 TiB
Rockstar Games presents Table Tennis,6.8,Rockstar San Diego,Rockstar Games,Rockstar Games Presents Table Tennis (USA).iso,4.4 GiB,1.2 TiB
Samba de Amigo,6.8,Gearbox Software,Sega,"Samba de Amigo (USA) (En,Fr,Es).iso",4.4 GiB,1.2 TiB
Space Invaders Get Even,6.8,Taito Corporation,Square Enix,Space Invaders Get Even (USA) (WiiWare) (DLC).wad,45.8 MiB,1.2 TiB
Tales of Symphonia: Dawn of the New World,6.8,Bandai Namco Games,Namco Bandai Games,Tales of Symphonia - Dawn of the New World (USA).iso,4.4 GiB,1.2 TiB
The Bigs 2,6.8,Blue Castle Games,2K Sports,,,
Top Spin 3,6.8,Pam Development,2K Sports,"Top Spin 3 (USA) (En,Fr,Es).iso",4.4 GiB,1.2 TiB
Wii Party,6.8,Nd Cube,Nintendo,"Wii Party (USA) (En,Fr,Es).iso",4.4 GiB,1.2 TiB
WWE All Stars,6.8,THQ,THQ,"WWE All Stars (USA) (En,Fr,Es).iso",4.4 GiB,1.2 TiB
Castle of Shikigami III,6.7,Alfa System,Aksys Games,Castle of Shikigami III (USA).iso,4.4 GiB,1.2 TiB
Cursed Mountain,6.7,Deep Silver,Deep Silver,"Cursed Mountain (USA) (En,Fr,Es).iso",4.4 GiB,1.2 TiB
Defendin' DePenguin,6.7,Crave,Crave,"Defendin' De Penguin (USA) (En,Es).iso",4.4 GiB,1.2 TiB
Dewy's Adventure,6.7,Konami,Konami,Dewy's Adventure (USA).iso,4.4 GiB,1.2 TiB
Fragile Dreams: Farewell Ruins of the Moon,6.7,Tri-Crescendo,XSEED Games,"Fragile Dreams - Farewell Ruins of the Moon (USA) (En,Ja,Fr).iso",4.4 GiB,1.2 TiB
Guinness World Records: The Videogame,6.7,TT Fusion,Warner Bros. Interactive Entertainment,"Guinness World Records - The Videogame (USA) (En,Fr,Es).iso",4.4 GiB,1.2 TiB
Karaoke Revolution Glee: Volume 2,6.7,Konami,Konami,"Karaoke Revolution Glee - Volume 2 (USA) (En,Fr,Es) (Rev 1).iso",4.4 GiB,1.2 TiB
Mario & Sonic at the Olympic Games,6.7,Sega Sports R&D,Sega,"Mario & Sonic at the Olympic Games (USA) (En,Fr,Es).iso",4.4 GiB,1.2 TiB
MySims SkyHeroes,6.7,Electronic Arts,Electronic Arts,"MySims SkyHeroes (USA) (En,Fr,Es).iso",4.4 GiB,1.2 TiB
Nancy Drew: The White Wolf of Icicle Creek,6.7,Her Interactive,Her Interactive,Nancy Drew - The White Wolf of Icicle Creek (USA).iso,4.4 GiB,1.2 TiB
Need for Speed: Carbon,6.7,EA Canada,EA Games,Need for Speed - Carbon (USA).iso,4.4 GiB,1.2 TiB
Nerf N-Strike Elite,6.7,EA Salt Lake,Electronic Arts,Nerf N-Strike Elite (USA).iso,4.4 GiB,1.2 TiB
One Piece: Unlimited Adventure,6.7,Ganbarion,Namco Bandai Games,One Piece - Unlimited Adventure (Japan).iso,4.4 GiB,1.2 TiB
Phoenix Wright: Ace Attorney,6.7,Capcom,Capcom,Phoenix Wright - Ace Attorney (USA) (WiiWare) (DLC).wad,77.5 KiB,1.2 TiB
Phoenix Wright: Ace Attorney - Trials and Tribulations,6.7,Capcom,Capcom,Phoenix Wright - Ace Attorney Trials and Tribulations (USA) (WiiWare).wad,36.1 MiB,1.2 TiB
Rayman Raving Rabbids 2,6.7,Ubisoft Montpellier,Ubisoft,"Rayman - Raving Rabbids (USA) (En,Fr,Es) (Rev 2).iso",4.4 GiB,1.2 TiB
Real Heroes: Firefighter,6.7,Epicenter Studios,Conspiracy Entertainment,"Real Heroes - Firefighter (USA) (En,Fr,Es).iso",4.4 GiB,1.2 TiB
Roogoo: Twisted Towers,6.7,SpiderMonk,SouthPeak Games,"Roogoo - Twisted Towers (USA) (En,Fr,Es).iso",4.4 GiB,1.3 TiB
SimCity Creator,6.7,Electronic Arts,EA Games,"SimCity Creator (USA) (En,Fr,Es).iso",4.4 GiB,1.3 TiB
Spaceball: Revolution,6.7,Virtual Toys,Virtual Toys,Spaceball Revolution (USA) (WiiWare).wad,42.9 MiB,1.3 TiB
Teenage Mutant Ninja Turtles: Smash-Up,6.7,Game Arts,Ubisoft,"Teenage Mutant Ninja Turtles - Smash-Up (USA) (En,Fr,De,Es,It).iso",4.4 GiB,1.3 TiB
Trivial Pursuit,6.7,EA Bright Light,Electronic Arts,"Trivial Pursuit (USA) (En,Fr).iso",4.4 GiB,1.3 TiB
We Ski,6.7,Bandai Namco Games,Namco Bandai Games,"We Ski (USA) (En,Fr,Es).iso",4.4 GiB,1.3 TiB
Abba: You Can Dance,6.6,Ubisoft,Ubisoft,"ABBA - You Can Dance (USA) (En,Fr,Es).iso",4.4 GiB,1.3 TiB
Another Code: R - A Journey into Lost Memories,6.6,Cing,Nintendo,"Another Code R - A Journey into Lost Memories (Europe) (En,Fr,De,Es,It).iso",4.4 GiB,1.3 TiB
Dance Dance Revolution: Hottest Party 3,6.6,Konami,Konami,Dance Dance Revolution - Hottest Party 3 (USA).iso,4.4 GiB,1.3 TiB
EA Playground,6.6,EA Canada,Electronic Arts,EA Playground (USA).iso,4.4 GiB,1.3 TiB
Final Fantasy Crystal Chronicles: The Crystal Bearers,6.6,Square Enix,Square Enix,"Final Fantasy Crystal Chronicles - The Crystal Bearers (USA) (En,Fr,Es).iso",4.4 GiB,1.3 TiB
High Voltage Hot Rod Show,6.6,High Voltage Software,High Voltage Software,High Voltage Hot Rod Show (USA) (WiiWare).wad,42.5 MiB,1.3 TiB
Ice Age 2: The Meltdown,6.6,Eurocom,Vivendi Games,Ice Age 2 - The Meltdown (USA).iso,4.4 GiB,1.3 TiB
Mario & Sonic at the London 2012 Olympic Games,6.6,Sega Sports R&D,Sega,"Mario & Sonic at the London 2012 Olympic Games (USA) (En,Ja,Fr,Es).iso",4.4 GiB,1.3 TiB
Midnight Pool,6.6,Gameloft,Gameloft,Midnight Pool (USA) (WiiWare).wad,41.9 MiB,1.3 TiB
Nerf N-Strike,6.6,EA Salt Lake,Electronic Arts,Nerf N-Strike (USA).iso,4.4 GiB,1.3 TiB
Octomania,6.6,Compile Heart,Conspiracy Entertainment,Octomania (USA).iso,4.4 GiB,1.3 TiB
Onslaught (2009),6.6,Hudson Entertainment,Hudson Entertainment,Onslaught (USA) (WiiWare).wad,42.3 MiB,1.3 TiB
Sonic Unleashed,6.6,Sonic Team,Sega,"Sonic Unleashed (USA) (En,Ja,Fr,De,Es,It).iso",4.4 GiB,1.3 TiB
Spyborgs,6.6,Bionic Games,Capcom,"Spyborgs (USA) (En,Fr,Es).iso",4.4 GiB,1.3 TiB
The Bigs,6.6,Blue Castle Games,2K Sports,,,
The House of the Dead 2 & 3 Return,6.6,Sega,Sega,"House of the Dead 2 & 3 Return, The (USA) (En,Fr,Es).iso",4.4 GiB,1.3 TiB
Transformers Prime: The Game,6.6,Now Production,Activision,"Transformers Prime - The Game (USA) (En,Fr).iso",4.4 GiB,1.3 TiB
Ultimate Shooting Collection,6.6,MileStone Inc.,UFO Interactive,Ultimate Shooting Collection (USA).iso,4.4 GiB,1.3 TiB
Vertigo (2009),6.6,Icon Games,Playlogic,"Vertigo (USA) (En,Fr,Es).iso",4.4 GiB,1.3 TiB
Viral Survival,6.6,PeakVox,NIS America,Viral Survival (USA) (WiiWare).wad,35.4 MiB,1.3 TiB
We Ski & Snowboard,6.6,Bandai Namco Games,Namco Bandai Games,"We Ski & Snowboard (USA) (En,Fr,Es).iso",4.4 GiB,1.3 TiB
Ben 10 Alien Force: Vilgax Attacks,6.5,Papaya Studio,D3Publisher,"Ben 10 - Alien Force - Vilgax Attacks (USA) (En,Fr,Es).iso",4.4 GiB,1.3 TiB
Cate West: The Vanishing Files,6.5,Destineer,Destineer,Cate West - The Vanishing Files (USA).iso,4.4 GiB,1.3 TiB
Def Jam Rapstar,6.5,4mm Games,Konami,"Def Jam - Rapstar (USA) (En,Fr,De,Es,It,Pt).iso",4.4 GiB,1.4 TiB
Defend Your Castle,6.5,XGenStudios,XGenStudios,Defend Your Castle (USA) (WiiWare).wad,22.5 MiB,1.4 TiB
Disney/Pixar Cars,6.5,Rainbow Studios,THQ,"Disney-Pixar Cars (USA) (En,Es).iso",4.4 GiB,1.4 TiB
Dragon Ball: Revenge of King Piccolo,6.5,Media.Vision,Namco Bandai Games,Dragon Ball - Revenge of King Piccolo (USA).iso,4.4 GiB,1.4 TiB
Dragon Quest Swords: The Masked Queen and the Tower of Mirrors,6.5,Genius Sonority Inc.,Square Enix,Dragon Quest Swords - The Masked Queen and the Tower of Mirrors (USA).iso,4.4 GiB,1.4 TiB
Ferrari Challenge Trofeo Pirelli,6.5,Eutechnyx,Activision,"Ferrari Challenge - Trofeo Pirelli (USA) (En,Fr).iso",4.4 GiB,1.4 TiB
FIFA 08 Soccer,6.5,EA Canada,EA Sports,"FIFA Soccer 13 (USA) (En,Fr,Es).iso",4.4 GiB,1.4 TiB
Grey's Anatomy: The Video Game,6.5,Longtail Studios,Ubisoft,"Grey's Anatomy - The Video Game (USA) (En,Fr,Es).iso",4.4 GiB,1.4 TiB
Harvest Moon: Tree of Tranquility,6.5,Marvelous Entertainment,Natsume,Harvest Moon - Tree of Tranquility (USA) (Rev 1).iso,4.4 GiB,1.4 TiB
Help Wanted: 50 Wacky Jobs,6.5,Hudson Soft,Hudson Entertainment,,,
Mario Power Tennis,6.5,Camelot Software Planning,Nintendo,"Mario Power Tennis (USA) (En,Fr,Es).iso",4.4 GiB,1.4 TiB
Monopoly Streets,6.5,Electronic Arts,Electronic Arts,"Monopoly Streets (USA) (En,Fr,Es).iso",4.4 GiB,1.4 TiB
Mystery Case Files: The Malgrave Incident,6.5,Sanzaru Games,Nintendo,Mystery Case Files - The Malgrave Incident (USA).iso,4.4 GiB,1.4 TiB
NHL 2K9,6.5,Visual Concepts,Take-Two Interactive,"NHL 2K9 (USA) (En,Fr,Es).iso",4.4 GiB,1.4 TiB
Nickelodeon Barnyard,6.5,Blue Tongue Entertainment,THQ,Nickelodeon Barnyard (USA).iso,4.4 GiB,1.4 TiB
Opoona,6.5,ArtePiazza,Koei,Opoona (USA).iso,4.4 GiB,1.4 TiB
Secret Files: Tunguska,6.5,Fusionsphere Systems,The Adventure Company,Secret Files - Tunguska (USA).iso,4.4 GiB,1.4 TiB
Sengoku Basara: Samurai Heroes,6.5,Capcom,Capcom,"Sengoku Basara - Samurai Heroes (USA) (En,Fr,Es).iso",4.4 GiB,1.4 TiB
Smarty Pants,6.5,Planet Moon Studios,Electronic Arts,,,
The Sims 2: Pets,6.5,Maxis,EA Games,"Sims 2, The - Pets (USA).iso",4.4 GiB,1.4 TiB
TV Show King,6.5,Gameloft,Gameloft,TV Show King (USA) (v256) (WiiWare).wad,39.8 MiB,1.4 TiB
Virtua Tennis 4,6.5,Sega,Sega,"Virtua Tennis 4 (USA) (En,Fr,Es).iso",4.4 GiB,1.4 TiB
Where the Wild Things Are,6.5,Griptonite Games,Warner Bros. Interactive Entertainment,"Where the Wild Things Are (USA) (En,Fr,Es).iso",4.4 GiB,1.4 TiB
Wild West Guns,6.5,Gameloft,Gameloft,Wild West Guns (USA) (WiiWare).wad,37.8 MiB,1.4 TiB
Zombie Panic in Wonderland,6.5,Akaoni Studio,Akaoni Studio,Zombie Panic in Wonderland (USA) (WiiWare).wad,19.4 MiB,1.4 TiB
A Monsteca Corral: Monsters vs. Robots,6.4,Onteca,Onteca,"Monsteca Corral, A - Monsters vs. Robots (USA) (WiiWare).wad",22.5 MiB,1.4 TiB
Academy of Champions: Soccer,6.4,Ubisoft Vancouver,Ubisoft,"Academy of Champions - Soccer (USA) (En,Fr,Es).iso",4.4 GiB,1.4 TiB
Alien Crush Returns,6.4,Tamsoft,Hudson Entertainment,Alien Crush Returns (USA) (WiiWare).wad,37.3 MiB,1.4 TiB
Arc Rise Fantasia,6.4,Imageepoch,Ignition Entertainment,Arc Rise Fantasia (USA).iso,4.4 GiB,1.4 TiB
Conduit 2,6.4,High Voltage Software,Sega,"Conduit 2 (USA) (En,Fr,Es).iso",4.4 GiB,1.4 TiB
Cranium Kabookii,6.4,Ubisoft Quebec,Ubisoft,"Cranium Kabookii (USA) (En,Fr,Es).iso",4.4 GiB,1.4 TiB
Disney Epic Mickey 2: The Power of Two,6.4,Blitz Games Studios,Disney Interactive Studios,"Disney Epic Mickey 2 - The Power of Two (USA) (En,Fr,Es,Pt).iso",4.4 GiB,1.5 TiB
Driver: San Francisco,6.4,Ubisoft Reflections,Ubisoft,"Driver - San Francisco (USA) (En,Fr,Es).iso",4.4 GiB,1.5 TiB
Final Fantasy Crystal Chronicles: Echoes of Time,6.4,Square Enix,Square Enix,"Final Fantasy Crystal Chronicles - Echoes of Time (USA) (En,Fr,Es).iso",4.4 GiB,1.5 TiB
Go Vacation,6.4,Namco Bandai Games,Namco Bandai Games,"Go Vacation (USA) (En,Fr,Es).iso",4.4 GiB,1.5 TiB
High School Musical: Sing It!,6.4,Artificial Mind and Movement,Disney Interactive Studios,"Disney High School Musical - Sing It! (USA) (En,Fr) (Rev 1).iso",4.4 GiB,1.5 TiB
lilt line,6.4,different cloth,Gaijin Games,Lilt Line (USA) (WiiWare).wad,45.4 MiB,1.5 TiB
Mario Sports Mix,6.4,Square Enix,Nintendo,"Mario Sports Mix (USA) (En,Fr,Es).iso",4.4 GiB,1.5 TiB
Need for Speed: The Run,6.4,EA Black Box,Electronic Arts,"Need for Speed - The Run (USA) (En,Fr,Es).iso",4.4 GiB,1.5 TiB
Pop,6.4,Nnooo,Nnooo,Pop (USA) (WiiWare).wad,21.0 MiB,1.5 TiB
Rubik's World,6.4,Two Tribes,The Game Factory,"Rubik's World (USA) (En,Fr,Es).iso",4.4 GiB,1.5 TiB
Sam & Max: Beyond Time and Space,6.4,Telltale Games,Microsoft Game Studios,"Sam & Max - Beyond Time and Space (USA) (En,Fr,Es).iso",4.4 GiB,1.5 TiB
Sid Meier's Pirates!,6.4,Firaxis Games,Atari SA,"Sid Meier's Pirates! (USA) (En,Fr,Es).iso",4.4 GiB,1.5 TiB
Star Soldier R,6.4,Hudson Soft,Hudson Soft,Star Soldier R (USA) (WiiWare).wad,24.4 MiB,1.5 TiB
Surf's Up,6.4,Ubisoft,Ubisoft,"Surf's Up (USA) (En,Fr,Es).iso",4.4 GiB,1.5 TiB
The Legend of Spyro: Dawn of the Dragon (2008),6.4,Etranges Libellules,Activision,"Legend of Spyro, The - Dawn of the Dragon (USA) (En,Fr,Es).iso",4.4 GiB,1.5 TiB
The Simpsons Game,6.4,EA Redwood Shores,EA Games,"Simpsons Game, The (USA).iso",4.4 GiB,1.5 TiB
We Cheer 2,6.4,"Machatin, Inc.",Namco Bandai Games,We Cheer 2 (USA).iso,4.4 GiB,1.5 TiB
