title,score,developer,publisher,rom_name,size,running_total
Racquet Sports,5.1,Asobo Studio,Ubisoft,Racquet Sports (USA).iso,4.4 GiB,2.2 TiB
Agatha Christie: And Then There Were None,5.0,AWE Games,The Adventure Company,Agatha Christie - And Then There Were None (USA).iso,4.4 GiB,2.2 TiB
Baroque,5.0,Sting,Atlus,Baroque (USA).iso,4.4 GiB,2.2 TiB
Disney Bolt,5.0,Avalanche Software,Disney Interactive Studios,"Disney Bolt (Scandinavia) (En,Sv,No,Da).iso",4.4 GiB,2.2 TiB
Disney/Pixar Brave,5.0,Disney Interactive Studios,Disney Interactive Studios,"Disney-Pixar Brave (USA) (En,Fr,Es).iso",4.4 GiB,2.2 TiB
Celebrity Sports Showdown,5.0,EA Canada,Electronic Arts,"Celebrity Sports Showdown (USA) (En,Fr,Es).iso",4.4 GiB,2.2 TiB
Deca Sports,5.0,CAProduction,Konami,"Deca Sports (USA) (En,Fr,Es) (Rev 1).iso",4.4 GiB,2.3 TiB
Guitar Hero: Van Halen,5.0,Neversoft Entertainment,Activision,"Guitar Hero - Van Halen (USA) (En,Fr).iso",4.4 GiB,2.3 TiB
Manic Monkey Mayhem,5.0,The Code Monkeys,The Code Monkeys,Manic Monkey Mayhem (USA) (WiiWare).wad,17.6 MiB,2.3 TiB
Marvel: Ultimate Alliance 2,5.0,Vicarious Visions,Activision,Marvel - Ultimate Alliance 2 (USA).iso,4.4 GiB,2.3 TiB
Need for Speed: Hot Pursuit,5.0,Criterion Games,Electronic Arts,"Need for Speed - Hot Pursuit (USA) (En,Fr,Es).iso",4.4 GiB,2.3 TiB
Potpourrii (2008),5.0,Abstraction Games,Abstraction Games,Potpourrii (USA) (WiiWare).wad,23.8 MiB,2.3 TiB
Robox (2010),5.0,DreamBox Games,DreamBox Games,Robox (USA) (WiiWare).wad,36.1 MiB,2.3 TiB
Shootanto: Evolutionary Mayhem,5.0,Grandprix Inc.,Hudson Entertainment,Shootanto - Evolutionary Mayhem (USA) (WiiWare).wad,44.2 MiB,2.3 TiB
The Hardy Boys: The Hidden Theft,5.0,Xpec,DreamCatcher Interactive,"Hardy Boys, The - The Hidden Theft (USA) (En,Fr,Es).iso",4.4 GiB,2.3 TiB
Twin Strike: Operation Thunder,5.0,Naps Team,Zoo Digital Publishing,"Twin Strike - Operation Thunder (USA) (En,Fr,Es).iso",4.4 GiB,2.3 TiB
Calling,4.9,Hudson Entertainment,Hudson Entertainment,"Calling (USA) (En,Fr,Es).iso",4.4 GiB,2.3 TiB
Castlevania Judgment,4.9,Eighting,Konami,Castlevania Judgment (USA).iso,4.4 GiB,2.3 TiB
CSI: Crime Scene Investigation: Hard Evidence,4.9,Telltale Games,Ubisoft,"CSI - Crime Scene Investigation - Hard Evidence (USA) (En,Fr,Es).iso",4.4 GiB,2.3 TiB
Deca Sports 2,4.9,CAProduction,Hudson,"Deca Sports 2 (USA) (En,Fr,Es).iso",4.4 GiB,2.3 TiB
Just Dance,4.9,Ubisoft Paris,Ubisoft,"Just Dance (USA) (En,Fr,Es).iso",4.4 GiB,2.3 TiB
Marvel Super Hero Squad,4.9,Blue Tongue Entertainment,THQ,"Marvel Super Hero Squad (USA) (En,Fr,Es) (Walmart).iso",4.4 GiB,2.3 TiB
Marvel Super Hero Squad: The Infinity Gauntlet,4.9,THQ,THQ,"Marvel Super Hero Squad - The Infinity Gauntlet (USA) (En,Fr).iso",4.4 GiB,2.3 TiB
My Horse & Me,4.9,W!Games,Atari SA,"My Horse & Me (USA) (En,Fr,Es).iso",4.4 GiB,2.3 TiB
Namco Museum Remix,4.9,TOSE,Namco Bandai Games,Namco Museum Remix (USA).iso,4.4 GiB,2.3 TiB
NCAA Football 09,4.9,EA Tiburon,Electronic Arts,NCAA Football 09 - All-Play (USA).iso,4.4 GiB,2.3 TiB
Neighborhood Games,4.9,Jet Black Games,THQ,Neighborhood Games (USA).iso,4.4 GiB,2.3 TiB
Ninja Reflex,4.9,Sanzaru Games,Electronic Arts,"Ninja Reflex (USA) (En,Fr,Es).iso",4.4 GiB,2.3 TiB
Nitrobike,4.9,Left Field Productions,Ubisoft,"Nitrobike (USA) (En,Fr,Es).iso",4.4 GiB,2.3 TiB
Open Season,4.9,Ubisoft,Ubisoft,"Open Season (USA) (En,Fr,Es).iso",4.4 GiB,2.3 TiB
Scene It? Twilight,4.9,Screenlife Games,Konami,"Scene It Twilight (USA) (En,Fr,Es).iso",4.4 GiB,2.3 TiB
Snowboard Riot,4.9,Hudson Soft,Hudson Entertainment,Snowboard Riot (USA) (WiiWare).wad,37.5 MiB,2.3 TiB
Star Trek: Conquest,4.9,4J Studios,Bethesda Softworks,Star Trek - Conquest (USA).iso,4.4 GiB,2.3 TiB
Disney/Pixar Toy Story Mania!,4.9,Papaya Studio,Disney Interactive Studios,"Disney-Pixar Toy Story Mania! (USA) (En,Fr,Es).iso",4.4 GiB,2.3 TiB
V.I.P. Casino Blackjack,4.9,High Voltage Software,High Voltage Software,V.I.P. Casino - Blackjack (USA) (WiiWare).wad,28.4 MiB,2.3 TiB
Alien Syndrome (2007),4.8,Totally Games,Sega,Alien Syndrome (USA).iso,4.4 GiB,2.4 TiB
Astro Boy: The Video Game,4.8,High Voltage Software,D3Publisher,"Astro Boy - The Video Game (USA) (En,Fr,Es).iso",4.4 GiB,2.4 TiB
Brave: A Warrior's Tale,4.8,Collision Studios,Evolved Games,"Brave - A Warrior's Tale (USA) (En,Fr,Es).iso",4.4 GiB,2.4 TiB
Dance on Broadway,4.8,Longtail Studios,Ubisoft,"Dance on Broadway (USA) (En,Fr,Es).iso",4.4 GiB,2.4 TiB
Family Slot Car Racing,4.8,Arc System Works,Aksys Games,Family Slot Car Racing (USA) (WiiWare).wad,42.8 MiB,2.4 TiB
Fishie Fishie,4.8,DK Games,DK Games,Fishie Fishie (USA) (WiiWare).wad,10.0 MiB,2.4 TiB
FlingSmash,4.8,Artoon,Nintendo,"FlingSmash (USA) (En,Fr,Es) (Rev 1).iso",4.4 GiB,2.4 TiB
Star Wars The Clone Wars: Republic Heroes,4.8,Krome Studios,LucasArts,"Star Wars - The Clone Wars - Republic Heroes (USA) (En,Fr,Es).iso",4.4 GiB,2.4 TiB
Bit Boy!!,4.7,Bplus,Bplus,Bit Boy!! (USA) (WiiWare).wad,13.8 MiB,2.4 TiB
Nickelodeon Dora the Explorer: Dora Saves the Snow Princess,4.7,High Voltage Software,Take-Two Interactive,"Nickelodeon Dora the Explorer - Dora Saves the Snow Princess (USA) (En,Fr) (Rev 1).iso",4.4 GiB,2.4 TiB
Flip's Twisted World,4.7,Frozen North Productions,Majesco,Flip's Twisted World (USA).iso,4.4 GiB,2.4 TiB
Frogger Returns,4.7,Hijinx Studios,Konami,Frogger Returns (USA) (WiiWare).wad,32.4 MiB,2.4 TiB
"Harry Potter and the Deathly Hallows, Part 2",4.7,EA Bright Light,Electronic Arts,"Harry Potter and the Deathly Hallows - Part 2 (USA) (En,Fr,Es).iso",4.4 GiB,2.4 TiB
Horrible Histories: Ruthless Romans,4.7,Virtual Identity,Graffiti Entertainment,"Horrible Histories - Ruthless Romans (Europe) (En,Fr,De,Es,It).iso",4.4 GiB,2.4 TiB
Indianapolis 500 Legends,4.7,Torus Games,Destineer,Indianapolis 500 Legends (USA).iso,4.4 GiB,2.4 TiB
My Pokemon Ranch,4.7,Ambrella,Nintendo,My Pokemon Ranch (USA) (v256) (WiiWare).wad,19.6 MiB,2.4 TiB
SpongeBob SquarePants featuring Nicktoons: Globs of Doom,4.7,Incinerator Games,THQ,"Nickelodeon SpongeBob SquarePants featuring Nicktoons - Globs of Doom (USA) (En,Fr).iso",4.4 GiB,2.4 TiB
Tom Clancy's HAWX 2,4.7,Ubisoft,Ubisoft,"Tom Clancy's H.A.W.X. 2 (USA) (En,Fr,Es).iso",4.4 GiB,2.4 TiB
Tony Hawk Ride,4.7,Robomodo,Activision,Tony Hawk - Ride (USA).iso,4.4 GiB,2.4 TiB
Wing Island,4.7,CAProduction,Hudson,"Wing Island (USA) (En,Fr,Es).iso",4.4 GiB,2.4 TiB
Agatha Christie: Evil Under the Sun,4.6,AWE Games,The Adventure Company,"Agatha Christie - Evil Under the Sun (USA) (En,Fr,Es).iso",4.4 GiB,2.4 TiB
All Star Karate,4.6,THQ,THQ,"All Star Karate (USA) (En,Fr,Es).iso",4.4 GiB,2.4 TiB
Arcade Sports,4.6,Icon Games,Icon Games,Arcade Sports (USA) (WiiWare).wad,32.7 MiB,2.4 TiB
Donkey Kong: Barrel Blast,4.6,Paon Corporation,Nintendo,Donkey Kong - Barrel Blast (USA).iso,4.4 GiB,2.4 TiB
Drill Sergeant Mindstrong,4.6,Hi Corp,XSEED Games,Drill Sergeant Mindstrong (USA) (WiiWare).wad,18.9 MiB,2.4 TiB
Family Pirate Party,4.6,Aksys Games,Aksys Games,Family Pirate Party (USA) (WiiWare) (DLC).wad,2.0 MiB,2.4 TiB
Gravitronix,4.6,Medaverse Studios,Medaverse Studios,Gravitronix (USA) (WiiWare).wad,19.1 MiB,2.4 TiB
Green Lantern: Rise of the Manhunters,4.6,Double Helix Games,Warner Bros. Interactive Entertainment,"Green Lantern - Rise of the Manhunters (USA) (En,Fr,Es,Pt).iso",4.4 GiB,2.4 TiB
GTI Club Supermini Festa!,4.6,Konami,Konami,"GTI Club Supermini Festa! (USA) (En,Fr).iso",4.4 GiB,2.4 TiB
Happy Feet,4.6,Artificial Mind and Movement,Midway,"Happy Feet (USA) (En,Fr).iso",4.4 GiB,2.4 TiB
Major Minor's Majestic March,4.6,NanaOn-Sha,Majesco,Major Minor's Majestic March (USA).iso,4.4 GiB,2.4 TiB
My Aquarium,4.6,Hudson Soft,Hudson Soft,My Aquarium (USA) (WiiWare).wad,31.9 MiB,2.4 TiB
Pirates vs Ninjas Dodgeball,4.6,Blazing Lizard,SouthPeak Games,"Pirates vs. Ninjas - Dodgeball (USA) (En,Fr,Es).iso",4.4 GiB,2.4 TiB
Rampage: Total Destruction,4.6,"Pipeworks Software, Inc.",Midway,Rampage - Total Destruction (USA).iso,4.4 GiB,2.4 TiB
Rock Revolution,4.6,Zoe Mode,Konami,"Rock Revolution (Europe) (En,Fr,De,Es,It,Sv,No,Da,Fi).iso",4.4 GiB,2.5 TiB
Summer Sports: Paradise Island,4.6,Destineer,Destineer,Summer Sports - Paradise Island (USA).iso,4.4 GiB,2.5 TiB
The Incredible Hulk (2008),4.6,Edge of Reality,Sega,"Incredible Hulk, The (USA) (En,Fr).iso",4.4 GiB,2.5 TiB
Tom Clancy's Ghost Recon (Wii),4.6,Next Level Games,Ubisoft,"Tom Clancy's Ghost Recon (USA) (En,Fr,Es).iso",4.4 GiB,2.5 TiB
World Series of Poker: Tournament of Champions,4.6,Left Field Productions,Activision,World Series of Poker - Tournament of Champions - 2007 Edition (USA).iso,4.4 GiB,2.5 TiB
3D Pixel Racing,4.5,Vidia,Microforum,3D Pixel Racing (USA) (WiiWare).wad,12.7 MiB,2.5 TiB
AquaSpace,4.5,Paon Corporation,Nintendo,AquaSpace (USA) (WiiWare).wad,23.1 MiB,2.5 TiB
Ben 10: Alien Force,4.5,Monkey Bar Games,D3Publisher,"Ben 10 - Alien Force (USA) (En,Fr,Es).iso",4.4 GiB,2.5 TiB
Brothers in Arms: Double Time,4.5,Gearbox Software,Ubisoft,"Brothers in Arms - Double Time (USA) (En,Fr,Es) (Disc 2) (Brothers in Arms - Earned in Blood).iso",8.8 GiB,2.5 TiB
Major League Eating: The Game,4.5,Sensory Sweep,Mastiff,Major League Eating - The Game (USA) (WiiWare).wad,32.2 MiB,2.5 TiB
Mart Racer,4.5,"Joju Games, Inc.","Joju Games, Inc.",Mart Racer (USA) (WiiWare).wad,27.1 MiB,2.5 TiB
Saban's Power Rangers Samurai,4.5,Inti Creates,Namco Bandai Games,"Power Rangers Samurai (USA) (En,Fr,Es).iso",4.4 GiB,2.5 TiB
Stop Stress: A Day of Fury,4.5,Abylight,Abylight,Stop Stress - A Day of Fury (USA) (WiiWare).wad,43.0 MiB,2.5 TiB
The Ant Bully,4.5,Artificial Mind and Movement,Midway,"Ant Bully, The (USA) (En,Fr).iso",4.4 GiB,2.5 TiB
Tournament of Legends,4.5,High Voltage Software,Sega Europe,Tournament of Legends (USA).iso,4.4 GiB,2.5 TiB
Wacky World of Sports,4.5,Tabot,Sega,"Wacky World of Sports (USA) (En,Fr,Es).iso",4.4 GiB,2.5 TiB
Big Beach Sports,4.4,HB Studios Multimedia,THQ,"Big Beach Sports (USA) (En,Fr,Es).iso",4.4 GiB,2.5 TiB
Gabrielle's Ghostly Groove: Monster Mix,4.4,Santa Entertainment,Natsume,Gabrielle's Ghostly Groove - Monster Mix (USA) (WiiWare).wad,45.4 MiB,2.5 TiB
Godzilla: Unleashed - Double Smash,4.4,"Pipeworks Software, Inc.",Atari SA,"Godzilla - Unleashed (USA) (En,Fr,Es).iso",4.4 GiB,2.5 TiB
Iron Man (2008),4.4,Secret Level,Sega,"Iron Man (USA) (En,Fr,Es) (Rev 1).iso",4.4 GiB,2.5 TiB
MotoGP 08,4.4,Milestone S.r.l,Capcom,"MotoGP (USA) (En,Fr,Es).iso",4.4 GiB,2.5 TiB
Niki: Rock 'n' Ball,4.4,Bplus,Bplus,Niki - Rock 'n' Ball (USA) (WiiWare).wad,18.7 MiB,2.5 TiB
Doc Clock: The Toasted Sandwich of Time,4.3,Stickmen Studios,Stickmen Studios,Doc Clock - The Toasted Sandwich of Time (USA) (WiiWare).wad,39.1 MiB,2.5 TiB
Fast Draw Showdown,4.3,Digital Leisure,Digital Leisure,Fast Draw Showdown (USA) (WiiWare).wad,47.2 MiB,2.5 TiB
Furu Furu Park,4.3,Taito Corporation,Majesco,Furu Furu Park (USA).iso,4.4 GiB,2.5 TiB
Six Flags Fun Park,4.3,7 Studios,Ubisoft,"Six Flags Fun Park (USA) (En,Fr) (Rev 1).iso",4.4 GiB,2.5 TiB
TNA iMPACT!,4.3,Midway Studios - Los Angeles,Midway,,,
Coraline,4.2,Papaya Studio,D3Publisher,"Coraline (USA) (En,Fr,Es).iso",4.4 GiB,2.5 TiB
Dancing with the Stars,4.2,Zoe Mode,Activision,Dancing with the Stars (USA).iso,4.4 GiB,2.5 TiB
Family Party: 30 Great Games,4.2,Tamsoft,D3Publisher,"Family Party - 30 Great Games (USA) (En,Fr,Es).iso",4.4 GiB,2.5 TiB
Iron Chef America: Supreme Cuisine,4.2,Black Lantern Studios,Destineer,Iron Chef America - Supreme Cuisine (USA).iso,4.4 GiB,2.5 TiB
NASCAR 2011: The Game,4.2,Eutechnyx,Activision,NASCAR 2011 - The Game (USA).iso,4.4 GiB,2.5 TiB
SPRay,4.2,EKO Software,Tecmo,SPRay (USA).iso,4.4 GiB,2.6 TiB
101-in-1 Sports Party Megamix,4.1,Nordcurrent,Atlus,"101-in-1 Sports Party Megamix (USA) (En,Fr,Es).iso",4.4 GiB,2.6 TiB
Deca Sports 3,4.1,Hudson,Hudson Entertainment,"Deca Sports 3 (USA) (En,Fr,Es).iso",4.4 GiB,2.6 TiB
Emergency Heroes,4.1,Ubisoft Barcelona,Ubisoft,"Emergency Heroes (USA) (En,Fr,Es).iso",4.4 GiB,2.6 TiB
GT Pro Series,4.1,MTO,Ubisoft,GT Pro Series (USA).iso,4.4 GiB,2.6 TiB
"Harry Potter and the Deathly Hallows, Part 1",4.1,EA Bright Light,Electronic Arts,"Harry Potter and the Deathly Hallows - Part 1 (USA) (En,Fr,Es).iso",4.4 GiB,2.6 TiB
Haunted House (2010),4.1,ImaginEngine,Atari SA,"Haunted House (USA) (En,Fr).iso",4.4 GiB,2.6 TiB
Iron Man 2,4.1,Sega Studios San Francisco,Sega,"Iron Man 2 (USA) (En,Fr,Es) (Walmart).iso",4.4 GiB,2.6 TiB
Rapala Tournament Fishing!,4.1,MagicWand,Activision,Rapala Tournament Fishing! (USA).iso,4.4 GiB,2.6 TiB
Soccer Bashi,4.1,Icon Games,Icon Games,Soccer Bashi (USA) (WiiWare).wad,18.7 MiB,2.6 TiB
Transformers: War for Cybertron,4.1,High Moon Studios,Activision,"Transformers - Cybertron Adventures (USA) (En,Fr).iso",4.4 GiB,2.6 TiB
WWII Aces,4.1,Arcade Moon,Destineer,WWII Aces (USA).iso,4.4 GiB,2.6 TiB
Chrysler Classic Racing,4.0,EM Studios,Zoo Games,"Chrysler Classic Racing (USA) (En,Fr,De,Es,It).iso",4.4 GiB,2.6 TiB
Emergency Mayhem,4.0,Supersonic Software,Codemasters,"Emergency Mayhem (USA) (En,Fr,Es).iso",4.4 GiB,2.6 TiB
Protothea,4.0,Digital Builders,Ubisoft,Protoethea (USA) (WiiWare).wad,35.2 MiB,2.6 TiB
Pub Darts,4.0,Big Blue Bubble Inc.,Big Blue Bubble Inc.,Pub Darts (USA) (WiiWare).wad,15.8 MiB,2.6 TiB
Rebel Raiders: Operation Nighthawk,4.0,Kando Games,XS Games,"Rebel Raiders - Operation Nighthawk (USA) (En,Fr,Es).iso",4.4 GiB,2.6 TiB
Alone in the Dark (2008),3.9,Eden Studios,Atari SA,"Alone in the Dark (USA) (En,Fr,Es) (Rev 1).iso",4.4 GiB,2.6 TiB
Attack of the Movies 3D,3.9,Panic Button,Majesco,Attack of the Movies 3-D (USA).iso,4.4 GiB,2.6 TiB
Beyblade: Metal Fusion - Battle Fortress,3.9,Hudson Soft,Hudson Entertainment,"Beyblade - Metal Fusion - Battle Fortress (USA) (En,Fr,Es).iso",4.4 GiB,2.6 TiB
DreamWorks Kung Fu Panda 2,3.9,THQ,THQ,"DreamWorks Kung Fu Panda 2 (USA) (En,Fr) (SKUZ).iso",4.4 GiB,2.6 TiB
Fantastic Four: Rise of the Silver Surfer,3.9,Visual Concepts,2K Games,"Fantastic Four - Rise of the Silver Surfer (USA) (En,Fr).iso",4.4 GiB,2.6 TiB
Ju-on: The Grudge,3.9,FeelPlus,XSEED Games,"Ju-on - The Grudge (Europe) (En,Fr,De,Es,It,Nl).iso",4.4 GiB,2.6 TiB
Sandy Beach,3.9,Frozen Codebase,Konami,Sandy Beach (USA) (WiiWare).wad,38.4 MiB,2.6 TiB
The Mummy: Tomb of the Dragon Emperor,3.9,Eurocom,Sierra Entertainment,"Mummy, The - Tomb of the Dragon Emperor (USA) (En,Fr,Es).iso",4.4 GiB,2.6 TiB
Wacky Races: Crash & Dash,3.9,Eidos Sweden,Eidos Interactive,"Wacky Races - Crash & Dash (USA) (En,Fr,Es).iso",4.4 GiB,2.6 TiB
Word Searcher,3.9,Digital Leisure,Digital Leisure,Word Searcher (USA) (WiiWare).wad,14.4 MiB,2.6 TiB
Carnival Games: Mini-Golf,3.8,Cat Daddy Games,2K Play,"Carnival Games - MiniGolf (USA) (En,Fr,Es).iso",4.4 GiB,2.6 TiB
Far Cry,3.8,Crytek,Ubisoft,"Funfair Party (Europe) (En,Fr,De,Es,It,Nl) (Rev 1).iso",4.4 GiB,2.6 TiB
Naruto Shippuden: Dragon Blade Chronicles,3.8,Eighting,Tomy Corporation,Naruto Shippuden - Dragon Blade Chronicles (USA).iso,4.4 GiB,2.7 TiB
Backyard Baseball '09,3.7,Humongous Entertainment,Atari SA,Backyard Baseball '09 (USA).iso,4.4 GiB,2.7 TiB
Escape from Bug Island,3.7,Spike,Eidos Interactive,Escape from Bug Island (USA).iso,4.4 GiB,2.7 TiB
Ford Racing: Off Road,3.7,Razorworks,Empire Interactive,"Ford Racing - Off Road (USA) (En,Fr,Es).iso",4.4 GiB,2.7 TiB
Game Party 3,3.7,Farsight Studios,Warner Bros. Interactive Entertainment,"Game Party 3 (USA) (En,Fr,Es).iso",4.4 GiB,2.7 TiB
Goosebumps HorrorLand,3.7,SScholastic Media,"Scholastic, Inc.",Goosebumps HorrorLand (USA).iso,4.4 GiB,2.7 TiB
Legend of the Dragon,3.7,Neko Entertainment,The Game Factory,"Legend of the Dragon (USA) (En,Fr,Es).iso",4.4 GiB,2.7 TiB
Midnight Bowling,3.7,Gameloft,Gameloft,Midnight Bowling (USA) (WiiWare).wad,37.9 MiB,2.7 TiB
Ready 2 Rumble Revolution,3.7,10tacle Studios,Atari SA,"Ready 2 Rumble - Revolution (USA) (En,Fr,Es).iso",4.4 GiB,2.7 TiB
Speed Zone,3.7,Awesome Play Ltd.,Detn8,Speed Zone (USA).iso,4.4 GiB,2.7 TiB
Tamagotchi Party On!,3.7,h.a.n.d. Inc.,Namco Bandai Games,Tamagotchi - Party On! (USA).iso,4.4 GiB,2.7 TiB
Wonder World Amusement Park,3.7,Coyote Console,Majesco,Wonder World Amusement Park (USA).iso,4.4 GiB,2.7 TiB
Dave Mirra BMX Challenge,3.6,Left Field Productions,Crave,Dave Mirra BMX Challenge (USA).iso,4.4 GiB,2.7 TiB
X-Men: Destiny,3.6,Silicon Knights,Activision,X-Men - Destiny (USA).iso,4.4 GiB,2.7 TiB
Arcade Essentials,3.5,Nordcurrent,Nordcurrent,Arcade Essentials (USA) (WiiWare).wad,38.4 MiB,2.7 TiB
George of the Jungle and the Search for the Secret,3.5,Crave,Crave,George of the Jungle and the Search for the Secret (USA).iso,4.4 GiB,2.7 TiB
King of Clubs,3.5,Oxygen Interactive,Crave,"King of Clubs (USA) (En,Fr,Es).iso",4.4 GiB,2.7 TiB
Sexy Poker,3.5,Gameloft,Gameloft,Sexy Poker (USA) (WiiWare).wad,37.4 MiB,2.7 TiB
Showtime Championship Boxing,3.5,Nikitova Games,DSI Games,Showtime Championship Boxing (USA).iso,4.4 GiB,2.7 TiB
The Golden Compass,3.5,Shiny Entertainment,Sega,"Golden Compass, The (USA).iso",4.4 GiB,2.7 TiB
Valhalla Knights: Eldar Saga,3.5,K2,XSEED Games,Valhalla Knights - Eldar Saga (USA).iso,4.4 GiB,2.7 TiB
Gormiti: The Lords of Nature!,3.4,Climax Studios,Konami,"Gormiti - The Lords of Nature! (USA) (En,Fr,Es).iso",4.4 GiB,2.7 TiB
M&M's Adventure (2008),3.4,Nikitova Games,Zoo Digital Publishing,M&M's Adventure (USA).iso,4.4 GiB,2.7 TiB
Transformers: Dark of the Moon,3.4,High Moon Studios,Activision,"Transformers - Dark of the Moon - Stealth Force Edition (USA) (En,Fr).iso",4.4 GiB,2.7 TiB
AMF Bowling Pinbusters!,3.3,4J Studios,Vir2L Studios,AMF Bowling - Pinbusters! (USA).iso,4.4 GiB,2.7 TiB
ATV Quad Kings,3.3,Beyond Reality,Zoo Games,"ATV Quad Kings (USA) (En,Fr,Es).iso",4.4 GiB,2.7 TiB
Target: Terror,3.3,Leviathan Games,Konami,Target - Terror (USA).iso,4.4 GiB,2.8 TiB
Vegas Party,3.3,Storm City Games,Storm City Games,"Vegas Party (USA) (En,Fr,Es).iso",4.4 GiB,2.8 TiB
Anima: Ark of Sinners,3.2,Anima Game Studio,Anima Game Studio,ANIMA - Ark of Sinners (USA) (WiiWare).wad,41.6 MiB,2.8 TiB
Pool Party (2007),3.2,Hyper-Devbox,SouthPeak Games,Pool Party (USA).iso,4.4 GiB,2.8 TiB
Rolling Stone: Drum King,3.2,505 Games,505 Games,"Rolling Stone - Drum King (USA) (En,Fr,Es).iso",4.4 GiB,2.8 TiB
CID The Dummy,3.1,Twelve Games,Oxygen Interactive,CID the Dummy (USA).iso,4.4 GiB,2.8 TiB
Copter Crisis,3.1,Digital Leisure,Digital Leisure,Copter Crisis (USA) (WiiWare) (DLC).wad,125.9 KiB,2.8 TiB
Mad Dog McCree: Gunslinger Pack,3.1,Digital Leisure,Majesco,"Mad Dog McCree - Gunslinger Pack (USA) (En,Fr,Es).iso",4.4 GiB,2.8 TiB
5 Arcade Gems,3.0,Nordcurrent,Nordcurrent,5 Arcade Gems (USA) (WiiWare).wad,32.0 MiB,2.8 TiB
Alvin and the Chipmunks,3.0,Sensory Sweep,Brash Entertainment,"Alvin and the Chipmunks (USA) (En,Fr).iso",4.4 GiB,2.8 TiB
Jillian Michaels' Fitness Ultimatum 2009,3.0,3G Studios,Majesco,Jillian Michaels' Fitness Ultimatum 2009 (USA).iso,4.4 GiB,2.8 TiB
Ten Pin Alley 2,3.0,Other Ocean Interactive,XS Games,"Ten Pin Alley 2 (USA) (En,Fr,Es).iso",4.4 GiB,2.8 TiB
Game Party 2,2.9,Midway,Midway,"Game Party 2 (USA) (En,Fr,Es).iso",4.4 GiB,2.8 TiB
Jumper: Griffin's Story,2.8,Red Tribe,Brash Entertainment,"Jumper - Griffin's Story (USA) (En,Fr).iso",4.4 GiB,2.8 TiB
Kung Fu Funk: Everybody is Kung Fu Fighting!,2.8,Stickmen Studios,Stickmen Studios,Kung Fu Funk - Everybody is Kung Fu Fighting! (USA) (WiiWare).wad,43.1 MiB,2.8 TiB
Ultimate Duck Hunting,2.8,Mid Carolina Media,Detn8,"Mathews Bow Hunting (USA) (En,Fr,Es).iso",4.4 GiB,2.8 TiB
Chicken Shoot,2.7,Destination Software,DSI Games,"Chicken Shoot (USA) (En,Fr,Es).iso",4.4 GiB,2.8 TiB
Looney Tunes: Acme Arsenal,2.7,Red Tribe,Warner Bros. Interactive Entertainment,Looney Tunes - Acme Arsenal (USA).iso,4.4 GiB,2.8 TiB
The Incredible Maze,2.7,Digital Leisure,Digital Leisure,"Incredible Maze, The (USA) (WiiWare).wad",23.1 MiB,2.8 TiB
Calvin Tucker's Redneck Jamboree,2.6,Humagade,Zoo Games,Calvin Tucker's Redneck Jamboree (USA).iso,4.4 GiB,2.8 TiB
Jenga World Tour,2.6,Atomic Planet Entertainment,Atari SA,"Jenga World Tour (USA) (En,Fr,De,Es,It).iso",4.4 GiB,2.8 TiB
Pimp My Ride,2.6,Eutechnyx,Activision,MTV Pimp My Ride (USA).iso,4.4 GiB,2.8 TiB
The Island of Dr. Frankenstein,2.6,Visual Impact,Storm City Games,"Island of Dr. Frankenstein, The (USA) (En,Fr,Es).iso",4.4 GiB,2.8 TiB
Cruis'n,2.5,Midway Studios - San Diego,Midway,"Cruis'n (USA) (En,Fr,Es).iso",4.4 GiB,2.8 TiB
Game Party,2.5,Midway,Midway,Game Party (USA) (Rev 1).iso,4.4 GiB,2.8 TiB
Monochrome Racing,2.5,Nordcurrent,Nordcurrent,Monochrome Racing (USA) (WiiWare).wad,31.0 MiB,2.8 TiB
Bloons,2.1,Bloober Team,Hands-On Mobile,Bloons (USA) (WiiWare).wad,14.9 MiB,2.8 TiB
Enjoy your massage!,2.1,Microforum,Microforum,Enjoy your Massage! (USA) (WiiWare).wad,22.2 MiB,2.8 TiB
Zombii Attack,2.1,Gamers Digital,Gamers Digital,Zombii Attack (USA) (WiiWare).wad,32.7 MiB,2.8 TiB
Ninjabread Man,2.0,Data Design Interactive,Conspiracy Entertainment,Ninjabread Man (USA).iso,4.4 GiB,2.8 TiB
Anubis II,1.9,Data Design Interactive,UFO Interactive,Anubis II (USA).iso,4.4 GiB,2.8 TiB
Balls of Fury,1.9,Black Lantern Studios,DSI Games,Balls of Fury (USA).iso,4.4 GiB,2.8 TiB
Blood Beach,1.8,Coresoft Inc.,Coresoft Inc.,Blood Beach (USA) (WiiWare).wad,19.0 MiB,2.8 TiB
Pong Toss: Frat Party Games,1.8,JV Games Inc.,JV Games Inc.,Pong Toss! Frat Party Games (USA) (WiiWare).wad,18.8 MiB,2.8 TiB
SPOGS Racing,1.8,Pronto Games,D2C Games,SPOGS Racing (USA) (WiiWare).wad,35.7 MiB,2.8 TiB
101-in-1 Explosive Megamix,1.6,Nordcurrent,Atlus,101-in-1 Explosive Megamix (USA) (WiiWare).wad,38.1 MiB,2.8 TiB
