title,score,developer,publisher,rom_name,size,running_total
Luxor: The Wrath of Set,6.0,MumboJumbo,MumboJumbo,Luxor - The Wrath of Set (USA).iso,864.3 MiB,358.9 GiB
Naruto Shippuden: Legends: Akatsuki Rising,6.0,Racjin,Namco Bandai Games,Naruto Shippuden - Legends - Akatsuki Rising (USA).iso,728.4 MiB,359.6 GiB
Online Chess Kingdoms,6.0,Leviathan Games,Konami,"Online Chess Kingdoms (USA) (En,Fr,De,Es,It) (v1.02).iso",254.6 MiB,359.8 GiB
ProStroke Golf - World Tour 2007,6.0,Gusto Games,Oxygen Interactive,Pro Stroke Golf - World Tour 2007 (USA) (v1.01).iso,771.9 MiB,360.6 GiB
Puzzle Scape,6.0,Farmind Ltd,Got Game Entertainment,Puzzle Scape (USA) (v1.04).iso,330.1 MiB,360.9 GiB
Sonic Rivals 2,6.0,Backbone Entertainment,Sega,Sonic Rivals 2 (USA) (v1.01).iso,492.0 MiB,361.4 GiB
Tom Clancy's Rainbow Six: Vegas,6.0,Ubisoft Montreal,Ubisoft,"Tom Clancy's Rainbow Six - Vegas (USA) (En,Fr,Es) (v1.02).iso",812.8 MiB,362.2 GiB
X-MEN ORIGINS: WOLVERINE,6.0,Raven Software,Activision,,,
Yu-Gi-Oh! GX Tag Force 2,6.0,Konami,Konami,Yu-Gi-Oh! GX - Tag Force 2 (USA) (v1.02).iso,1.7 GiB,363.9 GiB
Brainpipe: A Plunge to Unhumanity,5.9,Hands-On Mobile,Hands-On Mobile,,,
Coded Arms,5.9,Konami,Konami,Coded Arms (USA) (v1.01).iso,175.1 MiB,364.0 GiB
Eragon,5.9,Stormfront Studios,Sierra Entertainment,Eragon (USA) (v1.03).iso,237.3 MiB,364.3 GiB
Frantix: A Puzzle Adventure,5.9,Killer Game,Sony Online Entertainment,Frantix - A Puzzle Adventure (USA) (v1.01).iso,382.7 MiB,364.7 GiB
Gang Wars (1989),5.9,Alpha Denshi,SNK Playmore,Gang Wars (USA) (minis) (PSN).iso,128.6 MiB,364.8 GiB
Gladiator Begins,5.9,Goshow,Aksys Games,Gladiator Begins (USA).iso,452.7 MiB,365.2 GiB
MX vs. ATV Untamed,5.9,Rainbow Studios,THQ,MX vs. ATV Untamed (USA).iso,290.2 MiB,365.5 GiB
Naruto Shippuden: Ultimate Ninja Impact,5.9,Racjin,Namco Bandai Games,"Naruto Shippuden - Ultimate Ninja Impact (USA) (En,Fr,Es).iso",1013.7 MiB,366.5 GiB
Platypus,5.9,Squashy Software,MumboJumbo,Platypus (USA) (v1.01).iso,72.5 MiB,366.6 GiB
The Godfather: Mob Wars,5.9,Page 44 Studios,Electronic Arts,"Godfather, The - Mob Wars (USA).iso",1.3 GiB,367.8 GiB
The Simpsons Game,5.9,EA Redwood Shores,EA Games,"Simpsons Game, The (USA).iso",729.4 MiB,368.6 GiB
Xiaolin Showdown,5.9,BottleRocket Entertainment,Konami,Xiaolin Showdown (USA) (v1.02).iso,864.4 MiB,369.4 GiB
Adventures to Go!,5.8,Global A,Natsume,Adventures to Go! (USA) (v1.02).iso,168.0 MiB,369.6 GiB
BreakQuest,5.8,Beatshapers,Beatshapers,BreakQuest (USA) (v2) (minis) (PSN).iso,194.8 MiB,369.8 GiB
DreamWorks Over the Hedge: Hammy Goes Nuts,5.8,Amaze Entertainment,Activision,Over the Hedge - Hammy Goes Nuts! (USA) (v1.01).iso,310.2 MiB,370.1 GiB
Dungeons & Dragons Tactics,5.8,Kuju Entertainment,Atari SA,Dungeons & Dragons Tactics (USA) (v1.01).iso,462.4 MiB,370.5 GiB
Fate/Extra,5.8,Imageepoch,Aksys Games,Fate-Extra (USA).iso,1.2 GiB,371.7 GiB
FIFA Street 2,5.8,EA Canada,EA Sports Big,FIFA Street 2 (USA) (v1.01).iso,861.1 MiB,372.5 GiB
Fortix,5.8,Nemesys,Nemesys,Fortix (USA) (v3) (minis) (PSN).iso,151.6 MiB,372.7 GiB
Hero of Sparta,5.8,Gameloft,Gameloft,Hero of Sparta (USA) (minis) (PSN).iso,172.1 MiB,372.9 GiB
Jackass the Game,5.8,Sidhe Interactive,Red Mile Entertainment,Jackass - The Game (USA) (v1.02).iso,1.7 GiB,374.6 GiB
Marvel Nemesis: Rise of the Imperfects,5.8,EA Canada,EA Games,Marvel Nemesis - Rise of the Imperfects (USA).iso,864.3 MiB,375.4 GiB
Rocky Balboa,5.8,Ubisoft,Ubisoft,Rocky Balboa (USA) (v1.02).iso,864.3 MiB,376.2 GiB
Scarface: Money. Power. Respect.,5.8,Farsight Studios,Sierra Entertainment,Scarface - Money. Power. Respect. (USA) (v1.01).iso,551.7 MiB,376.8 GiB
Spider-Man: Friend or Foe,5.8,Next Level Games,Activision,Spider-Man - Friend or Foe (USA).iso,552.0 MiB,377.3 GiB
The Fast and the Furious (2006),5.8,Eutechnyx,Namco Bandai Games,"Fast and The Furious, The (USA) (v1.01).iso",863.2 MiB,378.2 GiB
The Legend of Heroes III: Song of the Ocean,5.8,Microvision,Namco Bandai Games,"Legend of Heroes III, The - Song of the Ocean (USA) (v1.01).iso",834.4 MiB,379.0 GiB
Tom Clancy's Splinter Cell Essentials,5.8,Ubisoft,Ubisoft,Tom Clancy's Splinter Cell - Essentials (USA) (v1.02).iso,1.7 GiB,380.7 GiB
Avatar: The Last Airbender,5.7,AWE Games,THQ,Avatar - The Last Airbender (USA).iso,169.9 MiB,380.8 GiB
BattleZone (2006),5.7,Paradigm Entertainment,Atari SA,"BattleZone (USA) (En,Fr,De,Es,It) (v1.02).iso",864.4 MiB,381.7 GiB
Driver '76,5.7,Sumo Digital,Ubisoft,Driver 76 (USA).iso,1.0 GiB,382.7 GiB
Dynasty Warriors Vol. 2,5.7,Omega Force,Koei,Dynasty Warriors Vol. 2 (USA).iso,266.2 MiB,383.0 GiB
EyePet,5.7,SCEE London Studio,SCEA,"EyePet (USA) (En,Fr,Es,Pt).iso",659.7 MiB,383.6 GiB
KAO Challengers,5.7,Tate Interactive,Atari SA,Kao Challengers (USA) (v1.01).iso,585.8 MiB,384.2 GiB
MiniSquadron,5.7,MrFungFung,MrFungFung,MiniSquadron (USA) (minis) (PSN).iso,168.1 MiB,384.3 GiB
Naruto Shippuden: Kizuna Drive,5.7,Premium Agency ,Namco Bandai Games,"Naruto Shippuden - Kizuna Drive (USA) (En,Fr,Es).iso",1.1 GiB,385.4 GiB
NBA,5.7,989 Sports,SCEA,NBA (USA).iso,185.6 MiB,385.6 GiB
Need for Speed: ProStreet,5.7,EA Black Box,EA Games,Need for Speed - ProStreet (USA).iso,854.8 MiB,386.5 GiB
Neverland Card Battles,5.7,Idea Factory,Yuke's,Neverland Card Battles (USA).iso,399.8 MiB,386.9 GiB
DreamWorks Shrek the Third,5.7,7 Studios,Activision,Shrek the Third (USA) (v1.01).iso,485.8 MiB,387.3 GiB
The Sims 2: Pets,5.7,Maxis,EA Games,"Sims 2, The (USA).iso",1.0 GiB,388.4 GiB
Ultimate Board Game Collection,5.7,Jack of All Games,Valcon Games,Ultimate Board Game Collection (USA) (v1.02).iso,121.2 MiB,388.5 GiB
Coded Arms: Contagion,5.6,Creat Studios,Konami,Coded Arms - Contagion (USA) (v1.04).iso,521.9 MiB,389.0 GiB
Dragoneer's Aria,5.6,Hit Maker,NIS America,Dragoneer's Aria (USA).iso,370.1 MiB,389.4 GiB
Dungeon Explorer: Warriors of Ancient Arts,5.6,Hudson Soft,Hudson Entertainment,Dungeon Explorer - Warriors of Ancient Arts (USA) (v1.01).iso,539.2 MiB,389.9 GiB
EA Replay,5.6,Team Fusion,Electronic Arts,EA Replay (USA) (v1.01).iso,850.4 MiB,390.7 GiB
Peter Jackson's King Kong: The Official Game of the Movie,5.6,Ubisoft Montpellier,Ubisoft,Peter Jackson's King Kong (USA) (v1.02).iso,472.2 MiB,391.2 GiB
Super Monkey Ball Adventure,5.6,Traveller's Tales,Sega,Super Monkey Ball Adventure (USA) (v1.02).iso,404.0 MiB,391.6 GiB
Unbound Saga,5.6,Vogster,"Vogster Entertainment, LLC",Unbound Saga (USA) (PSP) (PSN).iso,414.0 MiB,392.0 GiB
Warriors Orochi 2,5.6,Omega Force,Koei,"Warriors Orochi 2 (USA) (En,Fr) (v1.02).iso",1.7 GiB,393.7 GiB
World Championship Poker: Featuring Howard Lederer - All In,5.6,Point of View,Crave,World Championship Poker featuring Howard Lederer - All In (USA) (v1.01).iso,1.7 GiB,395.3 GiB
300: March to Glory,5.5,Collision Studios,Warner Bros. Interactive Entertainment,"300 - March to Glory (USA) (En,Fr,De,Es,It) (v1.01).iso",909.8 MiB,396.2 GiB
Bomberman Land Portable,5.5,Racjin,Hudson Entertainment,Bomberman Land Portable (Japan).iso,394.1 MiB,396.6 GiB
Diner Dash,5.5,Climax Studios,Eidos Interactive,"Diner Dash (Europe) (En,Fr,De,Es,It) (v1.01).iso",130.9 MiB,396.7 GiB
DiRT 2,5.5,Codemasters,Codemasters,,,
Elminage Original,5.5,Starfish SD,UFO Interactive,Elminage Original (USA) (PSP) (PSN).iso,541.8 MiB,397.3 GiB
Hot Pixel,5.5,zSlide,Atari SA,Hot Pixel (USA) (v1.02).iso,321.0 MiB,397.6 GiB
L.A. Rush,5.5,Midway,Midway,"L.A. Rush (Europe) (En,Fr,De,Es,It) (v1.01).iso",1.3 GiB,398.9 GiB
Ninjamurai,5.5,Open Emotion Studios,Open Emotion Studios,Ninjamurai (USA) (v2.02) (minis) (PSN).iso,171.4 MiB,399.1 GiB
Warhammer: Battle for Atluma,5.5,Sabertooth Games,Namco Bandai Games,Warhammer - Battle for Atluma (USA) (v1.03).iso,229.5 MiB,399.3 GiB
Dead to Rights: Reckoning,5.4,Rebellion,Namco,Dead to Rights - Reckoning (USA).iso,184.2 MiB,399.5 GiB
Duael Invaders,5.4,Laughing Jackal,Laughing Jackal,Duael Invaders (USA) (minis) (PSN).iso,152.2 MiB,399.6 GiB
Ghostbusters: The Video Game,5.4,Terminal Reality,Atari SA,Ghostbusters - The Video Game (USA).iso,1.1 GiB,400.7 GiB
International Athletics,5.4,The Code Monkeys,Ghostlight,"International Athletics (Europe) (En,Fr,De,Es,It) (v1.01).iso",132.1 MiB,400.8 GiB
Payout Poker & Casino,5.4,Bits Studios,Namco,Payout Poker & Casino (USA) (v1.02).iso,192.9 MiB,401.0 GiB
Scooby Doo!  Who's Watching Who?,5.4,Human Soft,THQ,Scooby-Doo! - Who's Watching Who (USA) (v1.01).iso,589.2 MiB,401.6 GiB
Shadow of Destiny,5.4,KCET,Konami,Shadow of Destiny (USA).iso,1.0 GiB,402.6 GiB
Steambot Chronicles: Battle Tournament,5.4,Irem,Atlus,Steambot Chronicles - Battle Tournament (USA).iso,256.4 MiB,402.9 GiB
Tom Clancy's Ghost Recon Predator,5.4,Virtuos,Ubisoft,"Tom Clancy's Ghost Recon - Predator (USA) (En,Fr,Es).iso",864.4 MiB,403.7 GiB
Alien Havoc,5.3,Creat Studios,Creat Studios,Alien Havoc (USA) (minis) (PSN).iso,118.7 MiB,403.8 GiB
Full Auto 2: Battlelines,5.3,Pseudo Interactive,Sega,Full Auto 2 - Battlelines (USA) (v1.01).iso,455.0 MiB,404.3 GiB
Lord of Arcana,5.3,Access Games,Square Enix,"Lord of Arcana (USA) (En,Fr).iso",767.7 MiB,405.0 GiB
Strikers 1945 Plus,5.3,Arc System Works,PM Studios Inc.,Strikers 1945 Plus (USA) (PSN).iso,216.5 MiB,405.2 GiB
Tiger Woods PGA Tour 09,5.3,EA Tiburon,Electronic Arts,Tiger Woods PGA Tour 09 (USA).iso,1.5 GiB,406.7 GiB
Valhalla Knights,5.3,K2 LLC,XSEED Games,Valhalla Knights (USA) (v1.01).iso,630.3 MiB,407.4 GiB
50 Cent: Bulletproof,5.2,High Voltage Software,Vivendi Games,50 Cent - Bulletproof - G-Unit Edition (USA) (v1.02).iso,1.6 GiB,408.9 GiB
Ford Bold Moves Street Racing,5.2,Razorworks,Eidos Interactive,Ford Bold Moves Street Racing (USA) (v1.01).iso,700.0 MiB,409.6 GiB
Gangs of London,5.2,SCEE London Studio,SCEA,Gangs of London (USA) (v1.01).iso,1.0 GiB,410.6 GiB
Harry Potter and the Order of the Phoenix,5.2,EA Games,EA Games,Harry Potter and the Order of the Phoenix (USA).iso,728.1 MiB,411.3 GiB
Need for Speed: Undercover,5.2,EA Vancouver,Electronic Arts,Need for Speed - Undercover (USA).iso,1.2 GiB,412.5 GiB
Pirates of the Caribbean: Dead Man's Chest,5.2,Griptonite Games,Buena Vista Games,Pirates of the Caribbean - Dead Man's Chest (USA) (v1.01).iso,449.8 MiB,413.0 GiB
Spider-Man 3,5.2,Treyarch,Activision,Spider-Man 3 (USA).iso,1.6 GiB,414.5 GiB
Warriors of the Lost Empire,5.2,Platinum Egg,UFO Interactive,"Warriors of the Lost Empire (USA) (En,Fr,Es) (v1.03).iso",1.7 GiB,416.2 GiB
7 Wonders of the Ancient World,5.1,Hot Lava Games,MumboJumbo,7 Wonders of the Ancient World (USA) (v1.01).iso,73.8 MiB,416.3 GiB
Alien Syndrome (2007),5.1,Totally Games,Sega,Alien Syndrome (USA).iso,471.9 MiB,416.7 GiB
Ape Escape Academy,5.1,Shift,SCEA,Ape Escape Academy (USA) (v1.01).iso,370.9 MiB,417.1 GiB
Blokus Portable: Steambot Championship,5.1,Irem,Majesco,Blokus Portable - Steambot Championship (USA).iso,63.1 MiB,417.2 GiB
Brooktown High,5.1,Backbone Entertainment,Konami,Brooktown High (USA).iso,1.2 GiB,418.4 GiB
Family Guy,5.1,High Voltage Software,2K Games,Family Guy (USA).iso,1.1 GiB,419.5 GiB
Marvel Super Hero Squad,5.1,Blue Tongue Entertainment,THQ,Marvel Super Hero Squad (USA).iso,1.5 GiB,420.9 GiB
Pac-Man World Rally,5.1,Smart Bomb Interactive,Namco Bandai Games,Pac-Man World Rally (USA) (v1.02).iso,412.7 MiB,421.3 GiB
Rengoku II: The Stairway to H.E.A.V.E.N.,5.1,Hudson Soft,Konami,Rengoku II - The Stairway to H.E.A.V.E.N. (USA) (v1.02).iso,479.1 MiB,421.8 GiB
The Hustle: Detroit Streets,5.1,Blade Interactive,Activision Value,"Hustle, The - Detroit Streets (USA) (v1.01).iso",942.6 MiB,422.7 GiB
B-Boy,5.0,FreeStyleGames,Evolved Games,B-Boy (USA) (v1.01).iso,1.5 GiB,424.3 GiB
SWAT: Target Liberty,5.0,3G Studios,Sierra Entertainment,SWAT - Target Liberty (USA) (v1.01).iso,838.1 MiB,425.1 GiB
TNA Impact: Cross the Line,5.0,Point of View,SouthPeak Games,"TNA Impact! Cross the Line (USA) (En,Fr).iso",1.1 GiB,426.2 GiB
Valhalla Knights 2,5.0,K2,XSEED Games,Valhalla Knights 2 (USA).iso,1.5 GiB,427.6 GiB
Aliens vs. Predator: Requiem,4.9,Rebellion,Sierra Entertainment,Aliens vs. Predator - Requiem (USA).iso,378.1 MiB,428.0 GiB
Army of Two: The 40th Day,4.9,EA Montreal,Electronic Arts,Army of Two - The 40th Day (USA).iso,858.6 MiB,428.8 GiB
Ghost Rider,4.9,Climax Studios,2K Games,"Ghost Rider (USA) (En,Fr,De,Es,It) (v1.02).iso",752.9 MiB,429.6 GiB
Heatseeker,4.9,IR Gurus,Codemasters,Heatseeker (USA) (v1.01).iso,385.8 MiB,429.9 GiB
Iron Man 2,4.9,Sega Studios San Francisco,Sega,"Iron Man (USA) (En,Fr,Es).iso",864.4 MiB,430.8 GiB
Astonishia Story,4.8,Sonnori,Ubisoft,Astonishia Story (USA) (v1.02).iso,110.2 MiB,430.9 GiB
N.O.V.A. - Near Orbit Vanguard Alliance,4.8,Gameloft,Gameloft,,,
SpongeBob Squarepants: The Yellow Avenger,4.8,Tantalus,THQ,SpongeBob SquarePants - The Yellow Avenger (USA) (v1.01).iso,166.2 MiB,431.1 GiB
Bubble Bobble Evolution,4.7,Digital Whip,Codemasters,Bubble Bobble - Evolution (USA) (v1.01).iso,595.9 MiB,431.6 GiB
Ford Racing: Off Road,4.7,Razorworks,Empire Interactive,Ford Racing - Off Road (USA).iso,700.0 MiB,432.3 GiB
Rainbow Islands Evolution,4.7,Digital Whip,Ignition Entertainment,"Rainbow Islands Evolution (USA) (En,Fr,Es).iso",807.8 MiB,433.1 GiB
Spectral Souls: Resurrection of the Ethereal Empires,4.7,Idea Factory,NIS America,Spectral Souls - Resurrection of the Ethereal Empires (USA).iso,1.1 GiB,434.2 GiB
Transformers: The Game,4.7,Traveller's Tales,Activision,Transformers - The Game (USA).iso,778.8 MiB,435.0 GiB
Mimana Iyar Chronicle,4.5,GungHo,Aksys Games,Mimana - Iyar Chronicle (USA) (v1.01).iso,632.1 MiB,435.6 GiB
Smart Bomb,4.5,Core Design Ltd.,Eidos Interactive,Smart Bomb (USA) (v1.03).iso,113.9 MiB,435.7 GiB
Hard Rock Casino,4.4,Farsight Studios,Crave,Hard Rock Casino (USA) (v1.02).iso,586.4 MiB,436.3 GiB
Iron Man (2008),4.4,Secret Level,Sega,"Iron Man (USA) (En,Fr,Es).iso",864.4 MiB,437.1 GiB
Armored Core 3,4.3,From Software,Agetec,Armored Core 3 Portable (USA) (PSP) (PSN).iso,459.7 MiB,437.6 GiB
PDC World Championship Darts 2008,4.3,Oxygen Interactive,O-Games,"PDC World Championship Darts 2008 (Europe) (En,Fr,De,Es,It,Nl) (v1.02).iso",325.3 MiB,437.9 GiB
Rengoku: The Tower of Purgatory,4.3,Neverland,Konami,Rengoku - The Tower of Purgatory (USA) (v1.01).iso,170.7 MiB,438.1 GiB
Asphalt: Urban GT 2,4.2,Virtuos,Ubisoft,"Asphalt - Urban GT 2 (Europe) (En,Fr,De,Es,It) (v1.01).iso",843.2 MiB,438.9 GiB
Funky Punch,4.2,Solus Games,Solus Games,Funky Punch (USA) (v2) (minis) (PSN).iso,134.1 MiB,439.0 GiB
Hellboy: The Science of Evil,4.2,Krome Studios,Konami,Hellboy - The Science of Evil (USA).iso,864.3 MiB,439.9 GiB
CID The Dummy,4.1,Twelve Games,Oxygen Interactive,CID The Dummy (USA) (v1.02).iso,500.2 MiB,440.4 GiB
Mana Khemia: Alchemists of Al-Revis,4.1,Gust,NIS America,,,
Street Supremacy,4.1,Genki,Konami,Street Supremacy (USA).iso,466.6 MiB,440.8 GiB
Taito Legends Power-Up,4.1,Empire Oxford,Destineer,Taito Legends Power-Up (USA) (v1.01).iso,301.8 MiB,441.1 GiB
Pocket Racers,3.9,Blade Interactive,Konami,Pocket Racers (USA) (v1.01).iso,255.8 MiB,441.4 GiB
Dead or Alive Paradise,3.8,Team Ninja,Tecmo,Dead or Alive - Paradise (USA) (v1.01).iso,829.7 MiB,442.2 GiB
Legend of the Dragon,3.8,Neko Entertainment,The Game Factory,Legend of the Dragon (USA) (v1.03).iso,788.9 MiB,442.9 GiB
Napoleon Dynamite: The Game,3.7,7 Studios,Crave,Napoleon Dynamite - The Game (USA) (v1.03).iso,627.4 MiB,443.6 GiB
Pocket Pool (2007),3.7,Conspiracy Entertainment,Eidos Interactive,Pocket Pool (USA) (v1.01).iso,672.3 MiB,444.2 GiB
TMNT,3.7,Ubisoft Montreal,Ubisoft,"TMNT (USA) (En,Fr,De,Es,It) (v1.01).iso",909.1 MiB,445.1 GiB
Transformers: Revenge of the Fallen The Mobile Game,3.7,"Luxoflux, Inc.",Activision,Transformers - Revenge of the Fallen (USA).iso,1.6 GiB,446.7 GiB
World Series of Poker,3.7,Activision,Activision,World Series of Poker (USA).iso,329.2 MiB,447.1 GiB
Air Conflicts: Aces of World War II,3.6,Cowboy Rodeo,Graffiti Entertainment,Air Conflicts - Aces of World War II (USA).iso,859.1 MiB,447.9 GiB
Dave Mirra BMX Challenge,3.2,Left Field Productions,Crave,Dave Mirra BMX Challenge (USA).iso,696.0 MiB,448.6 GiB
Winx Club: Join the Club,3.0,n-Space,Konami,Winx Club - Join the Club (USA) (v1.05).iso,1.2 GiB,449.8 GiB
Dragon Ball: Evolution,2.8,Dimps Corporation,Namco Bandai Games,Dragon Ball Evolution (USA).iso,376.5 MiB,450.2 GiB
The Golden Compass,2.8,Shiny Entertainment,Sega,"Golden Compass, The (USA).iso",1.2 GiB,451.4 GiB
