title,score,developer,publisher,rom_name,size,running_total
Justice League Heroes,7.2,Snowblind Studios,Warner Bros. Interactive Entertainment,Justice League Heroes (USA) (v1.01).iso,1.3 GiB,189.6 GiB
Kingdom of Paradise,7.2,Climax Entertainment,SCEA,Kingdom of Paradise (USA).iso,1.0 GiB,190.6 GiB
Monster Hunter Freedom 2,7.2,Capcom,Capcom,Monster Hunter Freedom 2 (USA) (v1.01).iso,798.4 MiB,191.4 GiB
Monsters (Probably) Stole My Princess,7.2,Mediatonic,Mediatonic,Monsters (Probably) Stole My Princess (USA) (minis) (PSN).iso,205.5 MiB,191.6 GiB
NBA 06,7.2,SCEA Sports Studio,SCEA,NBA 06 (USA).iso,296.2 MiB,191.9 GiB
Need for Speed: Most Wanted (2005),7.2,EA Canada,Electronic Arts,Need for Speed - Most Wanted 5-1-0 (USA).iso,883.7 MiB,192.7 GiB
Prinny: Can I Really Be the Hero?,7.2,Nippon Ichi Software,NIS America,Prinny - Can I Really Be the Hero (USA).iso,469.1 MiB,193.2 GiB
Pro Evolution Soccer 2010,7.2,Konami,Konami,"Pro Evolution Soccer 2010 (USA) (En,Fr,Es,Pt).iso",972.8 MiB,194.1 GiB
Secret Agent Clank,7.2,High Impact Games,SCEA,"Secret Agent Clank (USA) (En,Fr,De,Es,It).iso",1.4 GiB,195.6 GiB
SOCOM: U.S. Navy SEALs Tactical Strike,7.2,Slant Six,SCEA,SOCOM - U.S. Navy SEALs - Tactical Strike (USA).iso,1.3 GiB,196.8 GiB
The Bigs,7.2,Blue Castle Games,2K Sports,"Bigs, The (USA) (v1.01).iso",825.3 MiB,197.6 GiB
The Silent Hill Experience,7.2,Konami,Konami,Silent Hill Origins (USA) (PSN).iso,767.4 MiB,198.4 GiB
Thrillville,7.2,Frontier Developments,LucasArts,Thrillville (USA) (v1.01).iso,689.7 MiB,199.1 GiB
Thrillville: Off the Rails,7.2,Frontier Developments,LucasArts,Thrillville - Off the Rails (USA) (v1.01).iso,742.6 MiB,199.8 GiB
Tiger Woods PGA Tour 08,7.2,EA Salt Lake,EA Sports,Tiger Woods PGA Tour 08 (USA).iso,1.3 GiB,201.1 GiB
Tokobot,7.2,Tecmo,Tecmo,Tokobot (USA) (v1.02).iso,313.3 MiB,201.4 GiB
Ultimate Ghosts 'n Goblins,7.2,TOSE,Capcom,Ultimate Ghosts 'n Goblins (USA).iso,411.9 MiB,201.8 GiB
Vibes,7.2,Laughing Jackal,Laughing Jackal,Vibes (USA) (v2) (minis) (PSN).iso,184.3 MiB,201.9 GiB
World Tour Soccer 06,7.2,SCEE London Studio,SCEA,World Tour Soccer 06 (USA).iso,864.4 MiB,202.8 GiB
Worms: Battle Islands,7.2,Team17,Team17,Worms - Battle Islands (USA) (PSP) (PSN).iso,182.0 MiB,203.0 GiB
WWE SmackDown vs. Raw 2009,7.2,Yuke's,THQ,WWE SmackDown vs. Raw 2009 (Korea).iso,1.4 GiB,204.4 GiB
Ace Combat: Joint Assault,7.1,Project Aces ,Namco Bandai Games,Ace Combat - Joint Assault (USA).iso,1.6 GiB,206.0 GiB
Corpse Party,7.1,Team GrisGris,XSEED Games,Corpse Party (USA) (PSN).iso,742.3 MiB,206.7 GiB
Cubixx (2010),7.1,Laughing Jackal,Laughing Jackal,Cubixx (USA) (minis) (PSN).iso,133.0 MiB,206.9 GiB
Gods Eater Burst,7.1,Shift,D3Publisher,Gods Eater Burst (USA).iso,1.4 GiB,208.2 GiB
Jak and Daxter: The Lost Frontier,7.1,High Impact Games,SCEA,"Jak and Daxter - The Lost Frontier (USA) (En,Fr,Es).iso",1.4 GiB,209.6 GiB
LEGO Harry Potter: Years 1-4,7.1,Traveller's Tales,Warner Bros. Interactive Entertainment,LEGO Harry Potter - Years 1-4 (USA).iso,1.3 GiB,210.9 GiB
Medal of Honor Heroes,7.1,Team Fusion,EA Games,Medal of Honor - Heroes (USA).iso,1.3 GiB,212.2 GiB
Monster Hunter Freedom,7.1,Capcom,Capcom,Monster Hunter Freedom (USA) (v1.01).iso,706.9 MiB,212.9 GiB
No Heroes Allowed!,7.1,Acquire,SCEA,No Heroes Allowed! (USA) (PSP) (PSN).iso,308.7 MiB,213.2 GiB
The 3rd Birthday,7.1,HexaDrive,Square Enix,"3rd Birthday, The (USA).iso",1.4 GiB,214.6 GiB
The Red Star,7.1,XS Games,XS Games,"Red Star, The (USA) (PSN).iso",509.5 MiB,215.1 GiB
UEFA Champions League 2006-2007,7.1,EA Canada,EA Games,UEFA Champions League 2006-2007 (USA) (v1.01).iso,1.2 GiB,216.3 GiB
Young Thor,7.1,Frima Studio,Frima Studio,Young Thor (USA) (minis) (PSN).iso,201.7 MiB,216.5 GiB
Dante's Inferno,7.0,Visceral Games,Electronic Arts,Dante's Inferno (USA) (v1.01).iso,1.7 GiB,218.2 GiB
Disney/Pixar Cars,7.0,Rainbow Studios,THQ,Disney-Pixar Cars (Europe).iso,864.4 MiB,219.0 GiB
Dragon Ball Z: Shin Budokai,7.0,Dimps Corporation,Atari SA,Dragon Ball Z - Shin Budokai (USA).iso,311.6 MiB,219.3 GiB
Dungeon Maker: Hunting Ground,7.0,Global A,XSEED Games,Dungeon Maker - Hunting Ground (USA) (v1.01).iso,143.5 MiB,219.5 GiB
flOw,7.0,ThatGameCompany,SCEA,flOw (USA) (PSP) (PSN).iso,132.1 MiB,219.6 GiB
Generation of Chaos: Pandora's Reflection,7.0,Sting,NIS America,Generation of Chaos - Pandora's Reflection (USA) (PSN).iso,468.6 MiB,220.0 GiB
GripShift,7.0,Sidhe Interactive,Sony Platform Publishing,Gripshift (USA).iso,789.2 MiB,220.8 GiB
Harry Potter and the Goblet of Fire,7.0,Electronic Arts,Electronic Arts,Harry Potter and the Goblet of Fire (USA).iso,391.3 MiB,221.2 GiB
Hungry Giraffe,7.0,Laughing Jackal,Laughing Jackal,Hungry Giraffe (USA) (minis) (PSN).iso,141.9 MiB,221.3 GiB
Kenka Bancho: Badass Rumble,7.0,Bullets,Atlus,Kenka Bancho - Badass Rumble (USA).iso,499.9 MiB,221.8 GiB
Mortal Kombat: Deception,7.0,Midway,Midway,Mortal Kombat - Unchained (USA) (v1.03).iso,1.5 GiB,223.3 GiB
Naruto: Ultimate Ninja Heroes,7.0,CyberConnect2,Namco Bandai Games,Naruto - Ultimate Ninja Heroes (USA).iso,242.3 MiB,223.5 GiB
Shaun White Snowboarding,7.0,Ubisoft Montreal,Ubisoft,Shaun White Snowboarding (USA) (v1.01).iso,468.7 MiB,224.0 GiB
Star Wars: The Force Unleashed,7.0,LucasArts,LucasArts,"Star Wars - The Force Unleashed (USA) (En,Fr).iso",1.0 GiB,225.0 GiB
Tiger Woods PGA Tour 10,7.0,EA Tiburon,Electronic Arts,Tiger Woods PGA Tour 10 (USA).iso,1.4 GiB,226.4 GiB
World Series of Poker: Tournament of Champions,7.0,Left Field Productions,Activision,World Series of Poker - Tournament of Champions - 2007 Edition (USA).iso,722.7 MiB,227.1 GiB
World Tour Soccer,7.0,SCEE,SCEA,"World Tour Soccer (USA) (En,Fr,Es,It) (v1.01).iso",496.0 MiB,227.6 GiB
Worms: Open Warfare,7.0,Team17,Team17,Worms - Open Warfare (USA) (v1.02).iso,225.7 MiB,227.8 GiB
WWE All Stars,7.0,THQ,THQ,"WWE All Stars (Europe) (En,Fr,De,Es,It).iso",1.5 GiB,229.3 GiB
Yu-Gi-Oh! 5D's Tag Force 4,7.0,Konami,Konami,"Yu-Gi-Oh! 5D's - Tag Force 4 (USA) (En,Fr,De,Es,It) (v1.01).iso",1.6 GiB,230.9 GiB
2010 FIFA World Cup South Africa,6.9,Electronic Arts,EA Sports,"2010 FIFA World Cup South Africa (Canada) (En,Fr).iso",1.6 GiB,232.6 GiB
Arctic Adventures: Polar's Puzzles,6.9,Eiconic Games,Eiconic Games,Arctic Adventures - Polar's Puzzles (USA) (minis) (PSN).iso,138.7 MiB,232.7 GiB
Football Manager 2010,6.9,Sports Interactive,Sega,"Football Manager Handheld 2010 (USA) (En,Fr,Es,It) (PSP) (PSN).iso",208.8 MiB,232.9 GiB
Gravity Crash,6.9,Just Add Water,SCEA,Gravity Crash (USA) (minis) (PSN).iso,174.6 MiB,233.1 GiB
Invizimals,6.9,Novarama,SCEA,"Invizimals (USA) (En,Fr,Es) (v1.02).iso",1.5 GiB,234.6 GiB
Major League Baseball 2K6,6.9,Kush Games,2K Sports,Major League Baseball 2K6 (USA) (v1.01).iso,1.5 GiB,236.1 GiB
Manhunt 2,6.9,Rockstar Toronto,Rockstar Games,"Manhunt 2 (USA, Canada).iso",1.2 GiB,237.3 GiB
Medal of Honor Heroes 2,6.9,EA Canada,Electronic Arts,Medal of Honor - Heroes 2 (USA).iso,1.1 GiB,238.4 GiB
MotoGP (2006),6.9,Namco Bandai Games,Namco Bandai Games,"MotoGP (Europe) (En,Fr,De,It,Nl).iso",402.8 MiB,238.8 GiB
Myst (1995),6.9,Hoplite Research,Empire Interactive,Myst (USA) (PSP) (PSN).iso,835.5 MiB,239.6 GiB
NBA 10 The Inside,6.9,SCEA San Diego Studios,SCEA,NBA 10 - The Inside (USA).iso,1.0 GiB,240.6 GiB
NBA Ballers: Rebound,6.9,Backbone Entertainment,Midway,NBA Ballers Rebound (USA) (v1.05).iso,846.9 MiB,241.5 GiB
Need for Speed: Shift,6.9,Slightly Mad Studios,EA Games,"Need for Speed - Shift (USA) (En,Fr,Es).iso",1.7 GiB,243.2 GiB
Phantasy Star Portable 2,6.9,Alfa System,Sega,Phantasy Star Portable 2 (USA).iso,1.2 GiB,244.4 GiB
PQ: Practical Intelligence Quotient,6.9,Now Production,D3Publisher,PQ - Practical Intelligence Quotient (USA) (v1.01).iso,170.4 MiB,244.6 GiB
R-Type Command,6.9,Irem,Atlus,R-Type Command (USA).iso,318.1 MiB,244.9 GiB
Sky Force,6.9,Infinite Dreams,Infinite Dreams,Sky Force (USA) (minis) (PSN).iso,143.7 MiB,245.0 GiB
Star Wars: Battlefront II (2005),6.9,Pandemic Studios,LucasArts,Star Wars - Battlefront II (USA).iso,704.4 MiB,245.7 GiB
Super Stardust Portable,6.9,Housemarque,SCEA,"Super Stardust Portable (USA) (En,Fr,De,Es,It,Nl,Pt,Ru) (PSP) (PSN).iso",188.1 MiB,245.9 GiB
The Eye of Judgment: Legends,6.9,SCEJ,SCEA,"Eye of Judgment, The - Legends (USA) (PSP) (PSN).iso",853.5 MiB,246.7 GiB
"What Did I Do to Deserve This, My Lord!?",6.9,Acquire,NIS America,"What Did I Do to Deserve This, My Lord! (USA) (PSP) (PSN).iso",179.7 MiB,246.9 GiB
Bloons,6.8,Bloober Team,Hands-On Mobile,Bloons (USA) (minis) (PSN).iso,131.5 MiB,247.0 GiB
BreakQuest: Extra Evolution,6.8,Beatshapers,Beatshapers,BreakQuest - Extra Evolution (USA) (minis) (PSN).iso,181.8 MiB,247.2 GiB
Buzz! Master Quiz,6.8,Relentless Software,SCEA,Buzz! Master Quiz (USA).iso,864.4 MiB,248.0 GiB
Crash Tag Team Racing,6.8,Radical Entertainment,VU Games,Crash Tag Team Racing (USA) (v1.01).iso,1.4 GiB,249.5 GiB
Death Jr. II: Root of Evil,6.8,Backbone Entertainment,Konami,Death Jr. II - Root of Evil (USA) (v1.01).iso,697.8 MiB,250.2 GiB
Everyday Shooter,6.8,Backbone Entertainment,SCEA,Everyday Shooter (USA) (PSP) (PSN).iso,160.2 MiB,250.3 GiB
F1 2009,6.8,Sumo Digital,Codemasters,F1 2009 (USA).iso,652.7 MiB,251.0 GiB
FIFA Soccer 11,6.8,EA Sports,Electronic Arts,"FIFA Soccer 11 (USA) (En,Es) (v2.00).iso",1.6 GiB,252.6 GiB
Fighting Fantasy: The Warlock of Firetop Mountain (2011),6.8,Laughing Jackal,Laughing Jackal,Fighting Fantasy - The Warlock of Firetop Mountain (USA) (minis) (PSN).iso,151.8 MiB,252.7 GiB
Gungnir,6.8,Sting,Atlus,Gungnir (USA).iso,250.6 MiB,253.0 GiB
Hexyz Force,6.8,Sting,Atlus,Hexyz Force (USA).iso,675.8 MiB,253.6 GiB
Hysteria Project,6.8,Bulkypix,Sanuk Games,Hysteria Project (USA) (minis) (PSN).iso,188.3 MiB,253.8 GiB
Madden NFL 09,6.8,EA Tiburon,Electronic Arts,Madden NFL 09 (USA).iso,1.3 GiB,255.1 GiB
MX vs. ATV Unleashed,6.8,Rainbow Studios,THQ,MX vs. ATV Untamed (USA).iso,290.2 MiB,255.4 GiB
Mytran Wars,6.8,Stormregion,Deep Silver,"Mytran Wars (USA) (En,Fr,De,Es,It) (v1.04).iso",1.1 GiB,256.5 GiB
NBA 07,6.8,SCEA,SCEA,NBA 07 (USA).iso,595.0 MiB,257.1 GiB
NFL Street 3,6.8,EA Tiburon,EA Sports,NFL Street 3 (USA).iso,859.9 MiB,257.9 GiB
"Prinny 2: Dawn of Operation Panties, Dood!",6.8,Nippon Ichi Software,NIS America,"Prinny 2 - Dawn of Operation Panties, Dood! (USA).iso",758.3 MiB,258.7 GiB
Puyo Pop Fever,6.8,Sonic Team,Atlus,Puyo Pop Fever (Europe) (v1.01).iso,174.4 MiB,258.8 GiB
Riviera: The Promised Land,6.8,Sting,Atlus,Riviera - The Promised Land (USA).iso,1.0 GiB,259.9 GiB
Smash Court Tennis 3,6.8,Bandai Namco Games,Atari SA,Smash Court Tennis 3 (USA).iso,1.4 GiB,261.3 GiB
SNK Arcade Classics Vol. 1,6.8,SNK Playmore,SNK Playmore,SNK Arcade Classics Vol. 1 (USA) (v1.02).iso,1.3 GiB,262.6 GiB
Tenchu: Shadow Assassins,6.8,Acquire,Ubisoft,Tenchu - Shadow Assassins (USA) (v1.01).iso,776.2 MiB,263.3 GiB
The Legend of Heroes: A Tear of Vermillion,6.8,Microvision,Bandai,"Legend of Heroes, The - A Tear of Vermillion (USA) (v1.01).iso",638.9 MiB,263.9 GiB
UEFA EURO 2008,6.8,EA Canada,Electronic Arts,UEFA Euro 2008 (USA) (v1.01).iso,1.4 GiB,265.3 GiB
Untold Legends: Brotherhood of the Blade,6.8,Sony Online Entertainment,Sony Online Entertainment,Untold Legends - Brotherhood of the Blade (USA) (v1.02).iso,815.4 MiB,266.1 GiB
World Poker Tour (2005),6.8,Coresoft,2K Sports,World Poker Tour (USA) (v1.06).iso,579.7 MiB,266.7 GiB
WWE SmackDown vs. Raw 2008,6.8,Yuke's,THQ,WWE SmackDown vs. Raw 2008 (USA).iso,1.7 GiB,268.3 GiB
Zombie Tycoon,6.8,Frima Studio,Frima Studio,Zombie Tycoon (USA) (v3) (minis) (PSN).iso,190.0 MiB,268.5 GiB
Bust-A-Move Deluxe,6.7,Taito Corporation,Majesco,Bust-A-Move - Deluxe (USA).iso,67.0 MiB,268.6 GiB
Corpse Party: Book of Shadows,6.7,5pb,XSEED Games,Corpse Party - Book of Shadows (USA) (PSN).iso,1.3 GiB,269.9 GiB
Final Fantasy,6.7,TOSE,Square Enix,"Final Fantasy (Japan, Asia) (En,Ja).iso",188.9 MiB,270.1 GiB
Growlanser: Wayfarer of Time,6.7,Career Soft,Atlus,Growlanser - Wayfarer of Time (USA).iso,1.1 GiB,271.1 GiB
I Must Run!,6.7,Gamelion Studios,Gamelion Studios,I Must Run! (USA) (minis) (PSN).iso,113.7 MiB,271.3 GiB
Innocent Life: A Futuristic Harvest Moon,6.7,ArtePiazza,Natsume,Innocent Life - A Futuristic Harvest Moon (USA).iso,335.5 MiB,271.6 GiB
LEGO Pirates of the Caribbean: The Video Game,6.7,Traveller's Tales,Disney Interactive Studios,"LEGO Pirates of the Caribbean - The Video Game (USA) (En,Fr,Es).iso",1.4 GiB,273.0 GiB
Metal Slug XX,6.7,SNK Playmore,Atlus,Metal Slug XX (USA) (v1.01).iso,442.2 MiB,273.4 GiB
MTX Mototrax,6.7,Left Field Productions,Activision,MTX Mototrax (USA).iso,1018.4 MiB,274.4 GiB
MVP Baseball,6.7,EA Canada,Electronic Arts,MVP Baseball (USA) (v1.02).iso,1.3 GiB,275.7 GiB
PaRappa the Rapper,6.7,Epics,SCEA,PaRappa the Rapper (USA).iso,359.8 MiB,276.1 GiB
Pilot Academy,6.7,Kuju Entertainment,Marvelous Entertainment,"Pilot Academy (Europe) (En,Ja,Fr,De,Es,It) (v1.01).iso",313.1 MiB,276.4 GiB
Spider-Man 2 (2005),6.7,Vicarious Visions,Activision,Spider-Man 2 (USA) (v1.01).iso,556.5 MiB,276.9 GiB
The Bigs 2,6.7,Blue Castle Games,2K Sports,"Bigs 2, The (USA).iso",742.9 MiB,277.6 GiB
Tomb Raider: Legend,6.7,Crystal Dynamics,Eidos Interactive,Tomb Raider - Legend (USA) (PSP) (PSN).iso,1.4 GiB,279.0 GiB
"Warhammer 40,000: Squad Command",6.7,RedLynx,THQ,"Warhammer 40,000 - Squad Command (USA) (En,Fr) (v1.01).iso",475.8 MiB,279.5 GiB
WRC: FIA World Rally Championship (2006),6.7,Traveller's Tales,Namco Bandai Games,WRC - FIA World Rally Championship (USA) (v1.01).iso,1.2 GiB,280.7 GiB
Armored Core: Formula Front - Extreme Battle,6.6,From Software,Agetec,Armored Core - Formula Front - Extreme Battle (USA) (v1.02).iso,777.1 MiB,281.5 GiB
Black Rock Shooter: The Game,6.6,Imageepoch,NIS America,Black Rock Shooter - The Game (USA) (PSN).iso,1.3 GiB,282.8 GiB
Football Manager Handheld 2012,6.6,Sega,Sega,"Football Manager Handheld 2012 (Europe) (En,Fr,Es,It).iso",206.8 MiB,283.0 GiB
Frogger Helmet Chaos,6.6,Konami Computer Entertainment Hawaii,Konami,Frogger - Helmet Chaos (USA).iso,431.6 MiB,283.4 GiB
MediEvil: Resurrection,6.6,SCEE,SCEA,MediEvil - Resurrection (USA).iso,1.1 GiB,284.5 GiB
Monster Kingdom: Jewel Summoner,6.6,Gaia (Sony),Atlus,Monster Kingdom - Jewel Summoner (USA).iso,507.1 MiB,285.0 GiB
NASCAR (2006),6.6,EA Tiburon,EA Sports,NASCAR (USA) (v1.01).iso,703.8 MiB,285.7 GiB
Neopets Petpet Adventures: The Wand of Wishing,6.6,SCEA,SCEA,Neopets - Petpet Adventures - The Wand of Wishing (USA).iso,823.3 MiB,286.5 GiB
Obscure: The Aftermath,6.6,Hydravision,Ignition Entertainment,"Obscure - The Aftermath (USA) (En,Fr,Es).iso",942.0 MiB,287.4 GiB
One Epic Game,6.6,Grip Games,Grip Games,One Epic Game (USA) (minis) (PSN).iso,145.2 MiB,287.5 GiB
PoPoLoCrois,6.6,G-Artists,Agetec,PoPoLoCrois (USA).iso,1.2 GiB,288.7 GiB
Supermarket Mania,6.6,G5 Entertainment,G5 Entertainment,Supermarket Mania (USA) (minis) (PSN).iso,141.2 MiB,288.9 GiB
Tales of the World: Radiant Mythology,6.6,Alfa System,Namco Bandai Games,Tales of the World - Radiant Mythology (USA).iso,419.3 MiB,289.3 GiB
Vempire,6.6,impressionware,impressionware,Vempire (USA) (minis) (PSN).iso,136.8 MiB,289.4 GiB
Brothers in Arms: D-Day,6.5,Ubisoft Shanghai,Ubisoft,Brothers in Arms - D-Day (USA) (v1.01).iso,1.4 GiB,290.8 GiB
Capcom Puzzle World,6.5,Capcom,Capcom,Capcom Puzzle World (USA) (v1.02).iso,489.3 MiB,291.2 GiB
Dragon Ball Z: Shin Budokai - Another Road,6.5,Dimps Corporation,Atari SA,Dragon Ball Z - Shin Budokai Another Road (USA).iso,504.9 MiB,291.7 GiB
Dynasty Warriors: Strikeforce,6.5,Omega Force,Koei,Dynasty Warriors - Strikeforce (USA).iso,1.3 GiB,293.0 GiB
Fighting Fantasy: Talisman of Death,6.5,Laughing Jackal,SCEA,Fighting Fantasy - Talisman of Death (USA) (minis) (PSN).iso,150.9 MiB,293.2 GiB
Gretzky NHL 06,6.5,Page 44 Studios,SCEA,Gretzky NHL 06 (USA) (v1.02).iso,834.3 MiB,294.0 GiB
Halfbrick Rocket Racing,6.5,Halfbrick Studios,Halfbrick Studios,Rocket Racing (USA) (PSN).iso,178.7 MiB,294.2 GiB
Juiced: Eliminator,6.5,Juice Games,THQ,Juiced Eliminator (USA).iso,1.2 GiB,295.3 GiB
M.A.C.H. Modified Air Combat Heroes,6.5,VU Games,Sierra Entertainment,M.A.C.H. - Modified Air Combat Heroes (USA) (v1.01).iso,791.6 MiB,296.1 GiB
Metal Gear Solid: Portable Ops Plus,6.5,Kojima Productions,Konami,Metal Gear Solid - Portable Ops Plus (USA) (v1.01).iso,1.2 GiB,297.3 GiB
No Gravity: The Plague Of Mind,6.5,Realtech VR,Anozor SARL,No Gravity - The Plague of Mind (USA) (PSP) (PSN).iso,165.6 MiB,297.4 GiB
Phantom Brave,6.5,Nippon Ichi Software,NIS America,Phantom Brave Portable (Japan) (v1.01).iso,559.8 MiB,298.0 GiB
Prince of Persia: The Forgotten Sands,6.5,Ubisoft Montreal,Ubisoft,"Prince of Persia - The Forgotten Sands (USA) (En,Fr,Es) (v1.01).iso",659.4 MiB,298.6 GiB
Prince of Persia: Warrior Within,6.5,Ubisoft Montreal,Ubisoft,"Prince of Persia - Revelations (USA) (En,Fr,Es) (v1.01).iso",1.6 GiB,300.2 GiB
Puzzle Guzzle,6.5,Irem,Agetec,Puzzle Guzzle (USA) (v1.02).iso,117.5 MiB,300.3 GiB
Ragnarok Tactics,6.5,ApolloSoft,Aksys Games,Ragnarok Tactics (USA).iso,615.5 MiB,300.9 GiB
The Sims 2,6.5,Maxis,EA Games,"Sims 2, The (USA).iso",1.0 GiB,302.0 GiB
Untold Legends: The Warrior's Code,6.5,Sony Online Entertainment,Sony Online Entertainment,Untold Legends - The Warrior's Code (USA) (v1.02).iso,1004.9 MiB,302.9 GiB
World Championship Poker 2: Featuring Howard Lederer,6.5,Point of View,Crave,World Championship Poker 2 featuring Howard Lederer (USA) (v1.01).iso,197.5 MiB,303.1 GiB
Atari Classics Evolved,6.4,Stainless Games,Atari SA,Atari Classics Evolved (USA) (v1.02).iso,80.1 MiB,303.2 GiB
Call of Duty 3,6.4,Treyarch,Activision,Tales of Destiny 2 (Japan).iso,1.3 GiB,304.5 GiB
Chessmaster: Grandmaster Edition,6.4,Ubisoft,Ubisoft,,,
Crazy Taxi: Fare Wars,6.4,Sega,Sega,"Crazy Taxi - Fare Wars (USA) (En,Fr,De,Es,It) (v2.01).iso",530.2 MiB,305.0 GiB
Disgaea Infinite,6.4,Nippon Ichi Software,NIS America,Disgaea Infinite (USA) (v1.01).iso,267.3 MiB,305.3 GiB
Disney/Pixar Ratatouille,6.4,Asobo Studio,THQ,Disney-Pixar Ratatouille (Denmark).iso,864.4 MiB,306.1 GiB
Disney*Pixar WALL-E,6.4,Heavy Iron Studios,THQ,"Disney-Pixar WALL-E (United Arab Emirates) (En,Ar).iso",826.8 MiB,307.0 GiB
Hot Brain,6.4,Creat Studios,Midway,"Hot Brain (USA) (En,Fr,De,Es,It).iso",522.4 MiB,307.5 GiB
Naruto: Ultimate Ninja Heroes 2: The Phantom Fortress,6.4,CyberConnect2,Namco Bandai Games,Naruto - Ultimate Ninja Heroes 2 - The Phantom Fortress (USA).iso,1.1 GiB,308.6 GiB
NBA Live 07,6.4,EA Sports,EA Sports,NBA Live 07 (USA) (v1.01).iso,1.4 GiB,310.0 GiB
NBA Live 10,6.4,EA Canada,EA Sports,NBA Live 10 (USA) (v1.01).iso,1.6 GiB,311.6 GiB
Phantasy Star Portable,6.4,Alfa System,Sega,Phantasy Star Portable (USA).iso,1.0 GiB,312.6 GiB
Samurai Warriors: State of War,6.4,Omega Force,Koei,Samurai Warriors - State of War (USA) (v1.01).iso,312.4 MiB,312.9 GiB
Sonic Rivals,6.4,Backbone Entertainment,Sega,Sonic Rivals (USA).iso,234.7 MiB,313.2 GiB
Star Trek: Tactical Assault,6.4,Quicksilver Software,Bethesda Softworks,Star Trek - Tactical Assault (USA) (v1.01).iso,243.4 MiB,313.4 GiB
The Lord of the Rings: Tactics,6.4,Amaze Entertainment,EA Games,"Lord of the Rings, The - Tactics (USA).iso",528.5 MiB,313.9 GiB
The Sims 2: Castaway,6.4,Maxis,Electronic Arts,"Sims 2, The - Castaway (USA) (En,Fr,De,Es,It,Nl,Pt).iso",986.2 MiB,314.9 GiB
Wild ARMs XF,6.4,Media.Vision,XSEED Games,Wild Arms XF (USA).iso,1.6 GiB,316.4 GiB
Ys: The Ark of Napishtim,6.4,Konami Software Shanghai,Konami,Ys - The Ark of Napishtim (USA).iso,650.0 MiB,317.1 GiB
Assassin's Creed: Bloodlines,6.3,Griptonite Games,Ubisoft,"Assassin's Creed - Bloodlines (USA) (En,Fr,De,Es,It).iso",772.1 MiB,317.8 GiB
ATV Offroad Fury: Blazin' Trails,6.3,Climax Studios,SCEA,ATV Offroad Fury - Blazin' Trails (USA) (v1.01).iso,861.6 MiB,318.7 GiB
Bounty Hounds,6.3,Xpec,Namco Bandai Games,Bounty Hounds (USA).iso,1.1 GiB,319.7 GiB
Dragon Ball Z: Tenkaichi Tag Team,6.3,Spike,Namco Bandai Games,"Dragon Ball Z - Tenkaichi Tag Team (USA) (En,Fr,Es).iso",1.3 GiB,321.0 GiB
Final Fantasy II,6.3,TOSE,Square Enix,"Final Fantasy II (Japan, Asia) (En,Ja).iso",274.0 MiB,321.3 GiB
Go! Sudoku,6.3,Sumo Digital,Ubisoft,"Go! Sudoku (USA) (En,Fr,De,Es,It).iso",297.5 MiB,321.6 GiB
Indiana Jones and the Staff of Kings,6.3,Artificial Mind and Movement,LucasArts,Indiana Jones and the Staff of Kings (USA).iso,670.9 MiB,322.2 GiB
LEGO Star Wars III: The Clone Wars,6.3,Traveller's Tales,LucasArts,"LEGO Star Wars III - The Clone Wars (USA) (En,Fr,Es).iso",1.6 GiB,323.9 GiB
Major League Baseball 2K8,6.3,Kush Games,2K Sports,Major League Baseball 2K8 (USA) (v1.02).iso,1.5 GiB,325.4 GiB
Marvel Trading Card Game,6.3,Vicious Cycle,Konami,Marvel Trading Card Game (USA) (v1.02).iso,891.1 MiB,326.3 GiB
Miami Vice: The Game (2006),6.3,Rebellion,Sierra Entertainment,Miami Vice - The Game (USA) (v1.01).iso,330.6 MiB,326.6 GiB
Midway Arcade Treasures: Extended Play,6.3,Digital Eclipse,Midway,Midway Arcade Treasures - Extended Play (USA).iso,618.2 MiB,327.2 GiB
Split/Second,6.3,Black Rock Studio,Disney Interactive Studios,"Split-Second (USA) (En,Fr,Es).iso",1.5 GiB,328.7 GiB
Stacked with Daniel Negreanu,6.3,5000ft Inc.,Myelin Media,Stacked with Daniel Negreanu (USA) (v1.02).iso,864.2 MiB,329.5 GiB
Star Wars Battlefront: Elite Squadron,6.3,Savage Entertainment,LucasArts,"Star Wars Battlefront - Elite Squadron (USA) (En,Fr,De,Es,It).iso",1.4 GiB,330.9 GiB
The Con,6.3,SCEA,SCEA,"Con, The (USA).iso",818.5 MiB,331.7 GiB
The Legend of Heroes II: Prophecy of the Moonlight Witch,6.3,Microvision,Namco Bandai Games,"Legend of Heroes II, The - Prophecy of the Moonlight Witch (USA).iso",1.7 GiB,333.4 GiB
Undead Knights,6.3,Now Production,Tecmo,Undead Knights (USA) (v1.04).iso,484.0 MiB,333.8 GiB
Viewtiful Joe: Red Hot Rumble,6.3,Clover Studio,Capcom,Viewtiful Joe - Red Hot Rumble (USA).iso,626.2 MiB,334.5 GiB
WTF: Work Time Fun,6.3,SCEJ,D3Publisher,WTF - Work Time Fun (USA) (v1.01).iso,419.2 MiB,334.9 GiB
Ys Book I & II,6.3,Interchannel-Holon,Atlus,Ys I & II (Japan) (PCE) (PSN).iso,106.0 MiB,335.0 GiB
Aedis Eclipse: Generation of Chaos,6.2,Idea Factory,NIS America,Aedis Eclipse - Generation of Chaos (USA).iso,638.0 MiB,335.6 GiB
Arcade Darts,6.2,Icon Games,Icon Games,Arcade Darts (USA) (minis) (PSN).iso,138.2 MiB,335.7 GiB
Buzz! Quiz World,6.2,Relentless Software,SCEA,Buzz! Quiz World (USA) (PSP) (PSN).iso,1015.1 MiB,336.7 GiB
Dynasty Warriors (PSP),6.2,Omega Force,Koei,Dynasty Warriors (USA).iso,153.1 MiB,336.9 GiB
Fading Shadows,6.2,Ivolgamus,Agetec,"Fading Shadows (USA) (En,Fr,De,Es,It,Nl,Ru) (v1.03).iso",702.8 MiB,337.6 GiB
Gunpey DS,6.2,Q Entertainment,Namco Bandai Games,Gunpey (USA).iso,697.6 MiB,338.2 GiB
Harvey Birdman: Attorney at Law,6.2,High Voltage Software,Capcom,Harvey Birdman - Attorney at Law (USA).iso,1.6 GiB,339.8 GiB
Puzzle Chronicles,6.2,Konami,Konami,Puzzle Chronicles (USA).iso,384.3 MiB,340.2 GiB
Warriors Orochi,6.2,Omega Force,Koei,Warriors Orochi (USA).iso,864.3 MiB,341.1 GiB
Yu-Gi-Oh! GX Tag Force,6.2,Konami,Konami,Yu-Gi-Oh! GX - Tag Force (USA) (v1.03).iso,669.2 MiB,341.7 GiB
Blood Bowl,6.1,Cyanide,Focus Home Interactive,"Blood Bowl (USA) (En,Fr,De,Es,It) (v1.01).iso",222.9 MiB,341.9 GiB
Class of Heroes,6.1,Zerodiv,Atlus,Class of Heroes (USA) (v1.01).iso,324.9 MiB,342.2 GiB
Death Jr.,6.1,Backbone Entertainment,Konami,Death Jr. (USA) (v1.01).iso,415.0 MiB,342.7 GiB
Disney Pirates of the Caribbean: At World's End,6.1,Eurocom,Disney Interactive Studios,"Disney Pirates of the Caribbean - At World's End (Europe) (En,Fr,De,Es,It,Nl).iso",1.7 GiB,344.3 GiB
From Russia With Love,6.1,EA Redwood Shores,Electronic Arts,007 - From Russia with Love (USA).iso,698.6 MiB,345.0 GiB
Ghost in the Shell: Stand Alone Complex (2005),6.1,G-Artists,Bandai,Ghost in the Shell - Stand Alone Complex (USA) (v1.01).iso,756.5 MiB,345.7 GiB
Gretzky NHL,6.1,Page 44 Studios,SCEA,Gretzky NHL (USA).iso,146.1 MiB,345.9 GiB
Harvest Moon: Boy & Girl,6.1,Marvelous Entertainment,Natsume,Harvest Moon - Boy & Girl (USA).iso,325.7 MiB,346.2 GiB
Major League Baseball 2K7,6.1,Kush Games,2K Sports,Major League Baseball 2K7 (USA) (v1.01).iso,1.6 GiB,347.8 GiB
Micro Machines V4,6.1,Supersonic Software,Codemasters,Micro Machines V4 (USA) (v1.01).iso,574.1 MiB,348.3 GiB
Naruto Shippuden: Ultimate Ninja Heroes 3,6.1,CyberConnect2,Namco Bandai Games,Naruto Shippuden - Ultimate Ninja Heroes 3 (USA).iso,1.3 GiB,349.6 GiB
Pac-Man World 3,6.1,Blitz Games,Namco,Pac Man World 3 (USA) (v1.01).iso,471.3 MiB,350.1 GiB
Star Wars: Lethal Alliance,6.1,Ubisoft Montreal,Ubisoft,"Star Wars - Lethal Alliance (USA) (En,Fr,De,Es,It) (v1.02).iso",857.9 MiB,350.9 GiB
The King of Fighters Collection: The Orochi Saga,6.1,M2,SNK Playmore,"King of Fighters Collection, The - The Orochi Saga (USA).iso",1.4 GiB,352.3 GiB
Tom Clancy's Ghost Recon Advanced Warfighter 2,6.1,Red Storm Entertainment,Ubisoft,"Tom Clancy's Ghost Recon - Advanced Warfighter 2 (USA) (En,Fr,De,Es,It).iso",724.6 MiB,353.0 GiB
Unchained Blades,6.1,FuRyu,XSEED Games,Unchained Blades (USA) (PSN).iso,504.0 MiB,353.5 GiB
Astro Boy: The Video Game,6.0,High Voltage Software,D3Publisher,"Astro Boy - The Video Game (USA) (En,Fr,Es,It,Nl).iso",1.1 GiB,354.6 GiB
Ben 10: Protector of Earth,6.0,High Voltage Software,D3Publisher,Ben 10 - Protector of Earth (USA) (v1.01).iso,653.5 MiB,355.2 GiB
Blade Dancer: Lineage of Light,6.0,Hit Maker,NIS America,Blade Dancer - Lineage of Light (USA) (v1.01).iso,370.6 MiB,355.6 GiB
Cube (2007),6.0,Metia Interactive,D3Publisher,Cube (USA) (v1.01).iso,412.5 MiB,356.0 GiB
Generation of Chaos,6.0,Idea Factory,NIS America,Generation of Chaos (USA) (v1.02).iso,1.1 GiB,357.1 GiB
Hot Wheels: Ultimate Racing,6.0,Raylight Studios,DSI Games,"Hot Wheels Ultimate Racing (USA) (En,Fr,De,Es,It) (v1.02).iso",826.3 MiB,357.9 GiB
Jikandia: The Timeless Land,6.0,Opus Studio,Aksys Games,Jikandia - The Timeless Land (USA).iso,161.3 MiB,358.0 GiB
