title,score,developer,publisher,rom_name,size,running_total
God of War: Chains of Olympus,9.1,Ready at Dawn,SCEA,God of War - Chains of Olympus (USA).iso,1.5 GiB,1.5 GiB
Grand Theft Auto: Chinatown Wars,9.0,Rockstar Leeds,Rockstar Games,Grand Theft Auto - Chinatown Wars (USA) (v1.01).iso,862.4 MiB,2.3 GiB
Lumines,8.9,Q Entertainment,Ubisoft,Lumines (USA) (v1.01).iso,200.2 MiB,2.5 GiB
Metal Gear Solid: Peace Walker,8.9,Kojima Productions,Konami,"Metal Gear Solid - Peace Walker (USA) (En,Fr,Es) (v1.01).iso",1.5 GiB,4.1 GiB
Shin Megami Tensei: Persona 3 Portable,8.9,Atlus,Atlus,Shin Megami Tensei - Persona 3 Portable (USA) (Trade Demo).iso,1.2 GiB,5.3 GiB
Final Fantasy Tactics,8.8,TOSE,Square Enix,"Final Fantasy (Japan, Asia) (En,Ja).iso",188.9 MiB,5.5 GiB
Final Fantasy VII: Advent Children,8.8,Square Enix,Square Enix,"Final Fantasy II (Japan, Asia) (En,Ja).iso",274.0 MiB,5.7 GiB
Grand Theft Auto: Liberty City Stories,8.8,Rockstar Leeds,Rockstar Games,"Grand Theft Auto - Liberty City Stories (USA) (En,Fr,De,Es,It) (v3.00).iso",1.2 GiB,6.9 GiB
OMG Zombies,8.8,Laughing Jackal,Laughing Jackal,I Kill Zombies (USA) (minis) (PSN).iso,156.2 MiB,7.1 GiB
Ridge Racer,8.8,Namco,Namco,Ridge Racer (USA).iso,864.4 MiB,7.9 GiB
Tekken 5: Dark Resurrection,8.8,Namco Bandai Games,Namco Bandai Games,"Tekken - Dark Resurrection (USA) (En,Fr,De,Es,It).iso",1.6 GiB,9.5 GiB
Wipeout Pure,8.8,Studio Liverpool,SCEA,"WipEout Pure (USA) (En,Fr,Es) (v2.00).iso",241.2 MiB,9.8 GiB
Disgaea: Afternoon of Darkness,8.7,Nippon Ichi Software,Atlus,Disgaea - Afternoon of Darkness (USA).iso,924.9 MiB,10.7 GiB
Jeanne d'Arc,8.7,Level 5,SCEA,Jeanne d'Arc (USA).iso,1.2 GiB,11.8 GiB
LittleBigPlanet,8.7,Media Molecule,SCEA,"LittleBigPlanet (USA) (En,Fr,De,Es,It,Nl,Pt,Sv,No,Da,Fi,Pl).iso",1.4 GiB,13.2 GiB
Metal Gear Solid: Portable Ops,8.7,Kojima Productions,Konami,Metal Gear Solid - Portable Ops (USA) (v1.02).iso,1.3 GiB,14.5 GiB
Tactics Ogre: Let Us Cling Together,8.7,Square Enix,Square Enix,Tactics Ogre - Let Us Cling Together (USA).iso,1.5 GiB,16.1 GiB
Velocity,8.7,FuturLab,FuturLab,Velocity (USA) (minis) (PSN).iso,202.2 MiB,16.2 GiB
Burnout Legends,8.6,Criterion Games,EA Games,"Burnout Legends (USA) (En,Fr,De,Es,It,Nl) (v2.00).iso",482.5 MiB,16.7 GiB
God of War: Ghost of Sparta,8.6,Ready at Dawn,SCEA,"God of War - Ghost of Sparta (USA) (En,Fr,Es) (v2.00).iso",1.6 GiB,18.3 GiB
Grand Theft Auto: Vice City Stories,8.6,Rockstar Leeds,Rockstar Games,Grand Theft Auto - Vice City Stories (USA).iso,1.6 GiB,19.9 GiB
Patapon,8.6,SCE Japan Studio,SCEA,Patapon (USA).iso,325.2 MiB,20.2 GiB
PixelJunk Monsters Deluxe,8.6,Q-Games,SCEA,PixelJunk Monsters Deluxe (USA).iso,210.4 MiB,20.4 GiB
Daxter,8.5,Ready at Dawn,SCEA,Daxter (USA).iso,1.3 GiB,21.8 GiB
LocoRoco 2,8.5,SCE Japan Studio,SCEA,LocoRoco 2 (USA).iso,1.7 GiB,23.4 GiB
Ratchet & Clank: Size Matters,8.5,High Impact Games,SCEA,"Ratchet & Clank - Size Matters (USA) (En,Fr,De,Es,It) (v1.01).iso",916.8 MiB,24.3 GiB
Syphon Filter: Logan's Shadow,8.5,Sony Bend,SCEA,Syphon Filter - Logan's Shadow (USA).iso,1.2 GiB,25.5 GiB
Tetris (2010),8.5,EA Mobile,EA Mobile,Tetris (USA) (minis) (PSN).iso,162.2 MiB,25.7 GiB
Blast Off,8.4,Halfbrick Studios,Halfbrick Studios,Blast Off (USA) (v2) (minis) (PSN).iso,134.6 MiB,25.8 GiB
Half-Minute Hero,8.4,Opus,XSEED Games,Half-Minute Hero (USA).iso,211.8 MiB,26.0 GiB
Puzzle Quest: Challenge of the Warlords,8.4,1st Playable Productions,D3Publisher,Puzzle Quest - Challenge of the Warlords (USA) (Trade Demo).iso,86.2 MiB,26.1 GiB
Space Invaders Extreme,8.4,Taito Corporation,Square Enix,"Space Invaders Extreme (USA) (En,Fr,De,Es,It).iso",146.7 MiB,26.3 GiB
Virtua Tennis: World Tour,8.4,Sumo Digital,Sega,Virtua Tennis - World Tour (USA) (v1.02).iso,409.8 MiB,26.7 GiB
X-Men Legends II: Rise of Apocalypse,8.4,Raven Software,Activision,X-Men Legends II - Rise of Apocalypse (USA) (v1.01).iso,1.2 GiB,27.9 GiB
Crisis Core: Final Fantasy VII,8.3,Square Enix,Square Enix,Crisis Core - Final Fantasy VII (USA).iso,1.6 GiB,29.5 GiB
Crush (2007),8.3,Zoe Mode,Sega,"Crush (USA) (En,Fr,Es).iso",583.8 MiB,30.1 GiB
Disgaea 2: Dark Hero Days,8.3,Nippon Ichi Software,NIS America,Disgaea 2 - Dark Hero Days (USA) (v1.02).iso,757.1 MiB,30.8 GiB
FIFA Soccer 10,8.3,EA Sports,Electronic Arts,"FIFA Soccer 10 (USA) (En,Es).iso",1.6 GiB,32.4 GiB
Lego Star Wars II: The Original Trilogy,8.3,Traveller's Tales,LucasArts,LEGO Star Wars II - The Original Trilogy (USA).iso,1.1 GiB,33.6 GiB
LocoRoco Hi,8.3,SCE Japan Studio,SCEA,LocoRoco 2 (USA).iso,1.7 GiB,35.3 GiB
MLB 06: The Show,8.3,SCEA San Diego Studios,SCEA,MLB 06 - The Show (USA) (v1.01).iso,1.4 GiB,36.6 GiB
MLB 08: The Show,8.3,SCEA San Diego Studios,SCEA,MLB 08 - The Show (USA).iso,1.4 GiB,38.0 GiB
Tony Hawk's Underground 2 Remix,8.3,Neversoft Entertainment,Activision,Tony Hawk's Underground 2 Remix (USA) (v1.01).iso,1.1 GiB,39.1 GiB
Valkyria Chronicles II,8.3,Sega,Sega,Valkyria Chronicles II (USA).iso,1.0 GiB,40.1 GiB
BlazBlue: Calamity Trigger,8.2,Arc System Works,Aksys Games,"BlazBlue - Calamity Trigger Portable (USA) (En,Ja,Zh,Ko).iso",1.6 GiB,41.7 GiB
Hot Shots Golf: Open Tee 2,8.2,Clap Hanz,SCEA,Hot Shots Golf - Open Tee 2 (USA) (PSP) (PSN).iso,899.2 MiB,42.6 GiB
Kingdom Hearts: Birth by Sleep,8.2,Square Enix,Square Enix,"Kingdom Hearts - Birth by Sleep (USA) (En,Fr,Es).iso",1.6 GiB,44.2 GiB
Mega Man Powered Up,8.2,Capcom,Capcom,Mega Man - Powered Up (USA).iso,297.3 MiB,44.5 GiB
MLB 07: The Show,8.2,SCEA San Diego Studios,SCEA,MLB 07 - The Show (USA) (v1.01).iso,1.3 GiB,45.9 GiB
OutRun 2006: Coast 2 Coast,8.2,Sumo Digital,Sega,OutRun 2006 - Coast 2 Coast (USA) (v1.03).iso,605.4 MiB,46.5 GiB
Sega Genesis Collection,8.2,Digital Eclipse,Sega,Sega Genesis Collection (USA) (v1.01).iso,816.7 MiB,47.3 GiB
Sid Meier's Pirates!,8.2,Firaxis Games,Atari SA,"Sid Meier's Pirates! (USA) (En,Fr,De,Es,It) (v1.02).iso",318.0 MiB,47.6 GiB
SOCOM: U.S. Navy SEALs Fireteam Bravo,8.2,Zipper Interactive,SCEA,SOCOM - U.S. Navy SEALs - Fireteam Bravo (USA) (v1.01).iso,534.2 MiB,48.1 GiB
Tekken 6,8.2,Namco Bandai Games,Namco Bandai Games,"Tekken 6 (USA) (En,Fr,De,Es,It,Ru).iso",816.0 MiB,48.9 GiB
Wipeout Pulse,8.2,Studio Liverpool,SCEA,"WipEout Pulse (USA) (En,Fr,De,Es,It) (Promo).iso",435.8 MiB,49.3 GiB
A Space Shooter for 2 Bucks,8.1,Frima Studio,Frima Studio,"Space Shooter for Two Bucks!, A (USA) (v2) (minis) (PSN).iso",189.2 MiB,49.5 GiB
Coconut Dodge,8.1,FuturLab,FuturLab,Coconut Dodge (USA) (minis) (PSN).iso,139.1 MiB,49.6 GiB
Fieldrunners,8.1,Subatomic Studios,Subatomic Studios,Fieldrunners (USA) (minis) (PSN).iso,158.4 MiB,49.8 GiB
Hot Shots Golf: Open Tee,8.1,Clap Hanz,SCEA,Hot Shots Golf - Open Tee (USA) (v2.00).iso,438.4 MiB,50.2 GiB
Lumines II,8.1,Q Entertainment,Buena Vista Games,Lumines II (USA).iso,1.1 GiB,51.3 GiB
Marvel: Ultimate Alliance,8.1,Raven Software,Activision,Marvel - Ultimate Alliance (USA) (v2.00).iso,1.7 GiB,53.0 GiB
Monster Hunter Freedom Unite,8.1,Capcom,Capcom,"Monster Hunter Freedom Unite (USA) (En,Fr,De,Es,It).iso",845.6 MiB,53.8 GiB
Patapon 2,8.1,SCE Japan Studio,SCEA,"Patapon 2 (USA) (En,Fr,Es) (PSN & Store).iso",559.5 MiB,54.3 GiB
Pinball Fantasies,8.1,Cowboy Rodeo,Cowboy Rodeo,Pinball Fantasies (USA) (minis) (PSN).iso,113.1 MiB,54.4 GiB
Race Driver 2006,8.1,Sumo Digital,Codemasters,Race Driver 2006 (USA) (v1.01).iso,1.6 GiB,56.0 GiB
Resistance: Retribution,8.1,Sony Bend,SCEA,"Resistance - Retribution (USA) (En,Ja,Fr,Es).iso",1.6 GiB,57.6 GiB
SOCOM: U.S. Navy SEALs Fireteam Bravo 2,8.1,Zipper Interactive,SCEA,SOCOM - U.S. Navy SEALs - Fireteam Bravo 2 (USA).iso,882.0 MiB,58.5 GiB
The 2D Adventures of Rotating Octopus Character,8.1,Dakko Dakko,Dakko Dakko,"2D Adventures of Rotating Octopus Character, The (USA) (minis) (PSN).iso",138.2 MiB,58.6 GiB
The Warriors,8.1,Rockstar Toronto,Rockstar Games,"Warriors, The (USA) (v1.02).iso",1.7 GiB,60.3 GiB
Where is My Heart?,8.1,Die Gute Fabrik,Copenhagen Game Collective,Where is my Heart (USA) (minis) (PSN).iso,195.6 MiB,60.5 GiB
Winning Eleven: Pro Evolution Soccer 2007,8.1,KCET,Konami,"Winning Eleven - Pro Evolution Soccer 2007 (USA) (En,Es) (v1.01).iso",1.1 GiB,61.5 GiB
WWE SmackDown! vs. Raw 2006,8.1,Yuke's,THQ,"WWE SmackDown vs. Raw 2006 (Europe) (En,Fr,De,Es,It).iso",1.6 GiB,63.1 GiB
Z.H.P. Unlosing Ranger vs Darkdeath Evilman,8.1,Nippon Ichi Software,NIS America,Z.H.P. - Unlosing Ranger vs Darkdeath Evilman (Europe) (PSN).iso,823.3 MiB,63.9 GiB
Beaterator,8.0,Rockstar Leeds,Rockstar Games,Beaterator (USA) (v1.01).iso,1.0 GiB,64.9 GiB
Castlevania: The Dracula X Chronicles,8.0,Konami,Konami,Castlevania - The Dracula X Chronicles (USA) (v1.02).iso,1.0 GiB,66.0 GiB
FIFA 07 Soccer,8.0,EA Sports,EA Sports,FIFA Soccer (USA) (v1.02).iso,1.2 GiB,67.1 GiB
Gitaroo Man Lives!,8.0,Koei/Inis,Koei,Gitaroo Man Lives! (USA).iso,1.6 GiB,68.7 GiB
Hot Shots Tennis: Get a Grip,8.0,Clap Hanz,SCEA,Hot Shots Tennis - Get a Grip (USA) (v1.01).iso,1.2 GiB,69.9 GiB
Lunar: Silver Star Harmony,8.0,Game Arts,XSEED Games,Lunar - Silver Star Harmony (USA).iso,933.5 MiB,70.8 GiB
Metal Gear Acid 2,8.0,Kojima Productions,Konami,Metal Gear Ac!d 2 (USA).iso,874.8 MiB,71.7 GiB
MLB,8.0,989 Sports,SCEA,MLB (USA).iso,1.1 GiB,72.7 GiB
NBA Live 06,8.0,EA Canada,EA Sports,NBA Live 06 (USA).iso,1.2 GiB,73.9 GiB
Pro Evolution Soccer 2008,8.0,Konami,Konami,"Pro Evolution Soccer 2008 (USA) (En,Fr,Es).iso",1.3 GiB,75.2 GiB
SoulCalibur: Broken Destiny,8.0,Project Soul,Namco Bandai Games,"Soulcalibur - Broken Destiny (USA) (En,Ja,Fr,De,Es,It,Ru).iso",859.2 MiB,76.0 GiB
Street Fighter Alpha 3,8.0,Capcom,Capcom,Street Fighter Alpha 3 Max (USA).iso,235.4 MiB,76.3 GiB
Test Drive Unlimited,8.0,Eden Studios,Atari SA,Test Drive Unlimited (USA).iso,1.4 GiB,77.7 GiB
Tiger Woods PGA Tour 06,8.0,EA Sports,EA Sports,Tiger Woods PGA Tour 06 (USA) (v1.01).iso,1.2 GiB,78.9 GiB
Valkyrie Profile,8.0,TOSE,Square Enix,Valkyrie Profile - Lenneth (USA).iso,677.5 MiB,79.6 GiB
Worms: Open Warfare 2,8.0,Team17,THQ,Worms - Open Warfare 2 (USA) (v1.02).iso,187.1 MiB,79.8 GiB
Ys: The Oath in Felghana,8.0,Falcom,XSEED Games,Ys - The Oath in Felghana (USA).iso,1.0 GiB,80.8 GiB
Age of Zombies,7.9,Halfbrick Studios,Halfbrick Studios,Age of Zombies (USA) (minis) (PSN).iso,135.6 MiB,80.9 GiB
Def Jam: Fight for NY,7.9,Aki Corp.,EA Games,Def Jam - Fight for NY - The Takeover (USA) (v1.01).iso,1.5 GiB,82.4 GiB
Dissidia: Final Fantasy,7.9,Square Enix,Square Enix,Dissidia Final Fantasy (Japan).iso,1.5 GiB,83.9 GiB
echochrome,7.9,SCE Japan Studio,SCEA,Echochrome (USA) (PSP) (PSN).iso,176.5 MiB,84.1 GiB
FIFA 08 Soccer,7.9,EA Canada,EA Sports,FIFA Soccer (USA) (v1.02).iso,1.2 GiB,85.2 GiB
Floating Cloud God Saves the Pilgrims,7.9,Dakko Dakko,Dakko Dakko,Floating Cloud God Saves the Pilgrims (USA) (minis) (PSN).iso,127.8 MiB,85.3 GiB
Hakuoki: Demon of the Fleeting Blossom,7.9,Idea Factory,Aksys Games,Hakuoki - Demon of the Fleeting Blossom (USA).iso,1.1 GiB,86.5 GiB
Halfbrick Echoes,7.9,Halfbrick Studios,Halfbrick Studios,,,
Legends of War: Patton's Campaign,7.9,Enigma Software Productions,Enigma Software Productions,Legends of War - Patton's Campaign (USA) (PSP) (PSN).iso,767.4 MiB,87.2 GiB
Mega Man Maverick Hunter X,7.9,Capcom,Capcom,Mega Man - Maverick Hunter X (USA) (v1.01).iso,448.7 MiB,87.6 GiB
Midnight Club: LA Remix,7.9,Rockstar London,Rockstar Games,Midnight Club - L.A. Remix (USA) (v2.02).iso,894.8 MiB,88.5 GiB
MLB 10: The Show,7.9,SCEA,SCEA,MLB 10 - The Show (USA).iso,1.4 GiB,89.9 GiB
MotorStorm: Arctic Edge,7.9,Bigbig Studios,SCEA,"MotorStorm - Arctic Edge (USA) (En,Fr,De,Es,It,Nl,Pt,Ru).iso",830.5 MiB,90.7 GiB
N+,7.9,Slick Entertainment,Microsoft Game Studios,N+ (USA) (v1.02).iso,105.8 MiB,90.8 GiB
NBA 09 The Inside,7.9,SCEA San Diego Studios,SCEA,NBA 09 - The Inside (USA).iso,1.0 GiB,91.8 GiB
Rock Band Unplugged,7.9,Backbone Entertainment,Electronic Arts,Rock Band Unplugged (USA).iso,1.3 GiB,93.0 GiB
SSX On Tour,7.9,EA Canada,EA Sports Big,"SSX - On Tour (USA) (En,Fr,De).iso",1.3 GiB,94.4 GiB
The Legend of Heroes: Trails in the Sky,7.9,Falcom,XSEED Games,"Legend of Heroes, The - Trails in the Sky (USA).iso",1.3 GiB,95.7 GiB
Twisted Metal: Head-On,7.9,Incognito Inc.,SCEA,Twisted Metal - Head-On (USA).iso,799.8 MiB,96.5 GiB
Virtua Tennis 3,7.9,Sega AM3,Sega,"Virtua Tennis 3 (USA) (En,Ja,Fr,De,Es,It) (v1.02).iso",555.2 MiB,97.0 GiB
Wizorb,7.9,Beatshapers,Beatshapers,Wizorb (USA) (minis) (PSN).iso,187.8 MiB,97.2 GiB
Ys Seven,7.9,Falcom,XSEED Games,Ys Seven (USA).iso,728.4 MiB,97.9 GiB
Brandish: The Dark Revenant,7.8,Falcom,XSEED Games,Brandish - The Dark Revenant (USA) (PSP) (PSN).iso,381.3 MiB,98.3 GiB
Cladun: This is an RPG,7.8,System Prisma,NIS America,Cladun - This is an RPG! (USA) (PSP) (PSN).iso,291.3 MiB,98.6 GiB
Crimson Gem Saga,7.8,"IronNos Co.,Ltd.",Atlus,Crimson Gem Saga (USA).iso,837.9 MiB,99.4 GiB
Dissidia 012: Duodecim Final Fantasy,7.8,Square Enix,Square Enix,"Dissidia 012 - Duodecim Final Fantasy (USA) (En,Fr,De,Es,It).iso",1.6 GiB,101.0 GiB
Gurumin: A Monstrous Adventure,7.8,Falcom,Mastiff,Gurumin - A Monstrous Adventure (USA).iso,1014.7 MiB,102.0 GiB
Madden NFL 07,7.8,EA Tiburon,EA Sports,Madden NFL 07 (USA).iso,1.5 GiB,103.5 GiB
Mercury Meltdown,7.8,Ignition Entertainment,Ignition Entertainment,"Mercury Meltdown (USA) (En,Fr,Es) (v1.01).iso",343.9 MiB,103.8 GiB
Metal Gear Solid: Digital Graphic Novel,7.8,Kojima Productions,Konami,Metal Gear Solid - Digital Graphic Novel (USA) (v1.01).iso,932.8 MiB,104.7 GiB
Metal Slug Anthology,7.8,Terminal Reality,SNK Playmore,Metal Slug Anthology (USA) (v1.03).iso,1.2 GiB,106.0 GiB
MLB 09: The Show,7.8,SCEA San Diego Studios,SCEA,MLB 09 - The Show (USA) (v1.01).iso,1.4 GiB,107.3 GiB
Pinball Hall of Fame: The Williams Collection,7.8,Farsight Studios,System 3,Pinball Hall of Fame - The Williams Collection (USA).iso,374.3 MiB,107.7 GiB
Shin Megami Tensei: Persona,7.8,ITL,Atlus,Shin Megami Tensei - Persona (USA).iso,782.7 MiB,108.5 GiB
Silent Hill: Origins,7.8,Climax Studios,Konami,Silent Hill Origins (USA) (PSN).iso,767.4 MiB,109.2 GiB
Tiger Woods PGA Tour 07,7.8,EA Redwood Shores,EA Sports,Tiger Woods PGA Tour 07 (USA).iso,1.2 GiB,110.4 GiB
Tiger Woods PGA Tour 2005,7.8,EA Sports,EA Sports,Tiger Woods PGA Tour 10 (USA).iso,1.4 GiB,111.7 GiB
Tomb Raider: Anniversary,7.8,Crystal Dynamics,Eidos Interactive,"Tomb Raider - Anniversary (USA) (En,Fr,De,Es,It) (v1.02).iso",1.2 GiB,113.0 GiB
Traxxpad,7.8,Definitive Studios,Eidos Interactive,,,
World Soccer Winning Eleven 9,7.8,KCET,Konami,World Soccer Winning Eleven 9 (USA) (v1.02).iso,930.9 MiB,113.9 GiB
WWE SmackDown vs. Raw 2007,7.8,Yuke's,THQ,WWE SmackDown vs. Raw 2007 (USA).iso,1.5 GiB,115.4 GiB
Angry Birds,7.7,Abstraction Games,Chillingo,Angry Birds (USA) (v2) (minis) (PSN).iso,161.4 MiB,115.5 GiB
Aqua Panic,7.7,EKO Software,Atari SA,"Aqua Panic (Europe) (En,Fr,De,Es,It,Nl,Pt,Ru) (PSN).iso",496.3 MiB,116.0 GiB
BlazBlue: Continuum Shift II,7.7,Arc System Works,Aksys Games,"BlazBlue - Continuum Shift II (USA) (En,Ja,Zh,Ko) (v1.01).iso",1.5 GiB,117.6 GiB
Class of Heroes 2,7.7,Zerodiv,MonkeyPaw Games,Class of Heroes 2 (USA) (v1.01).iso,660.0 MiB,118.2 GiB
DJ Max Fever,7.7,Pentavision Entertainment,PM Studios Inc.,DJ Max Fever (USA) (v1.03).iso,1.6 GiB,119.8 GiB
Exit (2008),7.7,Taito Corporation,Ubisoft,"Exit 2 (Europe) (En,Fr,De,Es,It) (v1.01).iso",157.0 MiB,120.0 GiB
Field Commander,7.7,Sony Online Entertainment,Sony Online Entertainment,Field Commander (USA).iso,1.1 GiB,121.1 GiB
FIFA 06: Road to FIFA World Cup,7.7,EA Canada,EA Sports,,,
Final Fantasy IV: The Complete Collection,7.7,Bullets,Square Enix,"Final Fantasy IV - The Complete Collection (USA) (En,Ja,Fr).iso",840.0 MiB,121.9 GiB
Football Manager 2011,7.7,Sports Interactive,Sega,"Football Manager Handheld 2011 (Europe) (En,Fr,Es,It) (v1.02).iso",203.9 MiB,122.1 GiB
Guilty Gear Judgment,7.7,Arc System Works,Majesco,Guilty Gear Judgment (USA) (v1.01).iso,572.8 MiB,122.7 GiB
Killzone: Liberation,7.7,Guerrilla,SCEA,"Killzone - Liberation (USA) (En,Fr,De,Es,It,Nl,Pl,Ru).iso",554.7 MiB,123.2 GiB
MLB 11: The Show,7.7,SCEA San Diego Studios,SCEA,MLB 11 - The Show (USA).iso,1.3 GiB,124.5 GiB
1000 Tiny Claws,7.6,Mediatonic,Mediatonic,1000 Tiny Claws (USA) (minis) (PSN).iso,194.0 MiB,124.7 GiB
Alien Zombie Death,7.6,PomPom Games,PomPom Games,Alien Zombie Death (USA) (minis) (PSN).iso,132.3 MiB,124.8 GiB
Brave Story: New Traveler,7.6,Game Republic,XSEED Games,Brave Story - New Traveler (USA) (v1.01).iso,184.4 MiB,125.0 GiB
Burnout Dominator,7.6,Criterion Games,Electronic Arts,Burnout Dominator (USA).iso,659.1 MiB,125.7 GiB
Gradius Collection,7.6,M2,Konami,Gradius Collection (USA) (v1.01).iso,333.2 MiB,126.0 GiB
Lego Indiana Jones: The Original Adventures,7.6,Traveller's Tales,LucasArts,"LEGO Indiana Jones - The Original Adventures (USA) (En,Fr,Es).iso",1.2 GiB,127.1 GiB
Lemmings (2006),7.6,Team17,SCEA,Lemmings (USA) (v1.01).iso,449.7 MiB,127.6 GiB
Mad Blocker Alpha: Revenge of the Fluzzles,7.6,Open Emotion Studios,Open Emotion Studios,Mad Blocker Alpha - Revenge of the Fluzzles (Europe) (v3) (minis) (PSN).iso,133.0 MiB,127.7 GiB
Me Monstar: Hear Me Roar!,7.6,Cohort Studios,Cohort Studios,Me Monstar - Hear Me Roar! (USA) (minis) (PSN).iso,169.8 MiB,127.9 GiB
NHL 07,7.6,EA Sports,EA Sports,NHL 07 (USA) (v1.01).iso,1.6 GiB,129.5 GiB
Pix'n Love Rush,7.6,Pasta Games,Bulkypix,Pix'n Love Rush (USA) (minis) (PSN).iso,149.0 MiB,129.7 GiB
Shift Extended,7.6,Zallag,Zallag,Shift Extended (USA) (minis) (PSN).iso,116.1 MiB,129.8 GiB
Snoopy vs. the Red Baron,7.6,Smart Bomb Interactive,Namco Bandai Games,Snoopy vs the Red Baron (USA).iso,515.8 MiB,130.3 GiB
The Legend of Heroes: Trails in the Sky SC,7.6,Falcom,XSEED Games,"Legend of Heroes, The - Trails in the Sky (USA).iso",1.3 GiB,131.6 GiB
Ultimate Block Party,7.6,Magicpot,Conspiracy Entertainment,Ultimate Block Party (USA) (v1.02).iso,136.1 MiB,131.7 GiB
Who's That Flying?!,7.6,Mediatonic,SCEA,Who's That Flying (USA) (minis) (PSN).iso,192.7 MiB,131.9 GiB
Ace Combat X: Skies of Deception,7.5,Project Aces ,Namco Bandai Games,Ace Combat X - Skies of Deception (USA).iso,1.0 GiB,133.0 GiB
Activision Hits Remixed,7.5,Digital Eclipse,Activision,Activision Hits Remixed (USA) (v1.01).iso,264.8 MiB,133.2 GiB
Archer Maclean's Mercury,7.5,Awesome Studios,Ignition Entertainment,Archer Maclean's Mercury (USA).iso,275.9 MiB,133.5 GiB
Capcom Classics Collection Reloaded,7.5,Klein Computer Entertainment,Capcom,Capcom Classics Collection Reloaded (USA).iso,603.8 MiB,134.1 GiB
Dead Head Fred,7.5,Vicious Cycle,D3Publisher,Dead Head Fred (USA) (v1.02).iso,1.3 GiB,135.4 GiB
Dracula: Undead Awakening,7.5,Chillingo,Chillingo,Dracula - Undead Awakening (USA) (minis) (PSN).iso,145.0 MiB,135.5 GiB
echoshift,7.5,SCEJ,SCEA,Echoshift (USA) (PSP) (PSN).iso,277.6 MiB,135.8 GiB
Knights in the Nightmare,7.5,Sting,Atlus,Knights in the Nightmare (USA).iso,485.5 MiB,136.3 GiB
Madden NFL 06,7.5,EA Tiburon,EA Sports,Madden NFL 06 (USA).iso,1.6 GiB,137.9 GiB
Madden NFL 08,7.5,EA Tiburon,EA Sports,Madden NFL 08 (USA).iso,1.5 GiB,139.3 GiB
Me & My Katamari,7.5,Namco,Namco,Me & My Katamari (USA).iso,1.6 GiB,141.0 GiB
Metal Gear Acid,7.5,Konami,Konami,Metal Gear Ac!d (USA).iso,192.1 MiB,141.2 GiB
NBA 08,7.5,SCEA San Diego Studios,SCEA,NBA 08 (USA).iso,864.3 MiB,142.0 GiB
NBA Street Showdown,7.5,EA Canada,EA Sports Big,NBA Street Showdown (USA).iso,1.1 GiB,143.1 GiB
NCAA Football 07,7.5,EA Sports,EA Sports,NCAA Football 07 (USA) (v2.00).iso,1.5 GiB,144.6 GiB
Persona 2: Innocent Sin,7.5,ITL,Atlus,Persona 2 - Tsumi - Innocent Sin (Japan).iso,1.0 GiB,145.7 GiB
Pro Evolution Soccer 2009,7.5,KCET,Konami,"Pro Evolution Soccer 2009 (USA) (En,Fr,Es,Pt) (v1.01).iso",1.3 GiB,147.0 GiB
Pursuit Force,7.5,Bigbig Studios,SCEA,Pursuit Force (USA).iso,1.4 GiB,148.4 GiB
Puzzle Scape Mini,7.5,Farmind Ltd,Farmind Ltd,Puzzle Scape (USA) (v1.04).iso,330.1 MiB,148.7 GiB
Star Ocean: Second Evolution,7.5,TOSE,Square Enix,Star Ocean - Second Evolution (USA).iso,1.3 GiB,150.1 GiB
Blimp: The Flying Adventures,7.4,Craneballs Studios,Craneballs Studios,Blimp - The Flying Adventures (USA) (minis) (PSN).iso,198.0 MiB,150.2 GiB
Chili Con Carnage,7.4,Deadline Games,Eidos Interactive,Chili Con Carnage (USA) (v1.02).iso,760.2 MiB,151.0 GiB
ClaDun x2,7.4,System Prisma,NIS America,Cladun x2 (USA) (PSP) (PSN).iso,465.0 MiB,151.4 GiB
Darkstalkers Chronicle: The Chaos Tower,7.4,Capcom,Capcom,Darkstalkers Chronicle - The Chaos Tower (USA).iso,660.5 MiB,152.1 GiB
Dungeon Siege: Throne of Agony,7.4,SuperVillain Studios,Take-Two Interactive,Dungeon Siege - Throne of Agony (USA) (v1.02).iso,633.0 MiB,152.7 GiB
Every Extend Extra,7.4,Q Entertainment,Buena Vista Games,Every Extend Extra (USA).iso,357.3 MiB,153.1 GiB
Fat Princess,7.4,Titan Studios,SCEA,Glass Heart Princess (Japan) (v1.02).iso,1.6 GiB,154.7 GiB
Fight Night Round 3,7.4,EA Chicago,EA Sports,Fight Night Round 3 (USA).iso,1.1 GiB,155.7 GiB
FlatOut: Head On,7.4,Bugbear,Empire Interactive,FlatOut - Head On (USA) (v1.01).iso,429.7 MiB,156.2 GiB
Freekscape: Escape From Hell,7.4,Kidguru Studios,Creat Studios,Freekscape - Escape From Hell (USA) (minis) (PSN).iso,205.2 MiB,156.4 GiB
Gran Turismo: The Real Driving Simulator,7.4,Polyphony Digital,SCEA,,,
Harvest Moon: Hero of Leaf Valley,7.4,Hyde,Natsume,Harvest Moon - Hero of Leaf Valley (USA).iso,401.9 MiB,156.8 GiB
Infected (2005),7.4,Planet Moon Studios,Majesco,Infected (USA) (v1.02).iso,562.7 MiB,157.3 GiB
Midnight Club 3: DUB Edition,7.4,Rockstar San Diego,Rockstar Games,Midnight Club 3 - DUB Edition (USA) (v2.02).iso,1.5 GiB,158.8 GiB
Need for Speed Underground Rivals,7.4,Team Fusion,EA Games,Need for Speed - Underground Rivals (USA).iso,843.8 MiB,159.7 GiB
Patapon 3,7.4,SCE Japan Studio,SCEA,"Patapon 3 (USA) (En,Fr,Es,Pt).iso",530.2 MiB,160.2 GiB
Pipe Mania,7.4,Razorworks,Empire Interactive,"Pipe Mania (USA) (En,Fr) (FW3.95).iso",306.9 MiB,160.5 GiB
Power Stone Collection,7.4,Capcom,Capcom,Power Stone Collection (USA).iso,493.4 MiB,161.0 GiB
PQ2: Practical Intelligence Quotient,7.4,Now Production,D3Publisher,PQ - Practical Intelligence Quotient (USA) (v1.01).iso,170.4 MiB,161.1 GiB
Prince of Persia Rival Swords,7.4,Ubisoft Montreal,Ubisoft,"Prince of Persia - Rival Swords (USA) (En,Fr,Es) (v1.01).iso",1.2 GiB,162.3 GiB
Pro Evolution Soccer 2011,7.4,Konami,Konami,"Pro Evolution Soccer 2011 (USA) (En,Es).iso",1.4 GiB,163.7 GiB
Pro Evolution Soccer 2012,7.4,Konami,Konami,"Pro Evolution Soccer 2012 (USA) (En,Fr,Es,Pt) (v1.01).iso",1.7 GiB,165.4 GiB
Sega Rally Revo,7.4,SEGA Racing Studio,Sega,Sega Rally Revo (USA).iso,188.1 MiB,165.5 GiB
SOCOM: U.S. Navy SEALs Fireteam Bravo 3,7.4,Slant Six,SCEA,SOCOM - U.S. Navy SEALs - Fireteam Bravo 3 (USA) (v1.01).iso,1.3 GiB,166.9 GiB
Star Ocean: First Departure,7.4,TOSE,Square Enix,Star Ocean - First Departure (USA).iso,1.1 GiB,168.0 GiB
Summon Night 5,7.4,Felistella,GAIJINWORKS,Summon Night 5 (USA).iso,855.7 MiB,168.8 GiB
UFC Undisputed 2010,7.4,Yuke's,THQ,UFC Undisputed 2010 (USA).iso,1.6 GiB,170.4 GiB
After Burner: Black Falcon,7.3,Planet Moon Studios,Sega,"After Burner - Black Falcon (USA) (En,Fr,Es,It,Nl).iso",407.6 MiB,170.8 GiB
Bomberman (2006),7.3,Hudson,Konami,Bomberman (USA).iso,104.9 MiB,170.9 GiB
FIFA Soccer 2005,7.3,EA Canada,EA Sports,"FIFA Soccer 12 (USA) (En,Es).iso",1.6 GiB,172.5 GiB
Flying Hamster,7.3,The Game Atelier,The Game Atelier,Flying Hamster (USA) (minis) (PSN).iso,158.2 MiB,172.6 GiB
Gun,7.3,Neversoft Entertainment,Activision,Gunpey (USA).iso,697.6 MiB,173.3 GiB
Hammerin' Hero,7.3,Irem,Atlus,Hammerin' Hero (USA).iso,217.4 MiB,173.5 GiB
Juiced 2: Hot Import Nights,7.3,Juice Games,THQ,Juiced 2 - Hot Import Nights (USA) (v1.02).iso,1.1 GiB,174.6 GiB
LEGO Batman: The Videogame,7.3,Traveller's Tales,Warner Bros. Interactive Entertainment,"LEGO Batman - The Videogame (USA) (En,Fr,Es).iso",1.1 GiB,175.7 GiB
LocoRoco Midnight Carnival,7.3,SCE Japan Studio,SCEA,"LocoRoco - Midnight Carnival (USA) (En,Ja,Fr,De,Es,It,Nl,Pt,Sv,No,Da,Fi,Zh,Ko,Ru) (PSP) (PSN).iso",309.1 MiB,176.0 GiB
ModNation Racers,7.3,United Front Games,SCEA,"ModNation Racers (USA) (En,Fr,Es).iso",1.5 GiB,177.5 GiB
Namco Museum Battle Collection,7.3,TOSE,Namco,"Namco Museum Battle Collection (Europe) (En,Fr,De,Es,It).iso",533.3 MiB,178.0 GiB
NBA Live 08,7.3,EA Canada,EA Sports,NBA Live 08 (USA).iso,1.5 GiB,179.5 GiB
Need for Speed: Carbon,7.3,EA Canada,EA Games,Need for Speed Carbon - Own the City (USA).iso,852.8 MiB,180.4 GiB
NFL Street 2 Unleashed,7.3,EA Tiburon,EA Sports Big,NFL Street 2 Unleashed (USA) (v1.02).iso,663.6 MiB,181.0 GiB
Pinball Hall of Fame: The Gottlieb Collection,7.3,Farsight Studios,Crave,Pinball Hall of Fame - The Gottlieb Collection (USA).iso,251.9 MiB,181.2 GiB
Pursuit Force: Extreme Justice,7.3,Bigbig Studios,SCEA,"Pursuit Force - Extreme Justice (USA) (En,Fr,Es).iso",1.4 GiB,182.6 GiB
Silent Hill: Shattered Memories,7.3,Climax Studios,Konami,Silent Hill - Shattered Memories (USA).iso,967.0 MiB,183.5 GiB
Star Wars Battlefront: Renegade Squadron,7.3,Rebellion,LucasArts,Star Wars Battlefront - Renegade Squadron (USA).iso,887.4 MiB,184.4 GiB
"What Did I Do to Deserve This, My Lord!? 2",7.3,Acquire,NIS America,"What Did I Do to Deserve This, My Lord! 2 (USA) (v1.01).iso",309.9 MiB,184.7 GiB
Yggdra Union: We'll Never Fight Alone,7.3,Sting,Atlus,Yggdra Union - We'll Never Fight Alone (USA).iso,733.1 MiB,185.4 GiB
Capcom Classics Collection Remixed,7.2,Digital Eclipse,Capcom,Capcom Classics Collection Remixed (USA).iso,545.5 MiB,186.0 GiB
Carol Vorderman's Sudoku,7.2,Empire Interactive,Eidos Interactive,"Carol Vorderman's Sudoku (USA) (En,Fr,De,Es,It) (v1.01).iso",409.8 MiB,186.4 GiB
Fate/Unlimited Codes,7.2,Eighting,Capcom,Fate-Unlimited Codes (USA) (PSP) (PSN).iso,704.2 MiB,187.1 GiB
FIFA World Cup: Germany 2006,7.2,EA Canada,Electronic Arts,FIFA World Cup - Germany 2006 (USA) (v1.01).iso,1.2 GiB,188.3 GiB
