title,score,developer,publisher,rom_name,size,running_total
Pirates: The Key of Dreams,5.3,Oxygen Interactive,Oxygen Interactive,Pirates - The Key of Dreams (USA) (WiiWare).wad,18.2 MiB,711.3 GiB
Namco Museum Megamix,5.3,Namco Bandai Games,Namco Bandai Games,Namco Museum Megamix (USA).iso,4.4 GiB,715.7 GiB
Food Network: Cook or Be Cooked,5.3,Red Fly Studio,Namco Bandai Games,Food Network - Cook or Be Cooked (USA).iso,4.4 GiB,720.1 GiB
Fish'em All!,5.3,Abylight,Abylight,Fish'em All (USA) (WiiWare).wad,19.7 MiB,720.1 GiB
Bust-A-Move Bash!,5.3,Happy Happening,Majesco,Bust-A-Move Bash! (USA).iso,4.4 GiB,724.5 GiB
SoulCalibur Legends,5.2,Namco Bandai Games,Namco Bandai Games,Soulcalibur Legends (USA).iso,4.4 GiB,728.9 GiB
Silver Star Chess (2008),5.2,Agetec,Agetec,Silver Star Chess (USA) (WiiWare).wad,30.8 MiB,728.9 GiB
Rygar: The Battle of Argus,5.2,Tecmo,Tecmo,Rygar - The Battle of Argus (USA).iso,4.4 GiB,733.3 GiB
Plattchen: Twist 'n' Paint,5.2,Bplus,Bplus,Plaettchen Twist 'n' Paint (USA) (WiiWare).wad,38.5 MiB,733.3 GiB
Pit Crew Panic!,5.2,Hudson Soft,Hudson Entertainment,Pit Crew Panic! (USA) (WiiWare).wad,39.8 MiB,733.4 GiB
Lead the Meerkats,5.2,Inaria Interactive,Lapland Studio,Lead the Meerkats (USA) (WiiWare).wad,28.7 MiB,733.4 GiB
Happy Hammerin',5.2,Agenda,Gamebridge,Happy Hammerin' (USA) (WiiWare).wad,19.9 MiB,733.4 GiB
Fun! Fun! Minigolf,5.2,Shin'en,Shin'en,Fun! Fun! Minigolf (USA) (WiiWare).wad,41.5 MiB,733.4 GiB
Pucca's Kisses Game,5.1,Bigben Interactive,Bigben Interactive,Pucca's Kisses Game (USA) (WiiWare).wad,35.4 MiB,733.5 GiB
Family Table Tennis,5.1,Arc System Works,Aksys Games,Family Table Tennis (USA) (WiiWare).wad,37.9 MiB,733.5 GiB
Dragon Blade: Wrath of Fire,5.1,D3Publisher,D3Publisher,Dragon Blade - Wrath of Fire (USA).iso,4.4 GiB,737.9 GiB
Twin Strike: Operation Thunder,5.0,Naps Team,Zoo Digital Publishing,"Twin Strike - Operation Thunder (USA) (En,Fr,Es).iso",4.4 GiB,742.3 GiB
Shootanto: Evolutionary Mayhem,5.0,Grandprix Inc.,Hudson Entertainment,Shootanto - Evolutionary Mayhem (USA) (WiiWare).wad,44.2 MiB,742.3 GiB
Robox (2010),5.0,DreamBox Games,DreamBox Games,Robox (USA) (WiiWare).wad,36.1 MiB,742.4 GiB
Potpourrii (2008),5.0,Abstraction Games,Abstraction Games,Potpourrii (USA) (WiiWare).wad,23.8 MiB,742.4 GiB
Celebrity Sports Showdown,5.0,EA Canada,Electronic Arts,"Celebrity Sports Showdown (USA) (En,Fr,Es).iso",4.4 GiB,746.8 GiB
V.I.P. Casino Blackjack,4.9,High Voltage Software,High Voltage Software,V.I.P. Casino - Blackjack (USA) (WiiWare).wad,28.4 MiB,746.8 GiB
Snowboard Riot,4.9,Hudson Soft,Hudson Entertainment,Snowboard Riot (USA) (WiiWare).wad,37.5 MiB,746.8 GiB
Neighborhood Games,4.9,Jet Black Games,THQ,Neighborhood Games (USA).iso,4.4 GiB,751.2 GiB
Namco Museum Remix,4.9,TOSE,Namco Bandai Games,Namco Museum Remix (USA).iso,4.4 GiB,755.6 GiB
Just Dance,4.9,Ubisoft Paris,Ubisoft,"Just Dance (USA) (En,Fr,Es).iso",4.4 GiB,759.9 GiB
Deca Sports 2,4.9,CAProduction,Hudson,"Deca Sports 2 (USA) (En,Fr,Es).iso",4.4 GiB,764.3 GiB
Castlevania Judgment,4.9,Eighting,Konami,Castlevania Judgment (USA).iso,4.4 GiB,768.7 GiB
Calling,4.9,Hudson Entertainment,Hudson Entertainment,"Calling (USA) (En,Fr,Es).iso",4.4 GiB,773.1 GiB
FlingSmash,4.8,Artoon,Nintendo,"FlingSmash (USA) (En,Fr,Es) (Rev 1).iso",4.4 GiB,777.5 GiB
Fishie Fishie,4.8,DK Games,DK Games,Fishie Fishie (USA) (WiiWare).wad,10.0 MiB,777.5 GiB
Family Slot Car Racing,4.8,Arc System Works,Aksys Games,Family Slot Car Racing (USA) (WiiWare).wad,42.8 MiB,777.5 GiB
Wing Island,4.7,CAProduction,Hudson,"Wing Island (USA) (En,Fr,Es).iso",4.4 GiB,781.9 GiB
My Pokemon Ranch,4.7,Ambrella,Nintendo,My Pokemon Ranch (USA) (v256) (WiiWare).wad,19.6 MiB,781.9 GiB
Flip's Twisted World,4.7,Frozen North Productions,Majesco,Flip's Twisted World (USA).iso,4.4 GiB,786.3 GiB
Bit Boy!!,4.7,Bplus,Bplus,Bit Boy!! (USA) (WiiWare).wad,13.8 MiB,786.3 GiB
Tom Clancy's Ghost Recon (Wii),4.6,Next Level Games,Ubisoft,"Tom Clancy's Ghost Recon (USA) (En,Fr,Es).iso",4.4 GiB,790.7 GiB
Summer Sports: Paradise Island,4.6,Destineer,Destineer,Summer Sports - Paradise Island (USA).iso,4.4 GiB,795.1 GiB
Major Minor's Majestic March,4.6,NanaOn-Sha,Majesco,Major Minor's Majestic March (USA).iso,4.4 GiB,799.4 GiB
Gravitronix,4.6,Medaverse Studios,Medaverse Studios,Gravitronix (USA) (WiiWare).wad,19.1 MiB,799.4 GiB
Family Pirate Party,4.6,Aksys Games,Aksys Games,Family Pirate Party (USA) (WiiWare) (DLC).wad,2.0 MiB,799.4 GiB
Drill Sergeant Mindstrong,4.6,Hi Corp,XSEED Games,Drill Sergeant Mindstrong (USA) (WiiWare).wad,18.9 MiB,799.5 GiB
Donkey Kong: Barrel Blast,4.6,Paon Corporation,Nintendo,Donkey Kong - Barrel Blast (USA).iso,4.4 GiB,803.8 GiB
Arcade Sports,4.6,Icon Games,Icon Games,Arcade Sports (USA) (WiiWare).wad,32.7 MiB,803.9 GiB
All Star Karate,4.6,THQ,THQ,"All Star Karate (USA) (En,Fr,Es).iso",4.4 GiB,808.3 GiB
Wacky World of Sports,4.5,Tabot,Sega,"Wacky World of Sports (USA) (En,Fr,Es).iso",4.4 GiB,812.6 GiB
Tournament of Legends,4.5,High Voltage Software,Sega Europe,Tournament of Legends (USA).iso,4.4 GiB,817.0 GiB
Stop Stress: A Day of Fury,4.5,Abylight,Abylight,Stop Stress - A Day of Fury (USA) (WiiWare).wad,43.0 MiB,817.0 GiB
Mart Racer,4.5,"Joju Games, Inc.","Joju Games, Inc.",Mart Racer (USA) (WiiWare).wad,27.1 MiB,817.1 GiB
Major League Eating: The Game,4.5,Sensory Sweep,Mastiff,Major League Eating - The Game (USA) (WiiWare).wad,32.2 MiB,817.1 GiB
Brothers in Arms: Double Time,4.5,Gearbox Software,Ubisoft,"Brothers in Arms - Double Time (USA) (En,Fr,Es) (Disc 2) (Brothers in Arms - Earned in Blood).iso",4.4 GiB,821.5 GiB
AquaSpace,4.5,Paon Corporation,Nintendo,AquaSpace (USA) (WiiWare).wad,23.1 MiB,821.5 GiB
Niki: Rock 'n' Ball,4.4,Bplus,Bplus,Niki - Rock 'n' Ball (USA) (WiiWare).wad,18.7 MiB,821.5 GiB
Gabrielle's Ghostly Groove: Monster Mix,4.4,Santa Entertainment,Natsume,Gabrielle's Ghostly Groove - Monster Mix (USA) (WiiWare).wad,45.4 MiB,821.6 GiB
Big Beach Sports,4.4,HB Studios Multimedia,THQ,"Big Beach Sports (USA) (En,Fr,Es).iso",4.4 GiB,825.9 GiB
Furu Furu Park,4.3,Taito Corporation,Majesco,Furu Furu Park (USA).iso,4.4 GiB,830.3 GiB
SPRay,4.2,EKO Software,Tecmo,SPRay (USA).iso,4.4 GiB,834.7 GiB
Family Party: 30 Great Games,4.2,Tamsoft,D3Publisher,"Family Party - 30 Great Games (USA) (En,Fr,Es).iso",4.4 GiB,839.1 GiB
WWII Aces,4.1,Arcade Moon,Destineer,WWII Aces (USA).iso,4.4 GiB,843.5 GiB
GT Pro Series,4.1,MTO,Ubisoft,GT Pro Series (USA).iso,4.4 GiB,847.8 GiB
Emergency Heroes,4.1,Ubisoft Barcelona,Ubisoft,"Emergency Heroes (USA) (En,Fr,Es).iso",4.4 GiB,852.2 GiB
Deca Sports 3,4.1,Hudson,Hudson Entertainment,"Deca Sports 3 (USA) (En,Fr,Es).iso",4.4 GiB,856.6 GiB
101-in-1 Sports Party Megamix,4.1,Nordcurrent,Atlus,"101-in-1 Sports Party Megamix (USA) (En,Fr,Es).iso",4.4 GiB,861.0 GiB
Protothea,4.0,Digital Builders,Ubisoft,Protoethea (USA) (WiiWare).wad,35.2 MiB,861.0 GiB
Sandy Beach,3.9,Frozen Codebase,Konami,Sandy Beach (USA) (WiiWare).wad,38.4 MiB,861.0 GiB
Ju-on: The Grudge,3.9,FeelPlus,XSEED Games,"Ju-on - The Grudge (Europe) (En,Fr,De,Es,It,Nl).iso",4.4 GiB,865.4 GiB
Beyblade: Metal Fusion - Battle Fortress,3.9,Hudson Soft,Hudson Entertainment,"Beyblade - Metal Fusion - Battle Fortress (USA) (En,Fr,Es).iso",4.4 GiB,869.8 GiB
Naruto Shippuden: Dragon Blade Chronicles,3.8,Eighting,Tomy Corporation,Naruto Shippuden - Dragon Blade Chronicles (USA).iso,4.4 GiB,874.2 GiB
Carnival Games: Mini-Golf,3.8,Cat Daddy Games,2K Play,"Carnival Games - MiniGolf (USA) (En,Fr,Es).iso",4.4 GiB,878.5 GiB
Tamagotchi Party On!,3.7,h.a.n.d. Inc.,Namco Bandai Games,Tamagotchi - Party On! (USA).iso,4.4 GiB,882.9 GiB
Speed Zone,3.7,Awesome Play Ltd.,Detn8,Speed Zone (USA).iso,4.4 GiB,887.3 GiB
Ready 2 Rumble Revolution,3.7,10tacle Studios,Atari SA,"Ready 2 Rumble - Revolution (USA) (En,Fr,Es).iso",4.4 GiB,891.7 GiB
Game Party 3,3.7,Farsight Studios,Warner Bros. Interactive Entertainment,"Game Party 3 (USA) (En,Fr,Es).iso",4.4 GiB,896.1 GiB
Escape from Bug Island,3.7,Spike,Eidos Interactive,Escape from Bug Island (USA).iso,4.4 GiB,900.4 GiB
Valhalla Knights: Eldar Saga,3.5,K2,XSEED Games,Valhalla Knights - Eldar Saga (USA).iso,4.4 GiB,904.8 GiB
Sexy Poker,3.5,Gameloft,Gameloft,Sexy Poker (USA) (WiiWare).wad,37.4 MiB,904.8 GiB
Target: Terror,3.3,Leviathan Games,Konami,Target - Terror (USA).iso,4.4 GiB,909.2 GiB
Rolling Stone: Drum King,3.2,505 Games,505 Games,"Rolling Stone - Drum King (USA) (En,Fr,Es).iso",4.4 GiB,913.6 GiB
Pool Party (2007),3.2,Hyper-Devbox,SouthPeak Games,Pool Party (USA).iso,4.4 GiB,918.0 GiB
Anima: Ark of Sinners,3.2,Anima Game Studio,Anima Game Studio,ANIMA - Ark of Sinners (USA) (WiiWare).wad,41.6 MiB,918.0 GiB
Mad Dog McCree: Gunslinger Pack,3.1,Digital Leisure,Majesco,"Mad Dog McCree - Gunslinger Pack (USA) (En,Fr,Es).iso",4.4 GiB,922.4 GiB
Copter Crisis,3.1,Digital Leisure,Digital Leisure,Copter Crisis (USA) (WiiWare) (DLC).wad,125.9 KiB,922.4 GiB
Jillian Michaels' Fitness Ultimatum 2009,3.0,3G Studios,Majesco,Jillian Michaels' Fitness Ultimatum 2009 (USA).iso,4.4 GiB,926.8 GiB
5 Arcade Gems,3.0,Nordcurrent,Nordcurrent,5 Arcade Gems (USA) (WiiWare).wad,32.0 MiB,926.8 GiB
Game Party 2,2.9,Midway,Midway,"Game Party 2 (USA) (En,Fr,Es).iso",4.4 GiB,931.2 GiB
Kung Fu Funk: Everybody is Kung Fu Fighting!,2.8,Stickmen Studios,Stickmen Studios,Kung Fu Funk - Everybody is Kung Fu Fighting! (USA) (WiiWare).wad,43.1 MiB,931.2 GiB
The Incredible Maze,2.7,Digital Leisure,Digital Leisure,"Incredible Maze, The (USA) (WiiWare).wad",23.1 MiB,931.2 GiB
The Island of Dr. Frankenstein,2.6,Visual Impact,Storm City Games,"Island of Dr. Frankenstein, The (USA) (En,Fr,Es).iso",4.4 GiB,935.6 GiB
Game Party,2.5,Midway,Midway,Game Party (USA) (Rev 1).iso,4.4 GiB,940.0 GiB
Cruis'n,2.5,Midway Studios - San Diego,Midway,"Cruis'n (USA) (En,Fr,Es).iso",4.4 GiB,944.4 GiB
Zombii Attack,2.1,Gamers Digital,Gamers Digital,Zombii Attack (USA) (WiiWare).wad,32.7 MiB,944.4 GiB
Enjoy your massage!,2.1,Microforum,Microforum,Enjoy your Massage! (USA) (WiiWare).wad,22.2 MiB,944.4 GiB
Pong Toss: Frat Party Games,1.8,JV Games Inc.,JV Games Inc.,Pong Toss! Frat Party Games (USA) (WiiWare).wad,18.8 MiB,944.4 GiB
