title,score,developer,publisher,rom_name,size
Groovin' Blocks,7.5,Empty Clip Studios,Empty Clip Studios,"Groovin' Blocks (USA) (En,Fr,Es).iso",4699979776
Madden NFL 11,7.5,EA Tiburon,Electronic Arts,Madden NFL 13 (USA).iso,4699979776
Mario & Sonic at the Olympic Games,7.5,Sega Sports R&D,Sega,"Mario & Sonic at the Olympic Winter Games (USA) (En,Ja,Fr,Es).iso",4699979776
Mario Power Tennis,7.5,Camelot Software Planning,Nintendo,"Mario Power Tennis (USA) (En,Fr,Es).iso",4699979776
Resident Evil: The Darkside Chronicles,7.5,Cavia Inc.,Capcom,Resident Evil - The Darkside Chronicles (USA).iso,4699979776
Resident Evil: The Umbrella Chronicles,7.5,Cavia Inc.,Capcom,Resident Evil - The Umbrella Chronicles (USA).iso,4699979776
Sam & Max: Save the World,7.5,Telltale Games,The Adventure Company,,
Teenage Mutant Ninja Turtles: Smash-Up,7.5,Game Arts,Ubisoft,"Teenage Mutant Ninja Turtles - Smash-Up (USA) (En,Fr,De,Es,It).iso",4699979776
WWE All Stars,7.5,THQ,THQ,"WWE All Stars (USA) (En,Fr,Es).iso",4699979776
Avatar: The Last Airbender - Into the Inferno,7.4,THQ Studio Australia,THQ,Nickelodeon Avatar - The Last Airbender - Into the Inferno (USA).iso,4699979776
Ben 10: Alien Force,7.4,Monkey Bar Games,D3Publisher,"Ben 10 - Alien Force (USA) (En,Fr,Es).iso",4699979776
Disney Epic Mickey,7.4,Junction Point,Disney Interactive Studios,"Disney Epic Mickey (USA) (En,Fr,Es).iso",4699979776
Dragon Ball: Revenge of King Piccolo,7.4,Media.Vision,Namco Bandai Games,Dragon Ball - Revenge of King Piccolo (USA).iso,4699979776
Ivy the Kiwi?,7.4,Prope,XSEED Games,"Ivy the Kiwi (USA) (En,Fr,Es).iso",4699979776
Just Dance 2,7.4,Ubisoft,Ubisoft,"Just Dance 2 (USA) (En,Fr,Es) (Best Buy Edition).iso",4699979776
LEGO Pirates of the Caribbean: The Video Game,7.4,Traveller's Tales,Disney Interactive Studios,"LEGO Pirates of the Caribbean - The Video Game (USA) (En,Fr,Es) (Rev 1).iso",4699979776
Manhunt 2,7.4,Rockstar Toronto,Rockstar Games,"Manhunt 2 (USA) (En,Fr,Es).iso",4699979776
Need for Speed: ProStreet,7.4,EA Black Box,EA Games,Need for Speed - ProStreet (USA) (Rev 1).iso,4699979776
Sonic and the Black Knight,7.4,Sonic Team,Sega,"Sonic and the Black Knight (USA) (En,Ja,Fr,De,Es,It).iso",4699979776
Spider-Man: Web of Shadows,7.4,Shaba Games,Activision,"Spider-Man - Web of Shadows (USA) (En,Fr).iso",4699979776
SSX Blur,7.4,EA Montreal,EA Sports Big,"SSX Blur (USA) (En,Fr).iso",4699979776
Super Monkey Ball: Banana Blitz,7.4,Sega,Sega,Super Monkey Ball - Banana Blitz (USA).iso,4699979776
Tales of Symphonia: Dawn of the New World,7.4,Bandai Namco Games,Namco Bandai Games,Tales of Symphonia - Dawn of the New World (USA).iso,4699979776
The Biggest Loser,7.4,Blitz Games,THQ,"Biggest Loser, The (USA).iso",4699979776
The House of the Dead 2 & 3 Return,7.4,Sega,Sega,"House of the Dead 2 & 3 Return, The (USA) (En,Fr,Es).iso",4699979776
WWE '12,7.4,Yuke's,THQ,"WWE '13 (USA) (En,Fr,Es).iso",4699979776
WWE '13,7.4,Yuke's,THQ,"WWE '13 (USA) (En,Fr,Es).iso",4699979776
Captain America: Super Soldier,7.3,Next Level Games,Sega,"Captain America - Super Soldier (USA) (En,Fr,Es).iso",4699979776
Dance Dance Revolution Hottest Party,7.3,Konami,Konami,Dance Dance Revolution - Hottest Party (USA).iso,4699979776
Disney/Pixar Ratatouille,7.3,Asobo Studio,THQ,Disney-Pixar Ratatouille (USA).iso,4699979776
FIFA Soccer 11,7.3,EA Sports,Electronic Arts,"FIFA Soccer 13 (USA) (En,Fr,Es).iso",4699979776
Final Fantasy Crystal Chronicles: My Life as a Darklord,7.3,Square Enix,Square Enix,Final Fantasy Crystal Chronicles - My Life as a Darklord (USA) (WiiWare) (DLC).wad,4923392
Flowerworks,7.3,Nocturnal Entertainment,Nocturnal Entertainment,Flowerworks (USA) (WiiWare).wad,19324352
Guitar Hero: Aerosmith,7.3,Neversoft Entertainment,Activision,"Guitar Hero - Aerosmith (USA) (En,Fr).iso",4699979776
Harvest Moon: Tree of Tranquility,7.3,Marvelous Entertainment,Natsume,Harvest Moon - Tree of Tranquility (USA) (Rev 1).iso,4699979776
Indiana Jones and the Staff of Kings,7.3,Artificial Mind and Movement,LucasArts,"Indiana Jones and the Staff of Kings (USA) (En,Fr,Es).iso",4699979776
Mario Party 9,7.3,Nd Cube,Nintendo,"Mario Party 9 (USA, Asia) (En,Fr,Es).iso",4699979776
Medal of Honor Heroes 2,7.3,EA Canada,Electronic Arts,Medal of Honor - Heroes 2 (USA).iso,4699979776
Need for Speed: Carbon,7.3,EA Canada,EA Games,Need for Speed - Carbon (USA).iso,4699979776
Onechanbara: Bikini Zombie Slayers,7.3,Tamsoft,D3Publisher,"Onechanbara - Bikini Zombie Slayers (USA) (En,Fr).iso",4699979776
Overlord: Dark Legend,7.3,Climax Studios,Codemasters,"Overlord - Dark Legend (USA) (En,Fr,Es).iso",4699979776
Rayman Raving Rabbids: TV Party,7.3,Ubisoft Paris,Ubisoft,"Rayman - Raving Rabbids 2 (USA) (En,Fr,Es) (Rev 1).iso",4699979776
Virtua Tennis 2009,7.3,Sumo Digital,Sega,"Virtua Tennis 4 (USA) (En,Fr,Es).iso",4699979776
Big Brain Academy: Wii Degree,7.2,Nintendo,Nintendo,"Big Brain Academy - Wii Degree (USA) (En,Fr,Es).iso",4699979776
Disney/Pixar Cars Race-O-Rama,7.2,Incinerator Games,THQ,"Disney-Pixar Cars - Race-O-Rama (USA) (En,Fr).iso",4699979776
Dr. Mario Online RX,7.2,Arika,Nintendo,Dr. Mario Online Rx (USA) (v256) (WiiWare).wad,15677952
FlingSmash,7.2,Artoon,Nintendo,"FlingSmash (USA) (En,Fr,Es) (Rev 1).iso",4699979776
Lego Indiana Jones 2: The Adventure Continues,7.2,Traveller's Tales,LucasArts,"LEGO Indiana Jones 2 - The Adventure Continues (USA) (En,Fr,Es) (Rev 1).iso",4699979776
Need for Speed: Nitro,7.2,EA Montreal,EA Games,"Need for Speed - Nitro (USA) (En,Fr,Es).iso",4699979776
Shaun White Snowboarding: World Stage,7.2,Ubisoft,Ubisoft,"Shaun White Snowboarding - World Stage (USA) (En,Fr,Es).iso",4699979776
Sonic Unleashed,7.2,Sonic Team,Sega,"Sonic Unleashed (USA) (En,Ja,Fr,De,Es,It).iso",4699979776
Tetris Party Deluxe,7.2,"Tetris Online, Inc",Majesco,"Tetris Party Deluxe (USA) (En,Fr,Es).iso",4699979776
Cursed Mountain,7.1,Deep Silver,Deep Silver,"Cursed Mountain (USA) (En,Fr,Es).iso",4699979776
Super Monkey Ball: Step & Roll,7.1,Sega,Sega,Super Monkey Ball - Step & Roll (USA).iso,4699979776
Thor: God of Thunder,7.1,Liquid Entertainment,Sega,"Thor - God of Thunder (USA) (En,Fr,Es).iso",4699979776
Transformers Prime: The Game,7.1,Now Production,Activision,"Transformers Prime - The Game (USA) (En,Fr).iso",4699979776
2010 FIFA World Cup South Africa,7.0,Electronic Arts,EA Sports,"2010 FIFA World Cup South Africa (USA) (En,Es).iso",4699979776
Avatar: The Last Airbender,7.0,AWE Games,THQ,Nickelodeon Avatar - The Last Airbender (USA).iso,4699979776
Call of Duty: Modern Warfare 3,7.0,Infinity Ward,Activision,Call of Duty - Modern Warfare 3 (USA).iso,4699979776
Crash: Mind Over Mutant,7.0,Radical Entertainment,Activision,"Crash - Mind over Mutant (USA) (En,Fr).iso",4699979776
FIFA Soccer 12,7.0,Electronic Arts,Electronic Arts,"FIFA Soccer 13 (USA) (En,Fr,Es).iso",4699979776
DreamWorks Kung Fu Panda,7.0,"Luxoflux, Inc.",Activision,"DreamWorks Kung Fu Panda 2 (USA) (En,Fr) (SKUZ).iso",4699979776
Let's TAP,7.0,Prope,Sega,"Let's Tap (USA) (En,Fr,Es).iso",4699979776
Monopoly (2008),7.0,Electronic Arts,Electronic Arts,"Monopoly (USA) (En,Fr,Es).iso",4699979776
Muscle March,7.0,NBGI,Namco Bandai Games,Muscle March (USA) (WiiWare).wad,40086976
Nicktoons: Attack of the Toybots,7.0,Blue Tongue Entertainment,THQ,Nicktoons - Attack of the Toybots (USA).iso,4699979776
Prince of Persia Rival Swords,7.0,Ubisoft Montreal,Ubisoft,"Prince of Persia - Rival Swords (USA) (En,Fr,Es).iso",4699979776
Rabbids Travel in Time 3D,7.0,Ubisoft,Ubisoft,"Raving Rabbids - Travel in Time (USA) (En,Fr,Es).iso",4699979776
Secret Files 2: Puritas Cordis,7.0,Animation Arts,Deep Silver,"Secret Files 2 - Puritas Cordis (Europe) (En,Fr,De,Es,It).iso",4699979776
Tenchu: Shadow Assassins,7.0,Acquire,Ubisoft,"Tenchu - Shadow Assassins (USA) (En,Fr,Es).iso",4699979776
Thrillville: Off the Rails,7.0,Frontier Developments,LucasArts,Thrillville - Off the Rails (USA).iso,4699979776
Alice in Wonderland (2010),6.9,Etranges Libellules,Disney Interactive Studios,"Disney Alice in Wonderland (USA) (En,Fr,Es).iso",4699979776
Alvin and the Chipmunks,6.9,Sensory Sweep,Brash Entertainment,"Alvin and the Chipmunks (USA) (En,Fr).iso",4699979776
Call of Duty 3,6.9,Treyarch,Activision,Call of Duty 3 (USA).iso,4699979776
Disney/Pixar Cars 2,6.9,Avalanche Software,Disney Interactive Studios,"Disney-Pixar Cars 2 (USA) (En,Fr,Es).iso",4699979776
Crash of the Titans,6.9,Radical Entertainment,Sierra Entertainment,Crash of the Titans (USA).iso,4699979776
Disney Epic Mickey 2: The Power of Two,6.9,Blitz Games Studios,Disney Interactive Studios,"Disney Epic Mickey 2 - The Power of Two (USA) (En,Fr,Es,Pt).iso",4699979776
Disney G-Force,6.9,Eurocom,Disney Interactive Studios,"Disney G-Force (USA) (En,Fr,Es).iso",4699979776
F1 2009,6.9,Sumo Digital,Codemasters,"F1 2009 (USA) (En,Fr,Es).iso",4699979776
Final Fantasy IV: The After Years,6.9,Matrix Software,Square Enix,Final Fantasy IV - The After Years (USA) (WiiWare) (DLC).wad,5461760
Harry Potter and the Order of the Phoenix,6.9,EA Games,EA Games,Harry Potter and the Order of the Phoenix (USA).iso,4699979776
Kororinpa: Marble Mania,6.9,Hudson,Konami,Kororinpa - Marble Mania (USA).iso,4699979776
Sonic and the Secret Rings,6.9,Sonic Team,Sega,"Sonic and the Secret Rings (USA) (En,Ja,Fr,De,Es,It).iso",4699979776
Spider-Man: Edge of Time,6.9,Beenox,Activision,"Spider-Man - Edge of Time (USA) (En,Fr).iso",4699979776
Tom Clancy's Splinter Cell: Double Agent,6.9,Ubisoft Shanghai,Ubisoft,"Tom Clancy's Splinter Cell - Double Agent (USA) (En,Fr,Es).iso",4699979776
Link's Crossbow Training,6.8,Nintendo,Nintendo,"Link's Crossbow Training (USA) (En,Fr,Es) (Rev 1).iso",4699979776
MySims Racing,6.8,EA Games,EA Games,"MySims Racing (USA) (En,Fr,Es).iso",4699979776
Rayman Raving Rabbids 2,6.8,Ubisoft Montpellier,Ubisoft,"Rayman - Raving Rabbids 2 (USA) (En,Fr,Es) (Rev 1).iso",4699979776
The Simpsons Game,6.8,EA Redwood Shores,EA Games,"Team Elimination Games (USA) (En,Fr,Es).iso",4699979776
Dewy's Adventure,6.7,Konami,Konami,Dewy's Adventure (USA).iso,4699979776
Karaoke Revolution Glee: Volume 2,6.7,Konami,Konami,"Karaoke Revolution Glee - Volume 3 (USA) (En,Fr,Es).iso",4699979776
Mario Party 8,6.7,Hudson,Nintendo,Mario Party 9 (Japan).iso,4699979776
MySims SkyHeroes,6.7,Electronic Arts,Electronic Arts,"MySims SkyHeroes (USA) (En,Fr,Es).iso",4699979776
Namco Museum Remix,6.7,TOSE,Namco Bandai Games,Namco Museum Remix (USA).iso,4699979776
SimCity Creator,6.7,Electronic Arts,EA Games,"SimCity Creator (USA) (En,Fr,Es).iso",4699979776
Trivial Pursuit,6.7,EA Bright Light,Electronic Arts,"Trivial Pursuit (USA) (En,Fr).iso",4699979776
We Ski,6.7,Bandai Namco Games,Namco Bandai Games,"We Ski (USA) (En,Fr,Es).iso",4699979776
3D Pixel Racing,6.6,Vidia,Microforum,3D Pixel Racing (USA) (WiiWare).wad,13333312
Abba: You Can Dance,6.6,Ubisoft,Ubisoft,"ABBA - You Can Dance (USA) (En,Fr,Es).iso",4699979776
Cooking Mama: World Kitchen,6.6,Cooking Mama Limited,Majesco,Cooking Mama - World Kitchen (USA) (Rev 1).iso,4699979776
Driver: San Francisco,6.6,Ubisoft Reflections,Ubisoft,"Driver - San Francisco (USA) (En,Fr,Es).iso",4699979776
Nerf N-Strike,6.6,EA Salt Lake,Electronic Arts,Nerf N-Strike Elite (USA).iso,4699979776
Spyborgs,6.6,Bionic Games,Capcom,"Spyborgs (USA) (En,Fr,Es).iso",4699979776
Star Wars The Clone Wars: Lightsaber Duels,6.6,Krome Studios,LucasArts,"Star Wars - The Clone Wars - Lightsaber Duels (USA) (En,Fr).iso",4699979776
Tom Clancy's Ghost Recon (Wii),6.6,Next Level Games,Ubisoft,"Tom Clancy's Ghost Recon (USA) (En,Fr,Es).iso",4699979776
Wii Play,6.6,Nintendo,Nintendo,Wii Play (USA) (Rev 1).iso,4699979776
Bleach: Shattered Blade,6.5,Polygon Magic,Sega,Bleach - Shattered Blade (USA).iso,4699979776
Donkey Kong: Barrel Blast,6.5,Paon Corporation,Nintendo,Donkey Kong - Barrel Blast (USA).iso,4699979776
Dragon Quest Swords: The Masked Queen and the Tower of Mirrors,6.5,Genius Sonority Inc.,Square Enix,Dragon Quest Swords - The Masked Queen and the Tower of Mirrors (USA).iso,4699979776
Ferrari Challenge Trofeo Pirelli,6.5,Eutechnyx,Activision,"Ferrari Challenge - Trofeo Pirelli (USA) (En,Fr).iso",4699979776
FIFA 08 Soccer,6.5,EA Canada,EA Sports,"FIFA Soccer 13 (USA) (En,Fr,Es).iso",4699979776
Monopoly Streets,6.5,Electronic Arts,Electronic Arts,"Monopoly Streets (USA) (En,Fr,Es).iso",4699979776
The Legend of Spyro: Dawn of the Dragon (2008),6.5,Etranges Libellules,Activision,"Legend of the Dragon (USA) (En,Fr,Es).iso",4699979776
Wii Play: Motion,6.5,Good-Feel,Nintendo,"Wii Play - Motion (USA) (En,Fr,Es).iso",4699979776
Need for Speed: The Run,6.4,EA Black Box,Electronic Arts,"Need for Speed - The Run (USA) (En,Fr,Es).iso",4699979776
Red Steel,6.4,Ubisoft Paris,Ubisoft,"Red Steel 2 (USA) (En,Fr,Es).iso",4699979776
Worms: A Space Oddity,6.4,Team17,THQ,"Worms - A Space Oddity (USA) (En,Fr).iso",4699979776
Disney/Pixar Brave,6.3,Disney Interactive Studios,Disney Interactive Studios,"Disney-Pixar Brave (USA) (En,Fr,Es).iso",4699979776
Hasbro Family Game Night,6.3,EA Bright Light,Electronic Arts,"Hasbro Family Game Night 3 (USA) (En,Fr,Es).iso",4699979776
Pokemon Battle Revolution,6.3,Genius Sonority Inc.,Nintendo,Pokemon Battle Revolution (USA).iso,4699979776
The Chronicles of Narnia: Prince Caspian,6.3,Traveller's Tales,Disney Interactive Studios,"Chronicles of Narnia, The - Prince Caspian (USA).iso",4699979776
Wii Music,6.3,Nintendo,Nintendo,"Wii Music (USA) (En,Fr,Es).iso",4699979776
Just Dance,6.2,Ubisoft Paris,Ubisoft,"Just Dance 4 (USA) (En,Fr,Es).iso",4699979776
DreamWorks Madagascar: Escape 2 Africa,6.2,Toys for Bob,Activision,"DreamWorks Madagascar - Escape 2 Africa (USA) (En,Fr).iso",4699979776
Saban's Power Rangers Samurai,6.2,Inti Creates,Namco Bandai Games,"Power Rangers Samurai (USA) (En,Fr,Es).iso",4699979776
Coraline,6.1,Papaya Studio,D3Publisher,"Coraline (USA) (En,Fr,Es).iso",4699979776
Dead Rising: Chop Till You Drop,6.1,TOSE,Capcom,"Dead Rising - Chop Till You Drop (USA) (En,Fr,Es).iso",4699979776
Pac-Man Party,6.1,TOSE,Namco Bandai Games,"Pac-Man Party (USA) (En,Fr,Es).iso",4699979776
Spore Hero,6.1,Maxis,EA Games,"Spore Hero (USA) (En,Fr,Es).iso",4699979776
The Legend of Spyro: The Eternal Night,6.1,Krome Studios,Sierra Entertainment,"Legend of Spyro, The - The Eternal Night (USA).iso",4699979776
Harry Potter and the Half-Blood Prince,6.0,EA Bright Light,EA Games,"Harry Potter and the Half-Blood Prince (USA) (En,Fr,Es).iso",4699979776
James Cameron's Avatar: The Game,6.0,Ubisoft Montreal,Ubisoft,"James Cameron's Avatar - The Game (USA) (En,Fr,Es).iso",4699979776
007: Quantum of Solace,6.0,Treyarch,Activision,"007 - Quantum of Solace (USA) (En,Fr).iso",4699979776
TMNT,6.0,Ubisoft Montreal,Ubisoft,"TMNT (USA) (En,Fr,Es).iso",4699979776
Destroy All Humans! Big Willy Unleashed,5.9,Locomotive Games,THQ,"Destroy All Humans! Big Willy Unleashed (USA) (En,Fr).iso",4699979776
Driver: Parallel Lines,5.9,Reflections Interactive,Atari SA,"Driver - Parallel Lines (USA) (En,Fr,Es).iso",4699979776
SpongeBob SquarePants featuring Nicktoons: Globs of Doom,5.9,Incinerator Games,THQ,"Nickelodeon SpongeBob SquarePants featuring Nicktoons - Globs of Doom (USA) (En,Fr).iso",4699979776
Valhalla Knights: Eldar Saga,5.9,K2,XSEED Games,Valhalla Knights - Eldar Saga (USA).iso,4699979776
WWE SmackDown vs. Raw 2008,5.9,Yuke's,THQ,"WWE SmackDown vs. Raw 2011 (USA) (En,Fr,Es).iso",4699979776
Avatar: The Last Airbender - The Burning Earth,5.8,THQ,THQ,Nickelodeon Avatar - The Last Airbender - The Burning Earth (USA).iso,4699979776
Battle of the Bands (2008),5.8,Planet Moon Studios,THQ,Battle of the Bands (USA).iso,4699979776
Castlevania Judgment,5.8,Eighting,Konami,Castlevania Judgment (USA).iso,4699979776
Drawn to Life: The Next Chapter,5.8,Planet Moon Studios,THQ,"Drawn to Life - The Next Chapter (USA) (En,Fr).iso",4699979776
SimAnimals,5.8,Electronic Arts,Electronic Arts,"SimAnimals (USA) (En,Fr,Es).iso",4699979776
Marvel: Ultimate Alliance 2,5.7,Vicarious Visions,Activision,Marvel - Ultimate Alliance 2 (USA).iso,4699979776
Need for Speed: Undercover,5.7,EA Vancouver,Electronic Arts,"Need for Speed - Undercover (USA) (En,Fr,Es).iso",4699979776
DreamWorks Shrek the Third,5.7,7 Studios,Activision,DreamWorks Shrek the Third (USA) (Rev 1).iso,4699979776
SpongeBob SquarePants: Creature from the Krusty Krab,5.7,Blitz Games,THQ,Nickelodeon SpongeBob SquarePants - Creature from the Krusty Krab (USA).iso,4699979776
Alone in the Dark (2008),5.6,Eden Studios,Atari SA,"Alone in the Dark (USA) (En,Fr,Es) (Rev 1).iso",4699979776
Carnival Games (2007),5.6,Cat Daddy Games,Global Star Software,"New Carnival Games (USA) (En,Fr,Es).iso",4699979776
Chicken Shoot,5.6,Destination Software,DSI Games,"Chicken Shoot (USA) (En,Fr,Es).iso",4699979776
Deal or No Deal,5.6,Artefacts Studio,Destination Software,Deal or No Deal (USA).iso,4699979776
Medal of Honor: Vanguard,5.6,Electronic Arts,Electronic Arts,Medal of Honor - Vanguard (USA).iso,4699979776
Despicable Me: The Game,5.5,Monkey Bar Games,D3Publisher,"Despicable Me - The Game (USA) (En,Fr,Es).iso",4699979776
Emergency Heroes,5.5,Ubisoft Barcelona,Ubisoft,"Emergency Heroes (USA) (En,Fr,Es).iso",4699979776
Grease: The Official Video Game,5.5,Zoe Mode,505 Games,"Grease - The Official Video Game (USA) (En,Fr,Es) (Rev 1).iso",4699979776
Looney Tunes: Acme Arsenal,5.5,Red Tribe,Warner Bros. Interactive Entertainment,Looney Tunes - Acme Arsenal (USA).iso,4699979776
Rampage: Total Destruction,5.5,"Pipeworks Software, Inc.",Midway,Rampage - Total Destruction (USA).iso,4699979776
Battleship (2012),5.4,Double Helix Games,Activision,"Battleship (USA) (En,Fr).iso",4699979776
Hysteria Hospital: Emergency Ward,5.3,Gameinvest,O-Games,"Hysteria Hospital - Emergency Ward (USA) (En,Fr,Es).iso",4699979776
Transformers: Revenge of the Fallen The Mobile Game,5.3,"Luxoflux, Inc.",Activision,"Transformers Prime - The Game (USA) (En,Fr).iso",4699979776
Ju-on: The Grudge,5.2,FeelPlus,XSEED Games,"Ju-on - The Grudge (Europe) (En,Fr,De,Es,It,Nl).iso",4699979776
SoulCalibur Legends,5.2,Namco Bandai Games,Namco Bandai Games,Soulcalibur Legends (USA).iso,4699979776
CID The Dummy,5.1,Twelve Games,Oxygen Interactive,CID the Dummy (USA).iso,4699979776
Cruis'n,5.1,Midway Studios - San Diego,Midway,"Cruis'n (USA) (En,Fr,Es).iso",4699979776
Need for Speed: Hot Pursuit,5.1,Criterion Games,Electronic Arts,"Need for Speed - Hot Pursuit (USA) (En,Fr,Es).iso",4699979776
Disney Bolt,5.0,Avalanche Software,Disney Interactive Studios,"Disney Bolt (Scandinavia) (En,Sv,No,Da).iso",4699979776
Deca Sports,5.0,CAProduction,Konami,"Deca Sports 3 (USA) (En,Fr,Es).iso",4699979776
My Pokemon Ranch,5.0,Ambrella,Nintendo,My Pokemon Ranch (USA) (v256) (WiiWare).wad,20588992
Ninja Reflex,4.9,Sanzaru Games,Electronic Arts,"Ninja Reflex (USA) (En,Fr,Es).iso",4699979776
Scene It? Twilight,4.9,Screenlife Games,Konami,"Scene It Twilight (USA) (En,Fr,Es).iso",4699979776
Disney/Pixar Toy Story Mania!,4.9,Papaya Studio,Disney Interactive Studios,"Disney-Pixar Toy Story Mania! (USA) (En,Fr,Es).iso",4699979776
Astro Boy: The Video Game,4.8,High Voltage Software,D3Publisher,"Astro Boy - The Video Game (USA) (En,Fr,Es).iso",4699979776
Brave: A Warrior's Tale,4.8,Collision Studios,Evolved Games,"Brave - A Warrior's Tale (USA) (En,Fr,Es).iso",4699979776
Frogger Returns,4.7,Hijinx Studios,Konami,Frogger Returns (USA) (WiiWare).wad,33933312
"Harry Potter and the Deathly Hallows, Part 1",4.7,EA Bright Light,Electronic Arts,"Harry Potter and the Deathly Hallows - Part 2 (USA) (En,Fr,Es).iso",4699979776
Tony Hawk Ride,4.7,Robomodo,Activision,Tony Hawk - Ride (USA).iso,4699979776
Brothers in Arms: Double Time,4.5,Gearbox Software,Ubisoft,"Brothers in Arms - Double Time (USA) (En,Fr,Es) (Disc 2) (Brothers in Arms - Earned in Blood).iso",4699979776
Iron Man (2008),4.4,Secret Level,Sega,"Iron Man 2 (USA) (En,Fr,Es) (Walmart).iso",4699979776
Furu Furu Park,4.3,Taito Corporation,Majesco,Furu Furu Park (USA).iso,4699979776
Family Party: 30 Great Games,4.2,Tamsoft,D3Publisher,"Family Party - 30 Great Games (USA) (En,Fr,Es).iso",4699979776
Far Cry,4.2,Crytek,Ubisoft,"Funfair Party (Europe) (En,Fr,De,Es,It,Nl) (Rev 1).iso",4699979776
Iron Man 2,4.1,Sega Studios San Francisco,Sega,"Iron Man 2 (USA) (En,Fr,Es) (Walmart).iso",4699979776
Goosebumps HorrorLand,4.0,SScholastic Media,"Scholastic, Inc.",Goosebumps HorrorLand (USA).iso,4699979776
101-in-1 Explosive Megamix,3.9,Nordcurrent,Atlus,101-in-1 Explosive Megamix (USA) (WiiWare).wad,39932416
X-Men: Destiny,3.9,Silicon Knights,Activision,X-Men - Destiny (USA).iso,4699979776
Naruto Shippuden: Dragon Blade Chronicles,3.8,Eighting,Tomy Corporation,Naruto Shippuden - Dragon Blade Chronicles (USA).iso,4699979776
Wonder World Amusement Park,3.7,Coyote Console,Majesco,Wonder World Amusement Park (USA).iso,4699979776
Anubis II,3.4,Data Design Interactive,UFO Interactive,Anubis II (USA).iso,4699979776
Transformers: Dark of the Moon,3.4,High Moon Studios,Activision,"Transformers Prime - The Game (USA) (En,Fr).iso",4699979776
Game Party,3.2,Midway,Midway,"Game Party 3 (USA) (En,Fr,Es).iso",4699979776
Pool Party (2007),3.2,Hyper-Devbox,SouthPeak Games,Pool Party (USA).iso,4699979776
Copter Crisis,3.1,Digital Leisure,Digital Leisure,Copter Crisis (USA) (WiiWare) (DLC).wad,128896
Pimp My Ride,2.6,Eutechnyx,Activision,MTV Pimp My Ride (USA).iso,4699979776
Enjoy your massage!,2.1,Microforum,Microforum,Enjoy your Massage! (USA) (WiiWare).wad,23285504
Ninjabread Man,2.0,Data Design Interactive,Conspiracy Entertainment,Ninjabread Man (USA).iso,4699979776
