title,score,developer,publisher,rom_name,size,running_total
Z.H.P. Unlosing Ranger vs Darkdeath Evilman,9.5,Nippon Ichi Software,NIS America,Z.H.P. - Unlosing Ranger vs Darkdeath Evilman (Europe) (PSN).iso,823.3 MiB,823.3 MiB
God of War: Chains of Olympus,9.1,Ready at Dawn,SCEA,God of War - Chains of Olympus (USA).iso,1.5 GiB,2.3 GiB
Final Fantasy Tactics,9.0,TOSE,Square Enix,"Final Fantasy (Japan, Asia) (En,Ja).iso",188.9 MiB,2.5 GiB
Grand Theft Auto: Chinatown Wars,9.0,Rockstar Leeds,Rockstar Games,Grand Theft Auto - Chinatown Wars (USA) (v1.01).iso,862.4 MiB,3.3 GiB
God of War: Ghost of Sparta,8.9,Ready at Dawn,SCEA,"God of War - Ghost of Sparta (USA) (En,Fr,Es) (v2.00).iso",1.6 GiB,5.0 GiB
Lumines,8.9,Q Entertainment,Ubisoft,Lumines (USA) (v1.01).iso,200.2 MiB,5.1 GiB
Metal Gear Solid: Peace Walker,8.9,Kojima Productions,Konami,"Metal Gear Solid - Peace Walker (USA) (En,Fr,Es) (v1.01).iso",1.5 GiB,6.7 GiB
Shin Megami Tensei: Persona 3 Portable,8.9,Atlus,Atlus,Shin Megami Tensei - Persona 3 Portable (USA) (Trade Demo).iso,1.2 GiB,7.9 GiB
Final Fantasy VII: Advent Children,8.8,Square Enix,Square Enix,"Final Fantasy II (Japan, Asia) (En,Ja).iso",274.0 MiB,8.2 GiB
Grand Theft Auto: Liberty City Stories,8.8,Rockstar Leeds,Rockstar Games,"Grand Theft Auto - Liberty City Stories (USA) (En,Fr,De,Es,It) (v3.00).iso",1.2 GiB,9.3 GiB
Jeanne d'Arc,8.8,Level 5,SCEA,Jeanne d'Arc (USA).iso,1.2 GiB,10.5 GiB
OMG Zombies,8.8,Laughing Jackal,Laughing Jackal,I Kill Zombies (USA) (minis) (PSN).iso,156.2 MiB,10.7 GiB
Ridge Racer,8.8,Namco,Namco,Ridge Racer (USA).iso,864.4 MiB,11.5 GiB
Tekken 5: Dark Resurrection,8.8,Namco Bandai Games,Namco Bandai Games,"Tekken - Dark Resurrection (USA) (En,Fr,De,Es,It).iso",1.6 GiB,13.1 GiB
Wipeout Pure,8.8,Studio Liverpool,SCEA,"WipEout Pure (USA) (En,Fr,Es) (v2.00).iso",241.2 MiB,13.4 GiB
Burnout Legends,8.7,Criterion Games,EA Games,"Burnout Legends (USA) (En,Fr,De,Es,It,Nl) (v2.00).iso",482.5 MiB,13.8 GiB
Disgaea: Afternoon of Darkness,8.7,Nippon Ichi Software,Atlus,Disgaea - Afternoon of Darkness (USA).iso,924.9 MiB,14.7 GiB
Final Fantasy IV: The Complete Collection,8.7,Bullets,Square Enix,"Final Fantasy IV - The Complete Collection (USA) (En,Ja,Fr).iso",840.0 MiB,15.6 GiB
LittleBigPlanet,8.7,Media Molecule,SCEA,"LittleBigPlanet (USA) (En,Fr,De,Es,It,Nl,Pt,Sv,No,Da,Fi,Pl).iso",1.4 GiB,17.0 GiB
LocoRoco 2,8.7,SCE Japan Studio,SCEA,LocoRoco 2 (USA).iso,1.7 GiB,18.7 GiB
Metal Gear Solid: Portable Ops,8.7,Kojima Productions,Konami,Metal Gear Solid - Portable Ops (USA) (v1.02).iso,1.3 GiB,20.0 GiB
Patapon 2,8.7,SCE Japan Studio,SCEA,"Patapon 2 (USA) (En,Fr,Es) (PSN & Store).iso",559.5 MiB,20.5 GiB
Syphon Filter: Logan's Shadow,8.7,Sony Bend,SCEA,Syphon Filter - Logan's Shadow (USA).iso,1.2 GiB,21.7 GiB
Tactics Ogre: Let Us Cling Together,8.7,Square Enix,Square Enix,Tactics Ogre - Let Us Cling Together (USA).iso,1.5 GiB,23.2 GiB
Velocity,8.7,FuturLab,FuturLab,Velocity (USA) (minis) (PSN).iso,202.2 MiB,23.4 GiB
FlatOut: Head On,8.6,Bugbear,Empire Interactive,FlatOut - Head On (USA) (v1.01).iso,429.7 MiB,23.8 GiB
Grand Theft Auto: Vice City Stories,8.6,Rockstar Leeds,Rockstar Games,Grand Theft Auto - Vice City Stories (USA).iso,1.6 GiB,25.4 GiB
Mega Man Maverick Hunter X,8.6,Capcom,Capcom,Mega Man - Maverick Hunter X (USA) (v1.01).iso,448.7 MiB,25.8 GiB
Mega Man Powered Up,8.6,Capcom,Capcom,Mega Man - Powered Up (USA).iso,297.3 MiB,26.1 GiB
PixelJunk Monsters Deluxe,8.6,Q-Games,SCEA,PixelJunk Monsters Deluxe (USA).iso,210.4 MiB,26.3 GiB
Bomberman (2006),8.5,Hudson,Konami,Bomberman (USA).iso,104.9 MiB,26.4 GiB
Castlevania: The Dracula X Chronicles,8.5,Konami,Konami,Castlevania - The Dracula X Chronicles (USA) (v1.02).iso,1.0 GiB,27.5 GiB
Dragon Ball Z: Tenkaichi Tag Team,8.5,Spike,Namco Bandai Games,"Dragon Ball Z - Tenkaichi Tag Team (USA) (En,Fr,Es).iso",1.3 GiB,28.8 GiB
Harvest Moon: Hero of Leaf Valley,8.5,Hyde,Natsume,Harvest Moon - Hero of Leaf Valley (USA).iso,401.9 MiB,29.1 GiB
Ratchet & Clank: Size Matters,8.5,High Impact Games,SCEA,"Ratchet & Clank - Size Matters (USA) (En,Fr,De,Es,It) (v1.01).iso",916.8 MiB,30.0 GiB
Spectral Souls: Resurrection of the Ethereal Empires,8.5,Idea Factory,NIS America,Spectral Souls - Resurrection of the Ethereal Empires (USA).iso,1.1 GiB,31.2 GiB
Tetris (2010),8.5,EA Mobile,EA Mobile,Tetris (USA) (minis) (PSN).iso,162.2 MiB,31.3 GiB
Ys Seven,8.5,Falcom,XSEED Games,Ys Seven (USA).iso,728.4 MiB,32.0 GiB
Aliens vs. Predator: Requiem,8.4,Rebellion,Sierra Entertainment,Aliens vs. Predator - Requiem (USA).iso,378.1 MiB,32.4 GiB
Blast Off,8.4,Halfbrick Studios,Halfbrick Studios,Blast Off (USA) (v2) (minis) (PSN).iso,134.6 MiB,32.5 GiB
Brandish: The Dark Revenant,8.4,Falcom,XSEED Games,Brandish - The Dark Revenant (USA) (PSP) (PSN).iso,381.3 MiB,32.9 GiB
ClaDun x2,8.4,System Prisma,NIS America,Cladun x2 (USA) (PSP) (PSN).iso,465.0 MiB,33.4 GiB
Final Fantasy,8.4,TOSE,Square Enix,"Final Fantasy (Japan, Asia) (En,Ja).iso",188.9 MiB,33.5 GiB
Half-Minute Hero,8.4,Opus,XSEED Games,Half-Minute Hero (USA).iso,211.8 MiB,33.8 GiB
Kingdom Hearts: Birth by Sleep,8.4,Square Enix,Square Enix,"Kingdom Hearts - Birth by Sleep (USA) (En,Fr,Es).iso",1.6 GiB,35.4 GiB
LocoRoco Hi,8.4,SCE Japan Studio,SCEA,LocoRoco 2 (USA).iso,1.7 GiB,37.1 GiB
MediEvil: Resurrection,8.4,SCEE,SCEA,MediEvil - Resurrection (USA).iso,1.1 GiB,38.2 GiB
Metal Slug Anthology,8.4,Terminal Reality,SNK Playmore,Metal Slug Anthology (USA) (v1.03).iso,1.2 GiB,39.4 GiB
Monster Hunter Freedom Unite,8.4,Capcom,Capcom,"Monster Hunter Freedom Unite (USA) (En,Fr,De,Es,It).iso",845.6 MiB,40.3 GiB
Prinny: Can I Really Be the Hero?,8.4,Nippon Ichi Software,NIS America,Prinny - Can I Really Be the Hero (USA).iso,469.1 MiB,40.7 GiB
Puzzle Quest: Challenge of the Warlords,8.4,1st Playable Productions,D3Publisher,Puzzle Quest - Challenge of the Warlords (USA) (Trade Demo).iso,86.2 MiB,40.8 GiB
Sega Genesis Collection,8.4,Digital Eclipse,Sega,Sega Genesis Collection (USA) (v1.01).iso,816.7 MiB,41.6 GiB
SOCOM: U.S. Navy SEALs Fireteam Bravo 3,8.4,Slant Six,SCEA,SOCOM - U.S. Navy SEALs - Fireteam Bravo 3 (USA) (v1.01).iso,1.3 GiB,42.9 GiB
Space Invaders Extreme,8.4,Taito Corporation,Square Enix,"Space Invaders Extreme (USA) (En,Fr,De,Es,It).iso",146.7 MiB,43.1 GiB
The Legend of Heroes: Trails in the Sky SC,8.4,Falcom,XSEED Games,"Legend of Heroes, The - Trails in the Sky (USA).iso",1.3 GiB,44.4 GiB
Untold Legends: Brotherhood of the Blade,8.4,Sony Online Entertainment,Sony Online Entertainment,Untold Legends - Brotherhood of the Blade (USA) (v1.02).iso,815.4 MiB,45.2 GiB
Valkyria Chronicles II,8.4,Sega,Sega,Valkyria Chronicles II (USA).iso,1.0 GiB,46.2 GiB
Virtua Tennis: World Tour,8.4,Sumo Digital,Sega,Virtua Tennis - World Tour (USA) (v1.02).iso,409.8 MiB,46.6 GiB
Wipeout Pulse,8.4,Studio Liverpool,SCEA,"WipEout Pulse (USA) (En,Fr,De,Es,It) (Promo).iso",435.8 MiB,47.0 GiB
X-Men Legends II: Rise of Apocalypse,8.4,Raven Software,Activision,X-Men Legends II - Rise of Apocalypse (USA) (v1.01).iso,1.2 GiB,48.3 GiB
Cladun: This is an RPG,8.3,System Prisma,NIS America,Cladun - This is an RPG! (USA) (PSP) (PSN).iso,291.3 MiB,48.6 GiB
Crisis Core: Final Fantasy VII,8.3,Square Enix,Square Enix,Crisis Core - Final Fantasy VII (USA).iso,1.6 GiB,50.2 GiB
Crush (2007),8.3,Zoe Mode,Sega,"Crush (USA) (En,Fr,Es).iso",583.8 MiB,50.7 GiB
Darkstalkers Chronicle: The Chaos Tower,8.3,Capcom,Capcom,Darkstalkers Chronicle - The Chaos Tower (USA).iso,660.5 MiB,51.4 GiB
Disgaea 2: Dark Hero Days,8.3,Nippon Ichi Software,NIS America,Disgaea 2 - Dark Hero Days (USA) (v1.02).iso,757.1 MiB,52.1 GiB
Dissidia 012: Duodecim Final Fantasy,8.3,Square Enix,Square Enix,"Dissidia 012 - Duodecim Final Fantasy (USA) (En,Fr,De,Es,It).iso",1.6 GiB,53.7 GiB
FIFA Soccer 10,8.3,EA Sports,Electronic Arts,"FIFA Soccer 10 (USA) (En,Es).iso",1.6 GiB,55.4 GiB
Ghost in the Shell: Stand Alone Complex (2005),8.3,G-Artists,Bandai,Ghost in the Shell - Stand Alone Complex (USA) (v1.01).iso,756.5 MiB,56.1 GiB
Gradius Collection,8.3,M2,Konami,Gradius Collection (USA) (v1.01).iso,333.2 MiB,56.4 GiB
Growlanser: Wayfarer of Time,8.3,Career Soft,Atlus,Growlanser - Wayfarer of Time (USA).iso,1.1 GiB,57.5 GiB
Gungnir,8.3,Sting,Atlus,Gungnir (USA).iso,250.6 MiB,57.7 GiB
Lego Star Wars II: The Original Trilogy,8.3,Traveller's Tales,LucasArts,LEGO Star Wars II - The Original Trilogy (USA).iso,1.1 GiB,58.9 GiB
Lunar: Silver Star Harmony,8.3,Game Arts,XSEED Games,Lunar - Silver Star Harmony (USA).iso,933.5 MiB,59.8 GiB
MLB 06: The Show,8.3,SCEA San Diego Studios,SCEA,MLB 06 - The Show (USA) (v1.01).iso,1.4 GiB,61.2 GiB
MLB 08: The Show,8.3,SCEA San Diego Studios,SCEA,MLB 08 - The Show (USA).iso,1.4 GiB,62.5 GiB
Mytran Wars,8.3,Stormregion,Deep Silver,"Mytran Wars (USA) (En,Fr,De,Es,It) (v1.04).iso",1.1 GiB,63.7 GiB
Namco Museum Battle Collection,8.3,TOSE,Namco,"Namco Museum Battle Collection (Europe) (En,Fr,De,Es,It).iso",533.3 MiB,64.2 GiB
OutRun 2006: Coast 2 Coast,8.3,Sumo Digital,Sega,OutRun 2006 - Coast 2 Coast (USA) (v1.03).iso,605.4 MiB,64.8 GiB
Phantom Brave,8.3,Nippon Ichi Software,NIS America,Phantom Brave Portable (Japan) (v1.01).iso,559.8 MiB,65.3 GiB
Ragnarok Tactics,8.3,ApolloSoft,Aksys Games,Ragnarok Tactics (USA).iso,615.5 MiB,65.9 GiB
Star Wars: The Force Unleashed,8.3,LucasArts,LucasArts,"Star Wars - The Force Unleashed (USA) (En,Fr).iso",1.0 GiB,67.0 GiB
Test Drive Unlimited,8.3,Eden Studios,Atari SA,Test Drive Unlimited (USA).iso,1.4 GiB,68.4 GiB
Tomb Raider: Anniversary,8.3,Crystal Dynamics,Eidos Interactive,"Tomb Raider - Anniversary (USA) (En,Fr,De,Es,It) (v1.02).iso",1.2 GiB,69.6 GiB
Tony Hawk's Underground 2 Remix,8.3,Neversoft Entertainment,Activision,Tony Hawk's Underground 2 Remix (USA) (v1.01).iso,1.1 GiB,70.7 GiB
Valkyrie Profile,8.3,TOSE,Square Enix,Valkyrie Profile - Lenneth (USA).iso,677.5 MiB,71.4 GiB
BlazBlue: Calamity Trigger,8.2,Arc System Works,Aksys Games,"BlazBlue - Calamity Trigger Portable (USA) (En,Ja,Zh,Ko).iso",1.6 GiB,73.0 GiB
Capcom Classics Collection Reloaded,8.2,Klein Computer Entertainment,Capcom,Capcom Classics Collection Reloaded (USA).iso,603.8 MiB,73.6 GiB
Corpse Party,8.2,Team GrisGris,XSEED Games,Corpse Party (USA) (PSN).iso,742.3 MiB,74.3 GiB
Death Jr.,8.2,Backbone Entertainment,Konami,Death Jr. (USA) (v1.01).iso,415.0 MiB,74.7 GiB
Dissidia: Final Fantasy,8.2,Square Enix,Square Enix,Dissidia Final Fantasy (Japan).iso,1.5 GiB,76.2 GiB
Hakuoki: Demon of the Fleeting Blossom,8.2,Idea Factory,Aksys Games,Hakuoki - Demon of the Fleeting Blossom (USA).iso,1.1 GiB,77.3 GiB
Hot Shots Golf: Open Tee 2,8.2,Clap Hanz,SCEA,Hot Shots Golf - Open Tee 2 (USA) (PSP) (PSN).iso,899.2 MiB,78.2 GiB
Marvel: Ultimate Alliance,8.2,Raven Software,Activision,Marvel - Ultimate Alliance (USA) (v2.00).iso,1.7 GiB,79.8 GiB
Need for Speed: ProStreet,8.2,EA Black Box,EA Games,Need for Speed - ProStreet (USA).iso,854.8 MiB,80.7 GiB
Resistance: Retribution,8.2,Sony Bend,SCEA,"Resistance - Retribution (USA) (En,Ja,Fr,Es).iso",1.6 GiB,82.2 GiB
SOCOM: U.S. Navy SEALs Fireteam Bravo,8.2,Zipper Interactive,SCEA,SOCOM - U.S. Navy SEALs - Fireteam Bravo (USA) (v1.01).iso,534.2 MiB,82.8 GiB
Star Wars Battlefront: Renegade Squadron,8.2,Rebellion,LucasArts,Star Wars Battlefront - Renegade Squadron (USA).iso,887.4 MiB,83.6 GiB
Tekken 6,8.2,Namco Bandai Games,Namco Bandai Games,"Tekken 6 (USA) (En,Fr,De,Es,It,Ru).iso",816.0 MiB,84.4 GiB
The Legend of Heroes: Trails in the Sky,8.2,Falcom,XSEED Games,"Legend of Heroes, The - Trails in the Sky (USA).iso",1.3 GiB,85.7 GiB
Ultimate Ghosts 'n Goblins,8.2,TOSE,Capcom,Ultimate Ghosts 'n Goblins (USA).iso,411.9 MiB,86.1 GiB
Undead Knights,8.2,Now Production,Tecmo,Undead Knights (USA) (v1.04).iso,484.0 MiB,86.6 GiB
Viewtiful Joe: Red Hot Rumble,8.2,Clover Studio,Capcom,Viewtiful Joe - Red Hot Rumble (USA).iso,626.2 MiB,87.2 GiB
"What Did I Do to Deserve This, My Lord!?",8.2,Acquire,NIS America,"What Did I Do to Deserve This, My Lord! (USA) (PSP) (PSN).iso",179.7 MiB,87.4 GiB
A Space Shooter for 2 Bucks,8.1,Frima Studio,Frima Studio,"Space Shooter for Two Bucks!, A (USA) (v2) (minis) (PSN).iso",189.2 MiB,87.6 GiB
Coconut Dodge,8.1,FuturLab,FuturLab,Coconut Dodge (USA) (minis) (PSN).iso,139.1 MiB,87.7 GiB
Dante's Inferno,8.1,Visceral Games,Electronic Arts,Dante's Inferno (USA) (v1.01).iso,1.7 GiB,89.4 GiB
Fieldrunners,8.1,Subatomic Studios,Subatomic Studios,Fieldrunners (USA) (minis) (PSN).iso,158.4 MiB,89.6 GiB
Hot Shots Golf: Open Tee,8.1,Clap Hanz,SCEA,Hot Shots Golf - Open Tee (USA) (v2.00).iso,438.4 MiB,90.0 GiB
Lumines II,8.1,Q Entertainment,Buena Vista Games,Lumines II (USA).iso,1.1 GiB,91.1 GiB
Metal Gear Acid 2,8.1,Kojima Productions,Konami,Metal Gear Ac!d 2 (USA).iso,874.8 MiB,92.0 GiB
Phantasy Star Portable 2,8.1,Alfa System,Sega,Phantasy Star Portable 2 (USA).iso,1.2 GiB,93.2 GiB
Pinball Fantasies,8.1,Cowboy Rodeo,Cowboy Rodeo,Pinball Fantasies (USA) (minis) (PSN).iso,113.1 MiB,93.3 GiB
"Prinny 2: Dawn of Operation Panties, Dood!",8.1,Nippon Ichi Software,NIS America,"Prinny 2 - Dawn of Operation Panties, Dood! (USA).iso",758.3 MiB,94.1 GiB
Race Driver 2006,8.1,Sumo Digital,Codemasters,Race Driver 2006 (USA) (v1.01).iso,1.6 GiB,95.7 GiB
Riviera: The Promised Land,8.1,Sting,Atlus,Riviera - The Promised Land (USA).iso,1.0 GiB,96.7 GiB
Rock Band Unplugged,8.1,Backbone Entertainment,Electronic Arts,Rock Band Unplugged (USA).iso,1.3 GiB,97.9 GiB
Snoopy vs. the Red Baron,8.1,Smart Bomb Interactive,Namco Bandai Games,Snoopy vs the Red Baron (USA).iso,515.8 MiB,98.4 GiB
SOCOM: U.S. Navy SEALs Fireteam Bravo 2,8.1,Zipper Interactive,SCEA,SOCOM - U.S. Navy SEALs - Fireteam Bravo 2 (USA).iso,882.0 MiB,99.3 GiB
Street Fighter Alpha 3,8.1,Capcom,Capcom,Street Fighter Alpha 3 Max (USA).iso,235.4 MiB,99.5 GiB
The 2D Adventures of Rotating Octopus Character,8.1,Dakko Dakko,Dakko Dakko,"2D Adventures of Rotating Octopus Character, The (USA) (minis) (PSN).iso",138.2 MiB,99.7 GiB
The Warriors,8.1,Rockstar Toronto,Rockstar Games,"Warriors, The (USA) (v1.02).iso",1.7 GiB,101.3 GiB
Tomb Raider: Legend,8.1,Crystal Dynamics,Eidos Interactive,Tomb Raider - Legend (USA) (PSP) (PSN).iso,1.4 GiB,102.7 GiB
"Warhammer 40,000: Squad Command",8.1,RedLynx,THQ,"Warhammer 40,000 - Squad Command (USA) (En,Fr) (v1.01).iso",475.8 MiB,103.2 GiB
Warriors Orochi 2,8.1,Omega Force,Koei,"Warriors Orochi 2 (USA) (En,Fr) (v1.02).iso",1.7 GiB,104.9 GiB
"What Did I Do to Deserve This, My Lord!? 2",8.1,Acquire,NIS America,"What Did I Do to Deserve This, My Lord! 2 (USA) (v1.01).iso",309.9 MiB,105.2 GiB
Where is My Heart?,8.1,Die Gute Fabrik,Copenhagen Game Collective,Where is my Heart (USA) (minis) (PSN).iso,195.6 MiB,105.4 GiB
WWE SmackDown! vs. Raw 2006,8.1,Yuke's,THQ,"WWE SmackDown vs. Raw 2006 (Europe) (En,Fr,De,Es,It).iso",1.6 GiB,107.0 GiB
Yggdra Union: We'll Never Fight Alone,8.1,Sting,Atlus,Yggdra Union - We'll Never Fight Alone (USA).iso,733.1 MiB,107.7 GiB
Ys: The Ark of Napishtim,8.1,Konami Software Shanghai,Konami,Ys - The Ark of Napishtim (USA).iso,650.0 MiB,108.3 GiB
Ys: The Oath in Felghana,8.1,Falcom,XSEED Games,Ys - The Oath in Felghana (USA).iso,1.0 GiB,109.3 GiB
Ace Combat X: Skies of Deception,8.0,Project Aces ,Namco Bandai Games,Ace Combat X - Skies of Deception (USA).iso,1.0 GiB,110.4 GiB
Beaterator,8.0,Rockstar Leeds,Rockstar Games,Beaterator (USA) (v1.01).iso,1.0 GiB,111.4 GiB
Ben 10: Protector of Earth,8.0,High Voltage Software,D3Publisher,Ben 10 - Protector of Earth (USA) (v1.01).iso,653.5 MiB,112.0 GiB
Dead to Rights: Reckoning,8.0,Rebellion,Namco,Dead to Rights - Reckoning (USA).iso,184.2 MiB,112.2 GiB
Death Jr. II: Root of Evil,8.0,Backbone Entertainment,Konami,Death Jr. II - Root of Evil (USA) (v1.01).iso,697.8 MiB,112.9 GiB
Dragon Ball Z: Shin Budokai - Another Road,8.0,Dimps Corporation,Atari SA,Dragon Ball Z - Shin Budokai Another Road (USA).iso,504.9 MiB,113.4 GiB
Elminage Original,8.0,Starfish SD,UFO Interactive,Elminage Original (USA) (PSP) (PSN).iso,541.8 MiB,113.9 GiB
FIFA 07 Soccer,8.0,EA Sports,EA Sports,FIFA Soccer (USA) (v1.02).iso,1.2 GiB,115.1 GiB
Gitaroo Man Lives!,8.0,Koei/Inis,Koei,Gitaroo Man Lives! (USA).iso,1.6 GiB,116.7 GiB
Gods Eater Burst,8.0,Shift,D3Publisher,Gods Eater Burst (USA).iso,1.4 GiB,118.0 GiB
Hot Shots Tennis: Get a Grip,8.0,Clap Hanz,SCEA,Hot Shots Tennis - Get a Grip (USA) (v1.01).iso,1.2 GiB,119.2 GiB
Manhunt 2,8.0,Rockstar Toronto,Rockstar Games,"Manhunt 2 (USA, Canada).iso",1.2 GiB,120.4 GiB
MLB,8.0,989 Sports,SCEA,MLB (USA).iso,1.1 GiB,121.5 GiB
NBA Live 06,8.0,EA Canada,EA Sports,NBA Live 06 (USA).iso,1.2 GiB,122.7 GiB
One Epic Game,8.0,Grip Games,Grip Games,One Epic Game (USA) (minis) (PSN).iso,145.2 MiB,122.8 GiB
Pac-Man World 3,8.0,Blitz Games,Namco,Pac Man World 3 (USA) (v1.01).iso,471.3 MiB,123.3 GiB
Pro Evolution Soccer 2008,8.0,Konami,Konami,"Pro Evolution Soccer 2008 (USA) (En,Fr,Es).iso",1.3 GiB,124.6 GiB
Shadow of Destiny,8.0,KCET,Konami,Shadow of Destiny (USA).iso,1.0 GiB,125.6 GiB
SoulCalibur: Broken Destiny,8.0,Project Soul,Namco Bandai Games,"Soulcalibur - Broken Destiny (USA) (En,Ja,Fr,De,Es,It,Ru).iso",859.2 MiB,126.4 GiB
Star Ocean: Second Evolution,8.0,TOSE,Square Enix,Star Ocean - Second Evolution (USA).iso,1.3 GiB,127.8 GiB
The Lord of the Rings: Tactics,8.0,Amaze Entertainment,EA Games,"Lord of the Rings, The - Tactics (USA).iso",528.5 MiB,128.3 GiB
Valhalla Knights,8.0,K2 LLC,XSEED Games,Valhalla Knights (USA) (v1.01).iso,630.3 MiB,128.9 GiB
Worms: Open Warfare 2,8.0,Team17,THQ,Worms - Open Warfare 2 (USA) (v1.02).iso,187.1 MiB,129.1 GiB
Age of Zombies,7.9,Halfbrick Studios,Halfbrick Studios,Age of Zombies (USA) (minis) (PSN).iso,135.6 MiB,129.2 GiB
Capcom Classics Collection Remixed,7.9,Digital Eclipse,Capcom,Capcom Classics Collection Remixed (USA).iso,545.5 MiB,129.7 GiB
Dead Head Fred,7.9,Vicious Cycle,D3Publisher,Dead Head Fred (USA) (v1.02).iso,1.3 GiB,131.1 GiB
Def Jam: Fight for NY,7.9,Aki Corp.,EA Games,Def Jam - Fight for NY - The Takeover (USA) (v1.01).iso,1.5 GiB,132.5 GiB
echochrome,7.9,SCE Japan Studio,SCEA,Echochrome (USA) (PSP) (PSN).iso,176.5 MiB,132.7 GiB
Exit (2008),7.9,Taito Corporation,Ubisoft,"Exit 2 (Europe) (En,Fr,De,Es,It) (v1.01).iso",157.0 MiB,132.8 GiB
Fat Princess,7.9,Titan Studios,SCEA,Glass Heart Princess (Japan) (v1.02).iso,1.6 GiB,134.5 GiB
Fate/Extra,7.9,Imageepoch,Aksys Games,Fate-Extra (USA).iso,1.2 GiB,135.7 GiB
FIFA 08 Soccer,7.9,EA Canada,EA Sports,FIFA Soccer (USA) (v1.02).iso,1.2 GiB,136.8 GiB
Floating Cloud God Saves the Pilgrims,7.9,Dakko Dakko,Dakko Dakko,Floating Cloud God Saves the Pilgrims (USA) (minis) (PSN).iso,127.8 MiB,136.9 GiB
Halfbrick Echoes,7.9,Halfbrick Studios,Halfbrick Studios,,,
Killzone: Liberation,7.9,Guerrilla,SCEA,"Killzone - Liberation (USA) (En,Fr,De,Es,It,Nl,Pl,Ru).iso",554.7 MiB,137.5 GiB
LEGO Pirates of the Caribbean: The Video Game,7.9,Traveller's Tales,Disney Interactive Studios,"LEGO Pirates of the Caribbean - The Video Game (USA) (En,Fr,Es).iso",1.4 GiB,138.9 GiB
Midnight Club: LA Remix,7.9,Rockstar London,Rockstar Games,Midnight Club - L.A. Remix (USA) (v2.02).iso,894.8 MiB,139.7 GiB
MLB 10: The Show,7.9,SCEA,SCEA,MLB 10 - The Show (USA).iso,1.4 GiB,141.1 GiB
Mortal Kombat: Deception,7.9,Midway,Midway,Mortal Kombat - Unchained (USA) (v1.03).iso,1.5 GiB,142.6 GiB
MotorStorm: Arctic Edge,7.9,Bigbig Studios,SCEA,"MotorStorm - Arctic Edge (USA) (En,Fr,De,Es,It,Nl,Pt,Ru).iso",830.5 MiB,143.4 GiB
Obscure: The Aftermath,7.9,Hydravision,Ignition Entertainment,"Obscure - The Aftermath (USA) (En,Fr,Es).iso",942.0 MiB,144.3 GiB
Shift Extended,7.9,Zallag,Zallag,Shift Extended (USA) (minis) (PSN).iso,116.1 MiB,144.4 GiB
SSX On Tour,7.9,EA Canada,EA Sports Big,"SSX - On Tour (USA) (En,Fr,De).iso",1.3 GiB,145.7 GiB
Star Wars: Battlefront II (2005),7.9,Pandemic Studios,LucasArts,Star Wars - Battlefront II (USA).iso,704.4 MiB,146.4 GiB
Twisted Metal: Head-On,7.9,Incognito Inc.,SCEA,Twisted Metal - Head-On (USA).iso,799.8 MiB,147.2 GiB
Virtua Tennis 3,7.9,Sega AM3,Sega,"Virtua Tennis 3 (USA) (En,Ja,Fr,De,Es,It) (v1.02).iso",555.2 MiB,147.7 GiB
Wizorb,7.9,Beatshapers,Beatshapers,Wizorb (USA) (minis) (PSN).iso,187.8 MiB,147.9 GiB
Ys Book I & II,7.9,Interchannel-Holon,Atlus,Ys I & II (Japan) (PCE) (PSN).iso,106.0 MiB,148.0 GiB
Yu-Gi-Oh! 5D's Tag Force 4,7.9,Konami,Konami,"Yu-Gi-Oh! 5D's - Tag Force 4 (USA) (En,Fr,De,Es,It) (v1.01).iso",1.6 GiB,149.7 GiB
Black Rock Shooter: The Game,7.8,Imageepoch,NIS America,Black Rock Shooter - The Game (USA) (PSN).iso,1.3 GiB,150.9 GiB
Corpse Party: Book of Shadows,7.8,5pb,XSEED Games,Corpse Party - Book of Shadows (USA) (PSN).iso,1.3 GiB,152.2 GiB
Crimson Gem Saga,7.8,"IronNos Co.,Ltd.",Atlus,Crimson Gem Saga (USA).iso,837.9 MiB,153.1 GiB
Field Commander,7.8,Sony Online Entertainment,Sony Online Entertainment,Field Commander (USA).iso,1.1 GiB,154.2 GiB
Gladiator Begins,7.8,Goshow,Aksys Games,Gladiator Begins (USA).iso,452.7 MiB,154.6 GiB
Gun,7.8,Neversoft Entertainment,Activision,Gunpey (USA).iso,697.6 MiB,155.3 GiB
Hammerin' Hero,7.8,Irem,Atlus,Hammerin' Hero (USA).iso,217.4 MiB,155.5 GiB
Indiana Jones and the Staff of Kings,7.8,Artificial Mind and Movement,LucasArts,Indiana Jones and the Staff of Kings (USA).iso,670.9 MiB,156.2 GiB
Invizimals,7.8,Novarama,SCEA,"Invizimals (USA) (En,Fr,Es) (v1.02).iso",1.5 GiB,157.7 GiB
LEGO Batman: The Videogame,7.8,Traveller's Tales,Warner Bros. Interactive Entertainment,"LEGO Batman - The Videogame (USA) (En,Fr,Es).iso",1.1 GiB,158.7 GiB
Mercury Meltdown,7.8,Ignition Entertainment,Ignition Entertainment,"Mercury Meltdown (USA) (En,Fr,Es) (v1.01).iso",343.9 MiB,159.1 GiB
Metal Gear Acid,7.8,Konami,Konami,Metal Gear Ac!d (USA).iso,192.1 MiB,159.3 GiB
Shin Megami Tensei: Persona,7.8,ITL,Atlus,Shin Megami Tensei - Persona (USA).iso,782.7 MiB,160.0 GiB
Silent Hill: Origins,7.8,Climax Studios,Konami,Silent Hill Origins (USA) (PSN).iso,767.4 MiB,160.8 GiB
Star Wars Battlefront: Elite Squadron,7.8,Savage Entertainment,LucasArts,"Star Wars Battlefront - Elite Squadron (USA) (En,Fr,De,Es,It).iso",1.4 GiB,162.1 GiB
Worms: Battle Islands,7.8,Team17,Team17,Worms - Battle Islands (USA) (PSP) (PSN).iso,182.0 MiB,162.3 GiB
WWE All Stars,7.8,THQ,THQ,"WWE All Stars (Europe) (En,Fr,De,Es,It).iso",1.5 GiB,163.8 GiB
WWE SmackDown vs. Raw 2007,7.8,Yuke's,THQ,WWE SmackDown vs. Raw 2007 (USA).iso,1.5 GiB,165.3 GiB
Angry Birds,7.7,Abstraction Games,Chillingo,Angry Birds (USA) (v2) (minis) (PSN).iso,161.4 MiB,165.5 GiB
BlazBlue: Continuum Shift II,7.7,Arc System Works,Aksys Games,"BlazBlue - Continuum Shift II (USA) (En,Ja,Zh,Ko) (v1.01).iso",1.5 GiB,167.0 GiB
Burnout Dominator,7.7,Criterion Games,Electronic Arts,Burnout Dominator (USA).iso,659.1 MiB,167.7 GiB
DJ Max Fever,7.7,Pentavision Entertainment,PM Studios Inc.,DJ Max Fever (USA) (v1.03).iso,1.6 GiB,169.3 GiB
Dungeon Siege: Throne of Agony,7.7,SuperVillain Studios,Take-Two Interactive,Dungeon Siege - Throne of Agony (USA) (v1.02).iso,633.0 MiB,169.9 GiB
echoshift,7.7,SCEJ,SCEA,Echoshift (USA) (PSP) (PSN).iso,277.6 MiB,170.2 GiB
Football Manager 2011,7.7,Sports Interactive,Sega,"Football Manager Handheld 2011 (Europe) (En,Fr,Es,It) (v1.02).iso",203.9 MiB,170.4 GiB
Guilty Gear Judgment,7.7,Arc System Works,Majesco,Guilty Gear Judgment (USA) (v1.01).iso,572.8 MiB,170.9 GiB
MLB 11: The Show,7.7,SCEA San Diego Studios,SCEA,MLB 11 - The Show (USA).iso,1.3 GiB,172.2 GiB
Need for Speed: Carbon,7.7,EA Canada,EA Games,Need for Speed Carbon - Own the City (USA).iso,852.8 MiB,173.1 GiB
No Heroes Allowed!,7.7,Acquire,SCEA,No Heroes Allowed! (USA) (PSP) (PSN).iso,308.7 MiB,173.4 GiB
Sonic Rivals 2,7.7,Backbone Entertainment,Sega,Sonic Rivals 2 (USA) (v1.01).iso,492.0 MiB,173.9 GiB
The Sims 2,7.7,Maxis,EA Games,"Sims 2, The (USA).iso",1.0 GiB,174.9 GiB
Yu-Gi-Oh! GX Tag Force 2,7.7,Konami,Konami,Yu-Gi-Oh! GX - Tag Force 2 (USA) (v1.02).iso,1.7 GiB,176.6 GiB
1000 Tiny Claws,7.6,Mediatonic,Mediatonic,1000 Tiny Claws (USA) (minis) (PSN).iso,194.0 MiB,176.8 GiB
Alien Zombie Death,7.6,PomPom Games,PomPom Games,Alien Zombie Death (USA) (minis) (PSN).iso,132.3 MiB,176.9 GiB
Disgaea Infinite,7.6,Nippon Ichi Software,NIS America,Disgaea Infinite (USA) (v1.01).iso,267.3 MiB,177.2 GiB
Dragon Ball Z: Shin Budokai,7.6,Dimps Corporation,Atari SA,Dragon Ball Z - Shin Budokai (USA).iso,311.6 MiB,177.5 GiB
Fate/Unlimited Codes,7.6,Eighting,Capcom,Fate-Unlimited Codes (USA) (PSP) (PSN).iso,704.2 MiB,178.2 GiB
Generation of Chaos: Pandora's Reflection,7.6,Sting,NIS America,Generation of Chaos - Pandora's Reflection (USA) (PSN).iso,468.6 MiB,178.6 GiB
Gran Turismo: The Real Driving Simulator,7.6,Polyphony Digital,SCEA,,,
Innocent Life: A Futuristic Harvest Moon,7.6,ArtePiazza,Natsume,Innocent Life - A Futuristic Harvest Moon (USA).iso,335.5 MiB,178.9 GiB
Lego Indiana Jones: The Original Adventures,7.6,Traveller's Tales,LucasArts,"LEGO Indiana Jones - The Original Adventures (USA) (En,Fr,Es).iso",1.2 GiB,180.1 GiB
Lemmings (2006),7.6,Team17,SCEA,Lemmings (USA) (v1.01).iso,449.7 MiB,180.5 GiB
M.A.C.H. Modified Air Combat Heroes,7.6,VU Games,Sierra Entertainment,M.A.C.H. - Modified Air Combat Heroes (USA) (v1.01).iso,791.6 MiB,181.3 GiB
Me Monstar: Hear Me Roar!,7.6,Cohort Studios,Cohort Studios,Me Monstar - Hear Me Roar! (USA) (minis) (PSN).iso,169.8 MiB,181.5 GiB
Midnight Club 3: DUB Edition,7.6,Rockstar San Diego,Rockstar Games,Midnight Club 3 - DUB Edition (USA) (v2.02).iso,1.5 GiB,183.0 GiB
Pix'n Love Rush,7.6,Pasta Games,Bulkypix,Pix'n Love Rush (USA) (minis) (PSN).iso,149.0 MiB,183.2 GiB
Power Stone Collection,7.6,Capcom,Capcom,Power Stone Collection (USA).iso,493.4 MiB,183.6 GiB
Pursuit Force: Extreme Justice,7.6,Bigbig Studios,SCEA,"Pursuit Force - Extreme Justice (USA) (En,Fr,Es).iso",1.4 GiB,185.0 GiB
Sonic Rivals,7.6,Backbone Entertainment,Sega,Sonic Rivals (USA).iso,234.7 MiB,185.2 GiB
