title,score,developer,publisher,rom_name,size,running_total
The Legend of Heroes: A Tear of Vermillion,7.6,Microvision,Bandai,"Legend of Heroes, The - A Tear of Vermillion (USA) (v1.01).iso",638.9 MiB,185.8 GiB
Who's That Flying?!,7.6,Mediatonic,SCEA,Who's That Flying (USA) (minis) (PSN).iso,192.7 MiB,186.0 GiB
X-MEN ORIGINS: WOLVERINE,7.6,Raven Software,Activision,,,
Activision Hits Remixed,7.5,Digital Eclipse,Activision,Activision Hits Remixed (USA) (v1.01).iso,264.8 MiB,186.3 GiB
Archer Maclean's Mercury,7.5,Awesome Studios,Ignition Entertainment,Archer Maclean's Mercury (USA).iso,275.9 MiB,186.6 GiB
Chili Con Carnage,7.5,Deadline Games,Eidos Interactive,Chili Con Carnage (USA) (v1.02).iso,760.2 MiB,187.3 GiB
Disney/Pixar Cars,7.5,Rainbow Studios,THQ,Disney-Pixar Cars (Europe).iso,864.4 MiB,188.1 GiB
Knights in the Nightmare,7.5,Sting,Atlus,Knights in the Nightmare (USA).iso,485.5 MiB,188.6 GiB
Madden NFL 08,7.5,EA Tiburon,EA Sports,Madden NFL 08 (USA).iso,1.5 GiB,190.1 GiB
Me & My Katamari,7.5,Namco,Namco,Me & My Katamari (USA).iso,1.6 GiB,191.8 GiB
Metal Slug XX,7.5,SNK Playmore,Atlus,Metal Slug XX (USA) (v1.01).iso,442.2 MiB,192.2 GiB
Naruto Shippuden: Ultimate Ninja Impact,7.5,Racjin,Namco Bandai Games,"Naruto Shippuden - Ultimate Ninja Impact (USA) (En,Fr,Es).iso",1013.7 MiB,193.2 GiB
NBA Street Showdown,7.5,EA Canada,EA Sports Big,NBA Street Showdown (USA).iso,1.1 GiB,194.3 GiB
Need for Speed Underground Rivals,7.5,Team Fusion,EA Games,Need for Speed - Underground Rivals (USA).iso,843.8 MiB,195.1 GiB
Patapon 3,7.5,SCE Japan Studio,SCEA,"Patapon 3 (USA) (En,Fr,Es,Pt).iso",530.2 MiB,195.6 GiB
Persona 2: Innocent Sin,7.5,ITL,Atlus,Persona 2 - Tsumi - Innocent Sin (Japan).iso,1.0 GiB,196.7 GiB
Phantasy Star Portable,7.5,Alfa System,Sega,Phantasy Star Portable (USA).iso,1.0 GiB,197.7 GiB
PoPoLoCrois,7.5,G-Artists,Agetec,PoPoLoCrois (USA).iso,1.2 GiB,198.9 GiB
Prince of Persia Rival Swords,7.5,Ubisoft Montreal,Ubisoft,"Prince of Persia - Rival Swords (USA) (En,Fr,Es) (v1.01).iso",1.2 GiB,200.0 GiB
Prince of Persia: Warrior Within,7.5,Ubisoft Montreal,Ubisoft,"Prince of Persia - Revelations (USA) (En,Fr,Es) (v1.01).iso",1.6 GiB,201.6 GiB
Pro Evolution Soccer 2009,7.5,KCET,Konami,"Pro Evolution Soccer 2009 (USA) (En,Fr,Es,Pt) (v1.01).iso",1.3 GiB,203.0 GiB
Secret Agent Clank,7.5,High Impact Games,SCEA,"Secret Agent Clank (USA) (En,Fr,De,Es,It).iso",1.4 GiB,204.4 GiB
Star Ocean: First Departure,7.5,TOSE,Square Enix,Star Ocean - First Departure (USA).iso,1.1 GiB,205.4 GiB
The Simpsons Game,7.5,EA Redwood Shores,EA Games,"Simpsons Game, The (USA).iso",729.4 MiB,206.2 GiB
WWE SmackDown vs. Raw 2008,7.5,Yuke's,THQ,WWE SmackDown vs. Raw 2008 (USA).iso,1.7 GiB,207.8 GiB
Blimp: The Flying Adventures,7.4,Craneballs Studios,Craneballs Studios,Blimp - The Flying Adventures (USA) (minis) (PSN).iso,198.0 MiB,208.0 GiB
Dynasty Warriors: Strikeforce,7.4,Omega Force,Koei,Dynasty Warriors - Strikeforce (USA).iso,1.3 GiB,209.3 GiB
Every Extend Extra,7.4,Q Entertainment,Buena Vista Games,Every Extend Extra (USA).iso,357.3 MiB,209.7 GiB
FIFA Street 2,7.4,EA Canada,EA Sports Big,FIFA Street 2 (USA) (v1.01).iso,861.1 MiB,210.5 GiB
Fight Night Round 3,7.4,EA Chicago,EA Sports,Fight Night Round 3 (USA).iso,1.1 GiB,211.6 GiB
Infected (2005),7.4,Planet Moon Studios,Majesco,Infected (USA) (v1.02).iso,562.7 MiB,212.1 GiB
Kingdom of Paradise,7.4,Climax Entertainment,SCEA,Kingdom of Paradise (USA).iso,1.0 GiB,213.1 GiB
LocoRoco Midnight Carnival,7.4,SCE Japan Studio,SCEA,"LocoRoco - Midnight Carnival (USA) (En,Ja,Fr,De,Es,It,Nl,Pt,Sv,No,Da,Fi,Zh,Ko,Ru) (PSP) (PSN).iso",309.1 MiB,213.4 GiB
PQ2: Practical Intelligence Quotient,7.4,Now Production,D3Publisher,PQ - Practical Intelligence Quotient (USA) (v1.01).iso,170.4 MiB,213.6 GiB
Prince of Persia: The Forgotten Sands,7.4,Ubisoft Montreal,Ubisoft,"Prince of Persia - The Forgotten Sands (USA) (En,Fr,Es) (v1.01).iso",659.4 MiB,214.2 GiB
Pro Evolution Soccer 2011,7.4,Konami,Konami,"Pro Evolution Soccer 2011 (USA) (En,Es).iso",1.4 GiB,215.6 GiB
Pro Evolution Soccer 2012,7.4,Konami,Konami,"Pro Evolution Soccer 2012 (USA) (En,Fr,Es,Pt) (v1.01).iso",1.7 GiB,217.3 GiB
Sega Rally Revo,7.4,SEGA Racing Studio,Sega,Sega Rally Revo (USA).iso,188.1 MiB,217.5 GiB
Silent Hill: Shattered Memories,7.4,Climax Studios,Konami,Silent Hill - Shattered Memories (USA).iso,967.0 MiB,218.4 GiB
Summon Night 5,7.4,Felistella,GAIJINWORKS,Summon Night 5 (USA).iso,855.7 MiB,219.2 GiB
The Godfather: Mob Wars,7.4,Page 44 Studios,Electronic Arts,"Godfather, The - Mob Wars (USA).iso",1.3 GiB,220.5 GiB
UFC Undisputed 2010,7.4,Yuke's,THQ,UFC Undisputed 2010 (USA).iso,1.6 GiB,222.2 GiB
Adventures to Go!,7.3,Global A,Natsume,Adventures to Go! (USA) (v1.02).iso,168.0 MiB,222.3 GiB
After Burner: Black Falcon,7.3,Planet Moon Studios,Sega,"After Burner - Black Falcon (USA) (En,Fr,Es,It,Nl).iso",407.6 MiB,222.7 GiB
Dungeon Maker: Hunting Ground,7.3,Global A,XSEED Games,Dungeon Maker - Hunting Ground (USA) (v1.01).iso,143.5 MiB,222.9 GiB
Ghost Rider,7.3,Climax Studios,2K Games,"Ghost Rider (USA) (En,Fr,De,Es,It) (v1.02).iso",752.9 MiB,223.6 GiB
Hexyz Force,7.3,Sting,Atlus,Hexyz Force (USA).iso,675.8 MiB,224.3 GiB
Juiced 2: Hot Import Nights,7.3,Juice Games,THQ,Juiced 2 - Hot Import Nights (USA) (v1.02).iso,1.1 GiB,225.3 GiB
ModNation Racers,7.3,United Front Games,SCEA,"ModNation Racers (USA) (En,Fr,Es).iso",1.5 GiB,226.9 GiB
Need for Speed: Most Wanted (2005),7.3,EA Canada,Electronic Arts,Need for Speed - Most Wanted 5-1-0 (USA).iso,883.7 MiB,227.7 GiB
Pinball Hall of Fame: The Gottlieb Collection,7.3,Farsight Studios,Crave,Pinball Hall of Fame - The Gottlieb Collection (USA).iso,251.9 MiB,228.0 GiB
Untold Legends: The Warrior's Code,7.3,Sony Online Entertainment,Sony Online Entertainment,Untold Legends - The Warrior's Code (USA) (v1.02).iso,1004.9 MiB,228.9 GiB
Wild ARMs XF,7.3,Media.Vision,XSEED Games,Wild Arms XF (USA).iso,1.6 GiB,230.5 GiB
Alien Syndrome (2007),7.2,Totally Games,Sega,Alien Syndrome (USA).iso,471.9 MiB,231.0 GiB
Dead or Alive Paradise,7.2,Team Ninja,Tecmo,Dead or Alive - Paradise (USA) (v1.01).iso,829.7 MiB,231.8 GiB
Jak and Daxter: The Lost Frontier,7.2,High Impact Games,SCEA,"Jak and Daxter - The Lost Frontier (USA) (En,Fr,Es).iso",1.4 GiB,233.1 GiB
Lord of Arcana,7.2,Access Games,Square Enix,"Lord of Arcana (USA) (En,Fr).iso",767.7 MiB,233.9 GiB
Medal of Honor Heroes,7.2,Team Fusion,EA Games,Medal of Honor - Heroes (USA).iso,1.3 GiB,235.2 GiB
The Silent Hill Experience,7.2,Konami,Konami,Silent Hill Origins (USA) (PSN).iso,767.4 MiB,236.0 GiB
Thrillville,7.2,Frontier Developments,LucasArts,Thrillville (USA) (v1.01).iso,689.7 MiB,236.7 GiB
Thrillville: Off the Rails,7.2,Frontier Developments,LucasArts,Thrillville - Off the Rails (USA) (v1.01).iso,742.6 MiB,237.4 GiB
Tokobot,7.2,Tecmo,Tecmo,Tokobot (USA) (v1.02).iso,313.3 MiB,237.7 GiB
WWE SmackDown vs. Raw 2009,7.2,Yuke's,THQ,WWE SmackDown vs. Raw 2009 (Korea).iso,1.4 GiB,239.1 GiB
Cubixx (2010),7.1,Laughing Jackal,Laughing Jackal,Cubixx (USA) (minis) (PSN).iso,133.0 MiB,239.2 GiB
Driver '76,7.1,Sumo Digital,Ubisoft,Driver 76 (USA).iso,1.0 GiB,240.2 GiB
Dungeons & Dragons Tactics,7.1,Kuju Entertainment,Atari SA,Dungeons & Dragons Tactics (USA) (v1.01).iso,462.4 MiB,240.7 GiB
LEGO Harry Potter: Years 1-4,7.1,Traveller's Tales,Warner Bros. Interactive Entertainment,LEGO Harry Potter - Years 1-4 (USA).iso,1.3 GiB,242.0 GiB
Monster Hunter Freedom,7.1,Capcom,Capcom,Monster Hunter Freedom (USA) (v1.01).iso,706.9 MiB,242.7 GiB
Rocky Balboa,7.1,Ubisoft,Ubisoft,Rocky Balboa (USA) (v1.02).iso,864.3 MiB,243.6 GiB
The 3rd Birthday,7.1,HexaDrive,Square Enix,"3rd Birthday, The (USA).iso",1.4 GiB,244.9 GiB
The Sims 2: Castaway,7.1,Maxis,Electronic Arts,"Sims 2, The - Castaway (USA) (En,Fr,De,Es,It,Nl,Pt).iso",986.2 MiB,245.9 GiB
Atari Classics Evolved,7.0,Stainless Games,Atari SA,Atari Classics Evolved (USA) (v1.02).iso,80.1 MiB,246.0 GiB
Call of Duty 3,7.0,Treyarch,Activision,Tales of Destiny 2 (Japan).iso,1.3 GiB,247.3 GiB
flOw,7.0,ThatGameCompany,SCEA,flOw (USA) (PSP) (PSN).iso,132.1 MiB,247.4 GiB
GripShift,7.0,Sidhe Interactive,Sony Platform Publishing,Gripshift (USA).iso,789.2 MiB,248.2 GiB
Harry Potter and the Goblet of Fire,7.0,Electronic Arts,Electronic Arts,Harry Potter and the Goblet of Fire (USA).iso,391.3 MiB,248.6 GiB
Hungry Giraffe,7.0,Laughing Jackal,Laughing Jackal,Hungry Giraffe (USA) (minis) (PSN).iso,141.9 MiB,248.7 GiB
Naruto: Ultimate Ninja Heroes,7.0,CyberConnect2,Namco Bandai Games,Naruto - Ultimate Ninja Heroes (USA).iso,242.3 MiB,248.9 GiB
Naruto: Ultimate Ninja Heroes 2: The Phantom Fortress,7.0,CyberConnect2,Namco Bandai Games,Naruto - Ultimate Ninja Heroes 2 - The Phantom Fortress (USA).iso,1.1 GiB,250.1 GiB
Spider-Man: Friend or Foe,7.0,Next Level Games,Activision,Spider-Man - Friend or Foe (USA).iso,552.0 MiB,250.6 GiB
The Legend of Heroes II: Prophecy of the Moonlight Witch,7.0,Microvision,Namco Bandai Games,"Legend of Heroes II, The - Prophecy of the Moonlight Witch (USA).iso",1.7 GiB,252.3 GiB
World Series of Poker: Tournament of Champions,7.0,Left Field Productions,Activision,World Series of Poker - Tournament of Champions - 2007 Edition (USA).iso,722.7 MiB,253.0 GiB
Yu-Gi-Oh! GX Tag Force,7.0,Konami,Konami,Yu-Gi-Oh! GX - Tag Force (USA) (v1.03).iso,669.2 MiB,253.6 GiB
2010 FIFA World Cup South Africa,6.9,Electronic Arts,EA Sports,"2010 FIFA World Cup South Africa (Canada) (En,Fr).iso",1.6 GiB,255.2 GiB
Arctic Adventures: Polar's Puzzles,6.9,Eiconic Games,Eiconic Games,Arctic Adventures - Polar's Puzzles (USA) (minis) (PSN).iso,138.7 MiB,255.4 GiB
Assassin's Creed: Bloodlines,6.9,Griptonite Games,Ubisoft,"Assassin's Creed - Bloodlines (USA) (En,Fr,De,Es,It).iso",772.1 MiB,256.1 GiB
Crash Tag Team Racing,6.9,Radical Entertainment,VU Games,Crash Tag Team Racing (USA) (v1.01).iso,1.4 GiB,257.6 GiB
Football Manager 2010,6.9,Sports Interactive,Sega,"Football Manager Handheld 2010 (USA) (En,Fr,Es,It) (PSP) (PSN).iso",208.8 MiB,257.8 GiB
Harvest Moon: Boy & Girl,6.9,Marvelous Entertainment,Natsume,Harvest Moon - Boy & Girl (USA).iso,325.7 MiB,258.1 GiB
Medal of Honor Heroes 2,6.9,EA Canada,Electronic Arts,Medal of Honor - Heroes 2 (USA).iso,1.1 GiB,259.2 GiB
Metal Gear Solid: Portable Ops Plus,6.9,Kojima Productions,Konami,Metal Gear Solid - Portable Ops Plus (USA) (v1.01).iso,1.2 GiB,260.4 GiB
MotoGP (2006),6.9,Namco Bandai Games,Namco Bandai Games,"MotoGP (Europe) (En,Fr,De,It,Nl).iso",402.8 MiB,260.8 GiB
Myst (1995),6.9,Hoplite Research,Empire Interactive,Myst (USA) (PSP) (PSN).iso,835.5 MiB,261.6 GiB
Need for Speed: Shift,6.9,Slightly Mad Studios,EA Games,"Need for Speed - Shift (USA) (En,Fr,Es).iso",1.7 GiB,263.3 GiB
PQ: Practical Intelligence Quotient,6.9,Now Production,D3Publisher,PQ - Practical Intelligence Quotient (USA) (v1.01).iso,170.4 MiB,263.4 GiB
Sky Force,6.9,Infinite Dreams,Infinite Dreams,Sky Force (USA) (minis) (PSN).iso,143.7 MiB,263.6 GiB
Super Stardust Portable,6.9,Housemarque,SCEA,"Super Stardust Portable (USA) (En,Fr,De,Es,It,Nl,Pt,Ru) (PSP) (PSN).iso",188.1 MiB,263.8 GiB
The Eye of Judgment: Legends,6.9,SCEJ,SCEA,"Eye of Judgment, The - Legends (USA) (PSP) (PSN).iso",853.5 MiB,264.6 GiB
Tom Clancy's Rainbow Six: Vegas,6.9,Ubisoft Montreal,Ubisoft,"Tom Clancy's Rainbow Six - Vegas (USA) (En,Fr,Es) (v1.02).iso",812.8 MiB,265.4 GiB
Unchained Blades,6.9,FuRyu,XSEED Games,Unchained Blades (USA) (PSN).iso,504.0 MiB,265.9 GiB
Disney/Pixar Ratatouille,6.8,Asobo Studio,THQ,Disney-Pixar Ratatouille (Denmark).iso,864.4 MiB,266.7 GiB
F1 2009,6.8,Sumo Digital,Codemasters,F1 2009 (USA).iso,652.7 MiB,267.4 GiB
FIFA Soccer 11,6.8,EA Sports,Electronic Arts,"FIFA Soccer 11 (USA) (En,Es) (v2.00).iso",1.6 GiB,269.0 GiB
Hysteria Project,6.8,Bulkypix,Sanuk Games,Hysteria Project (USA) (minis) (PSN).iso,188.3 MiB,269.2 GiB
N.O.V.A. - Near Orbit Vanguard Alliance,6.8,Gameloft,Gameloft,,,
DreamWorks Shrek the Third,6.8,7 Studios,Activision,Shrek the Third (USA) (v1.01).iso,485.8 MiB,269.7 GiB
Split/Second,6.8,Black Rock Studio,Disney Interactive Studios,"Split-Second (USA) (En,Fr,Es).iso",1.5 GiB,271.2 GiB
World Poker Tour (2005),6.8,Coresoft,2K Sports,World Poker Tour (USA) (v1.06).iso,579.7 MiB,271.7 GiB
I Must Run!,6.7,Gamelion Studios,Gamelion Studios,I Must Run! (USA) (minis) (PSN).iso,113.7 MiB,271.8 GiB
PaRappa the Rapper,6.7,Epics,SCEA,PaRappa the Rapper (USA).iso,359.8 MiB,272.2 GiB
Spider-Man 2 (2005),6.7,Vicarious Visions,Activision,Spider-Man 2 (USA) (v1.01).iso,556.5 MiB,272.7 GiB
Tales of the World: Radiant Mythology,6.7,Alfa System,Namco Bandai Games,Tales of the World - Radiant Mythology (USA).iso,419.3 MiB,273.1 GiB
Armored Core: Formula Front - Extreme Battle,6.6,From Software,Agetec,Armored Core - Formula Front - Extreme Battle (USA) (v1.02).iso,777.1 MiB,273.9 GiB
Coded Arms,6.6,Konami,Konami,Coded Arms (USA) (v1.01).iso,175.1 MiB,274.1 GiB
DiRT 2,6.6,Codemasters,Codemasters,,,
Final Fantasy II,6.6,TOSE,Square Enix,"Final Fantasy II (Japan, Asia) (En,Ja).iso",274.0 MiB,274.3 GiB
NASCAR (2006),6.6,EA Tiburon,EA Sports,NASCAR (USA) (v1.01).iso,703.8 MiB,275.0 GiB
The Legend of Heroes III: Song of the Ocean,6.6,Microvision,Namco Bandai Games,"Legend of Heroes III, The - Song of the Ocean (USA) (v1.01).iso",834.4 MiB,275.8 GiB
Army of Two: The 40th Day,6.5,EA Montreal,Electronic Arts,Army of Two - The 40th Day (USA).iso,858.6 MiB,276.7 GiB
Brothers in Arms: D-Day,6.5,Ubisoft Shanghai,Ubisoft,Brothers in Arms - D-Day (USA) (v1.01).iso,1.4 GiB,278.0 GiB
Marvel Nemesis: Rise of the Imperfects,6.5,EA Canada,EA Games,Marvel Nemesis - Rise of the Imperfects (USA).iso,864.3 MiB,278.9 GiB
Astonishia Story,6.4,Sonnori,Ubisoft,Astonishia Story (USA) (v1.02).iso,110.2 MiB,279.0 GiB
Crazy Taxi: Fare Wars,6.4,Sega,Sega,"Crazy Taxi - Fare Wars (USA) (En,Fr,De,Es,It) (v2.01).iso",530.2 MiB,279.5 GiB
Disney*Pixar WALL-E,6.4,Heavy Iron Studios,THQ,"Disney-Pixar WALL-E (United Arab Emirates) (En,Ar).iso",826.8 MiB,280.3 GiB
Samurai Warriors: State of War,6.4,Omega Force,Koei,Samurai Warriors - State of War (USA) (v1.01).iso,312.4 MiB,280.6 GiB
Tom Clancy's Splinter Cell Essentials,6.4,Ubisoft,Ubisoft,Tom Clancy's Splinter Cell - Essentials (USA) (v1.02).iso,1.7 GiB,282.3 GiB
ATV Offroad Fury: Blazin' Trails,6.3,Climax Studios,SCEA,ATV Offroad Fury - Blazin' Trails (USA) (v1.01).iso,861.6 MiB,283.2 GiB
Bounty Hounds,6.3,Xpec,Namco Bandai Games,Bounty Hounds (USA).iso,1.1 GiB,284.2 GiB
LEGO Star Wars III: The Clone Wars,6.3,Traveller's Tales,LucasArts,"LEGO Star Wars III - The Clone Wars (USA) (En,Fr,Es).iso",1.6 GiB,285.8 GiB
Miami Vice: The Game (2006),6.3,Rebellion,Sierra Entertainment,Miami Vice - The Game (USA) (v1.01).iso,330.6 MiB,286.2 GiB
Need for Speed: Undercover,6.3,EA Vancouver,Electronic Arts,Need for Speed - Undercover (USA).iso,1.2 GiB,287.4 GiB
Star Wars: Lethal Alliance,6.3,Ubisoft Montreal,Ubisoft,"Star Wars - Lethal Alliance (USA) (En,Fr,De,Es,It) (v1.02).iso",857.9 MiB,288.2 GiB
The Con,6.3,SCEA,SCEA,"Con, The (USA).iso",818.5 MiB,289.0 GiB
Aedis Eclipse: Generation of Chaos,6.2,Idea Factory,NIS America,Aedis Eclipse - Generation of Chaos (USA).iso,638.0 MiB,289.6 GiB
Dynasty Warriors (PSP),6.2,Omega Force,Koei,Dynasty Warriors (USA).iso,153.1 MiB,289.8 GiB
Gunpey DS,6.2,Q Entertainment,Namco Bandai Games,Gunpey (USA).iso,697.6 MiB,290.5 GiB
Mana Khemia: Alchemists of Al-Revis,6.2,Gust,NIS America,,,
Naruto Shippuden: Ultimate Ninja Heroes 3,6.2,CyberConnect2,Namco Bandai Games,Naruto Shippuden - Ultimate Ninja Heroes 3 (USA).iso,1.3 GiB,291.7 GiB
Warriors Orochi,6.2,Omega Force,Koei,Warriors Orochi (USA).iso,864.3 MiB,292.6 GiB
300: March to Glory,6.1,Collision Studios,Warner Bros. Interactive Entertainment,"300 - March to Glory (USA) (En,Fr,De,Es,It) (v1.01).iso",909.8 MiB,293.5 GiB
Tom Clancy's Ghost Recon Advanced Warfighter 2,6.1,Red Storm Entertainment,Ubisoft,"Tom Clancy's Ghost Recon - Advanced Warfighter 2 (USA) (En,Fr,De,Es,It).iso",724.6 MiB,294.2 GiB
Astro Boy: The Video Game,6.0,High Voltage Software,D3Publisher,"Astro Boy - The Video Game (USA) (En,Fr,Es,It,Nl).iso",1.1 GiB,295.3 GiB
Blade Dancer: Lineage of Light,6.0,Hit Maker,NIS America,Blade Dancer - Lineage of Light (USA) (v1.01).iso,370.6 MiB,295.6 GiB
Hot Wheels: Ultimate Racing,6.0,Raylight Studios,DSI Games,"Hot Wheels Ultimate Racing (USA) (En,Fr,De,Es,It) (v1.02).iso",826.3 MiB,296.4 GiB
Naruto Shippuden: Legends: Akatsuki Rising,6.0,Racjin,Namco Bandai Games,Naruto Shippuden - Legends - Akatsuki Rising (USA).iso,728.4 MiB,297.1 GiB
Spider-Man 3,6.0,Treyarch,Activision,Spider-Man 3 (USA).iso,1.6 GiB,298.7 GiB
Brainpipe: A Plunge to Unhumanity,5.9,Hands-On Mobile,Hands-On Mobile,,,
Family Guy,5.9,High Voltage Software,2K Games,Family Guy (USA).iso,1.1 GiB,299.8 GiB
Platypus,5.9,Squashy Software,MumboJumbo,Platypus (USA) (v1.01).iso,72.5 MiB,299.9 GiB
Scarface: Money. Power. Respect.,5.8,Farsight Studios,Sierra Entertainment,Scarface - Money. Power. Respect. (USA) (v1.01).iso,551.7 MiB,300.4 GiB
Avatar: The Last Airbender,5.7,AWE Games,THQ,Avatar - The Last Airbender (USA).iso,169.9 MiB,300.6 GiB
Dynasty Warriors Vol. 2,5.7,Omega Force,Koei,Dynasty Warriors Vol. 2 (USA).iso,266.2 MiB,300.8 GiB
Naruto Shippuden: Kizuna Drive,5.7,Premium Agency ,Namco Bandai Games,"Naruto Shippuden - Kizuna Drive (USA) (En,Fr,Es).iso",1.1 GiB,301.9 GiB
Ultimate Board Game Collection,5.7,Jack of All Games,Valcon Games,Ultimate Board Game Collection (USA) (v1.02).iso,121.2 MiB,302.1 GiB
Ninjamurai,5.5,Open Emotion Studios,Open Emotion Studios,Ninjamurai (USA) (v2.02) (minis) (PSN).iso,171.4 MiB,302.2 GiB
50 Cent: Bulletproof,5.2,High Voltage Software,Vivendi Games,50 Cent - Bulletproof - G-Unit Edition (USA) (v1.02).iso,1.6 GiB,303.8 GiB
Harry Potter and the Order of the Phoenix,5.2,EA Games,EA Games,Harry Potter and the Order of the Phoenix (USA).iso,728.1 MiB,304.5 GiB
Transformers: The Game,4.7,Traveller's Tales,Activision,Transformers - The Game (USA).iso,778.8 MiB,305.3 GiB
TMNT,4.5,Ubisoft Montreal,Ubisoft,"TMNT (USA) (En,Fr,De,Es,It) (v1.01).iso",909.1 MiB,306.2 GiB
Transformers: Revenge of the Fallen The Mobile Game,3.7,"Luxoflux, Inc.",Activision,Transformers - Revenge of the Fallen (USA).iso,1.6 GiB,307.8 GiB
Dragon Ball: Evolution,2.8,Dimps Corporation,Namco Bandai Games,Dragon Ball Evolution (USA).iso,376.5 MiB,308.2 GiB
The Golden Compass,2.8,Shiny Entertainment,Sega,"Golden Compass, The (USA).iso",1.2 GiB,309.3 GiB
