title,score,developer,publisher,rom_name,size,running_total
Class of Heroes 2,7.7,Zerodiv,MonkeyPaw Games,Class of Heroes 2 (USA) (v1.01).iso,660.0 MiB,190.7 GiB
DJ Max Fever,7.7,Pentavision Entertainment,PM Studios Inc.,DJ Max Fever (USA) (v1.03).iso,1.6 GiB,192.3 GiB
Dungeon Siege: Throne of Agony,7.7,SuperVillain Studios,Take-Two Interactive,Dungeon Siege - Throne of Agony (USA) (v1.02).iso,633.0 MiB,192.9 GiB
echoshift,7.7,SCEJ,SCEA,Echoshift (USA) (PSP) (PSN).iso,277.6 MiB,193.2 GiB
FIFA 06: Road to FIFA World Cup,7.7,EA Canada,EA Sports,,,
Football Manager 2011,7.7,Sports Interactive,Sega,"Football Manager Handheld 2011 (Europe) (En,Fr,Es,It) (v1.02).iso",203.9 MiB,193.4 GiB
Guilty Gear Judgment,7.7,Arc System Works,Majesco,Guilty Gear Judgment (USA) (v1.01).iso,572.8 MiB,193.9 GiB
MLB 11: The Show,7.7,SCEA San Diego Studios,SCEA,MLB 11 - The Show (USA).iso,1.3 GiB,195.2 GiB
Need for Speed: Carbon,7.7,EA Canada,EA Games,Need for Speed Carbon - Own the City (USA).iso,852.8 MiB,196.1 GiB
No Heroes Allowed!,7.7,Acquire,SCEA,No Heroes Allowed! (USA) (PSP) (PSN).iso,308.7 MiB,196.4 GiB
Sonic Rivals 2,7.7,Backbone Entertainment,Sega,Sonic Rivals 2 (USA) (v1.01).iso,492.0 MiB,196.8 GiB
The Sims 2,7.7,Maxis,EA Games,"Sims 2, The (USA).iso",1.0 GiB,197.9 GiB
Yu-Gi-Oh! GX Tag Force 2,7.7,Konami,Konami,Yu-Gi-Oh! GX - Tag Force 2 (USA) (v1.02).iso,1.7 GiB,199.6 GiB
1000 Tiny Claws,7.6,Mediatonic,Mediatonic,1000 Tiny Claws (USA) (minis) (PSN).iso,194.0 MiB,199.8 GiB
Alien Zombie Death,7.6,PomPom Games,PomPom Games,Alien Zombie Death (USA) (minis) (PSN).iso,132.3 MiB,199.9 GiB
Brave Story: New Traveler,7.6,Game Republic,XSEED Games,Brave Story - New Traveler (USA) (v1.01).iso,184.4 MiB,200.1 GiB
Disgaea Infinite,7.6,Nippon Ichi Software,NIS America,Disgaea Infinite (USA) (v1.01).iso,267.3 MiB,200.3 GiB
Dragon Ball Z: Shin Budokai,7.6,Dimps Corporation,Atari SA,Dragon Ball Z - Shin Budokai (USA).iso,311.6 MiB,200.6 GiB
Fate/Unlimited Codes,7.6,Eighting,Capcom,Fate-Unlimited Codes (USA) (PSP) (PSN).iso,704.2 MiB,201.3 GiB
Generation of Chaos: Pandora's Reflection,7.6,Sting,NIS America,Generation of Chaos - Pandora's Reflection (USA) (PSN).iso,468.6 MiB,201.8 GiB
Gran Turismo: The Real Driving Simulator,7.6,Polyphony Digital,SCEA,,,
Innocent Life: A Futuristic Harvest Moon,7.6,ArtePiazza,Natsume,Innocent Life - A Futuristic Harvest Moon (USA).iso,335.5 MiB,202.1 GiB
Lego Indiana Jones: The Original Adventures,7.6,Traveller's Tales,LucasArts,"LEGO Indiana Jones - The Original Adventures (USA) (En,Fr,Es).iso",1.2 GiB,203.3 GiB
Lemmings (2006),7.6,Team17,SCEA,Lemmings (USA) (v1.01).iso,449.7 MiB,203.7 GiB
M.A.C.H. Modified Air Combat Heroes,7.6,VU Games,Sierra Entertainment,M.A.C.H. - Modified Air Combat Heroes (USA) (v1.01).iso,791.6 MiB,204.5 GiB
Mad Blocker Alpha: Revenge of the Fluzzles,7.6,Open Emotion Studios,Open Emotion Studios,Mad Blocker Alpha - Revenge of the Fluzzles (Europe) (v3) (minis) (PSN).iso,133.0 MiB,204.6 GiB
Me Monstar: Hear Me Roar!,7.6,Cohort Studios,Cohort Studios,Me Monstar - Hear Me Roar! (USA) (minis) (PSN).iso,169.8 MiB,204.8 GiB
Midnight Club 3: DUB Edition,7.6,Rockstar San Diego,Rockstar Games,Midnight Club 3 - DUB Edition (USA) (v2.02).iso,1.5 GiB,206.3 GiB
NHL 07,7.6,EA Sports,EA Sports,NHL 07 (USA) (v1.01).iso,1.6 GiB,207.9 GiB
Pix'n Love Rush,7.6,Pasta Games,Bulkypix,Pix'n Love Rush (USA) (minis) (PSN).iso,149.0 MiB,208.1 GiB
Power Stone Collection,7.6,Capcom,Capcom,Power Stone Collection (USA).iso,493.4 MiB,208.6 GiB
Pursuit Force: Extreme Justice,7.6,Bigbig Studios,SCEA,"Pursuit Force - Extreme Justice (USA) (En,Fr,Es).iso",1.4 GiB,209.9 GiB
Sonic Rivals,7.6,Backbone Entertainment,Sega,Sonic Rivals (USA).iso,234.7 MiB,210.1 GiB
The Legend of Heroes: A Tear of Vermillion,7.6,Microvision,Bandai,"Legend of Heroes, The - A Tear of Vermillion (USA) (v1.01).iso",638.9 MiB,210.8 GiB
Ultimate Block Party,7.6,Magicpot,Conspiracy Entertainment,Ultimate Block Party (USA) (v1.02).iso,136.1 MiB,210.9 GiB
Who's That Flying?!,7.6,Mediatonic,SCEA,Who's That Flying (USA) (minis) (PSN).iso,192.7 MiB,211.1 GiB
X-MEN ORIGINS: WOLVERINE,7.6,Raven Software,Activision,,,
Activision Hits Remixed,7.5,Digital Eclipse,Activision,Activision Hits Remixed (USA) (v1.01).iso,264.8 MiB,211.4 GiB
Archer Maclean's Mercury,7.5,Awesome Studios,Ignition Entertainment,Archer Maclean's Mercury (USA).iso,275.9 MiB,211.6 GiB
Chili Con Carnage,7.5,Deadline Games,Eidos Interactive,Chili Con Carnage (USA) (v1.02).iso,760.2 MiB,212.4 GiB
Disney/Pixar Cars,7.5,Rainbow Studios,THQ,Disney-Pixar Cars (Europe).iso,864.4 MiB,213.2 GiB
Dracula: Undead Awakening,7.5,Chillingo,Chillingo,Dracula - Undead Awakening (USA) (minis) (PSN).iso,145.0 MiB,213.4 GiB
Guilty Gear XX Accent Core Plus,7.5,Arc System Works,Aksys Games,Guilty Gear XX Accent Core Plus (USA).iso,860.6 MiB,214.2 GiB
Knights in the Nightmare,7.5,Sting,Atlus,Knights in the Nightmare (USA).iso,485.5 MiB,214.7 GiB
Madden NFL 06,7.5,EA Tiburon,EA Sports,Madden NFL 06 (USA).iso,1.6 GiB,216.2 GiB
Madden NFL 08,7.5,EA Tiburon,EA Sports,Madden NFL 08 (USA).iso,1.5 GiB,217.7 GiB
Me & My Katamari,7.5,Namco,Namco,Me & My Katamari (USA).iso,1.6 GiB,219.4 GiB
Metal Slug XX,7.5,SNK Playmore,Atlus,Metal Slug XX (USA) (v1.01).iso,442.2 MiB,219.8 GiB
Naruto Shippuden: Ultimate Ninja Impact,7.5,Racjin,Namco Bandai Games,"Naruto Shippuden - Ultimate Ninja Impact (USA) (En,Fr,Es).iso",1013.7 MiB,220.8 GiB
NBA 08,7.5,SCEA San Diego Studios,SCEA,NBA 08 (USA).iso,864.3 MiB,221.6 GiB
NBA Street Showdown,7.5,EA Canada,EA Sports Big,NBA Street Showdown (USA).iso,1.1 GiB,222.7 GiB
NCAA Football 07,7.5,EA Sports,EA Sports,NCAA Football 07 (USA) (v2.00).iso,1.5 GiB,224.3 GiB
Need for Speed Underground Rivals,7.5,Team Fusion,EA Games,Need for Speed - Underground Rivals (USA).iso,843.8 MiB,225.1 GiB
Patapon 3,7.5,SCE Japan Studio,SCEA,"Patapon 3 (USA) (En,Fr,Es,Pt).iso",530.2 MiB,225.6 GiB
Persona 2: Innocent Sin,7.5,ITL,Atlus,Persona 2 - Tsumi - Innocent Sin (Japan).iso,1.0 GiB,226.7 GiB
Phantasy Star Portable,7.5,Alfa System,Sega,Phantasy Star Portable (USA).iso,1.0 GiB,227.7 GiB
PoPoLoCrois,7.5,G-Artists,Agetec,PoPoLoCrois (USA).iso,1.2 GiB,228.9 GiB
Prince of Persia Rival Swords,7.5,Ubisoft Montreal,Ubisoft,"Prince of Persia - Rival Swords (USA) (En,Fr,Es) (v1.01).iso",1.2 GiB,230.0 GiB
Prince of Persia: Warrior Within,7.5,Ubisoft Montreal,Ubisoft,"Prince of Persia - Revelations (USA) (En,Fr,Es) (v1.01).iso",1.6 GiB,231.6 GiB
Pro Evolution Soccer 2009,7.5,KCET,Konami,"Pro Evolution Soccer 2009 (USA) (En,Fr,Es,Pt) (v1.01).iso",1.3 GiB,233.0 GiB
Pursuit Force,7.5,Bigbig Studios,SCEA,Pursuit Force (USA).iso,1.4 GiB,234.3 GiB
Puzzle Scape Mini,7.5,Farmind Ltd,Farmind Ltd,Puzzle Scape (USA) (v1.04).iso,330.1 MiB,234.6 GiB
Secret Agent Clank,7.5,High Impact Games,SCEA,"Secret Agent Clank (USA) (En,Fr,De,Es,It).iso",1.4 GiB,236.1 GiB
Star Ocean: First Departure,7.5,TOSE,Square Enix,Star Ocean - First Departure (USA).iso,1.1 GiB,237.1 GiB
The Simpsons Game,7.5,EA Redwood Shores,EA Games,"Simpsons Game, The (USA).iso",729.4 MiB,237.8 GiB
WWE SmackDown vs. Raw 2008,7.5,Yuke's,THQ,WWE SmackDown vs. Raw 2008 (USA).iso,1.7 GiB,239.5 GiB
WWE SmackDown vs. Raw 2010,7.5,Yuke's,THQ,WWE SmackDown vs. Raw 2008 (USA).iso,1.7 GiB,241.2 GiB
Blimp: The Flying Adventures,7.4,Craneballs Studios,Craneballs Studios,Blimp - The Flying Adventures (USA) (minis) (PSN).iso,198.0 MiB,241.4 GiB
Dynasty Warriors: Strikeforce,7.4,Omega Force,Koei,Dynasty Warriors - Strikeforce (USA).iso,1.3 GiB,242.7 GiB
Every Extend Extra,7.4,Q Entertainment,Buena Vista Games,Every Extend Extra (USA).iso,357.3 MiB,243.0 GiB
FIFA Street 2,7.4,EA Canada,EA Sports Big,FIFA Street 2 (USA) (v1.01).iso,861.1 MiB,243.8 GiB
Fight Night Round 3,7.4,EA Chicago,EA Sports,Fight Night Round 3 (USA).iso,1.1 GiB,244.9 GiB
Freekscape: Escape From Hell,7.4,Kidguru Studios,Creat Studios,Freekscape - Escape From Hell (USA) (minis) (PSN).iso,205.2 MiB,245.1 GiB
Infected (2005),7.4,Planet Moon Studios,Majesco,Infected (USA) (v1.02).iso,562.7 MiB,245.7 GiB
Kingdom of Paradise,7.4,Climax Entertainment,SCEA,Kingdom of Paradise (USA).iso,1.0 GiB,246.7 GiB
LocoRoco Midnight Carnival,7.4,SCE Japan Studio,SCEA,"LocoRoco - Midnight Carnival (USA) (En,Ja,Fr,De,Es,It,Nl,Pt,Sv,No,Da,Fi,Zh,Ko,Ru) (PSP) (PSN).iso",309.1 MiB,247.0 GiB
Michael Jackson The Experience,7.4,Ubisoft Montpellier,Ubisoft,"Michael Jackson - The Experience (USA) (En,Fr,De,Es,It,Pl,Ru).iso",323.7 MiB,247.3 GiB
Pipe Mania,7.4,Razorworks,Empire Interactive,"Pipe Mania (USA) (En,Fr) (FW3.95).iso",306.9 MiB,247.6 GiB
PQ2: Practical Intelligence Quotient,7.4,Now Production,D3Publisher,PQ - Practical Intelligence Quotient (USA) (v1.01).iso,170.4 MiB,247.7 GiB
Prince of Persia: The Forgotten Sands,7.4,Ubisoft Montreal,Ubisoft,"Prince of Persia - The Forgotten Sands (USA) (En,Fr,Es) (v1.01).iso",659.4 MiB,248.4 GiB
Pro Evolution Soccer 2011,7.4,Konami,Konami,"Pro Evolution Soccer 2011 (USA) (En,Es).iso",1.4 GiB,249.8 GiB
Pro Evolution Soccer 2012,7.4,Konami,Konami,"Pro Evolution Soccer 2012 (USA) (En,Fr,Es,Pt) (v1.01).iso",1.7 GiB,251.4 GiB
Sega Rally Revo,7.4,SEGA Racing Studio,Sega,Sega Rally Revo (USA).iso,188.1 MiB,251.6 GiB
Silent Hill: Shattered Memories,7.4,Climax Studios,Konami,Silent Hill - Shattered Memories (USA).iso,967.0 MiB,252.6 GiB
Summon Night 5,7.4,Felistella,GAIJINWORKS,Summon Night 5 (USA).iso,855.7 MiB,253.4 GiB
The Godfather: Mob Wars,7.4,Page 44 Studios,Electronic Arts,"Godfather, The - Mob Wars (USA).iso",1.3 GiB,254.7 GiB
UFC Undisputed 2010,7.4,Yuke's,THQ,UFC Undisputed 2010 (USA).iso,1.6 GiB,256.3 GiB
Adventures to Go!,7.3,Global A,Natsume,Adventures to Go! (USA) (v1.02).iso,168.0 MiB,256.5 GiB
After Burner: Black Falcon,7.3,Planet Moon Studios,Sega,"After Burner - Black Falcon (USA) (En,Fr,Es,It,Nl).iso",407.6 MiB,256.9 GiB
Dungeon Maker: Hunting Ground,7.3,Global A,XSEED Games,Dungeon Maker - Hunting Ground (USA) (v1.01).iso,143.5 MiB,257.0 GiB
FIFA Soccer 2005,7.3,EA Canada,EA Sports,"FIFA Soccer 12 (USA) (En,Es).iso",1.6 GiB,258.6 GiB
Flying Hamster,7.3,The Game Atelier,The Game Atelier,Flying Hamster (USA) (minis) (PSN).iso,158.2 MiB,258.7 GiB
Ghost Rider,7.3,Climax Studios,2K Games,"Ghost Rider (USA) (En,Fr,De,Es,It) (v1.02).iso",752.9 MiB,259.5 GiB
Hexyz Force,7.3,Sting,Atlus,Hexyz Force (USA).iso,675.8 MiB,260.1 GiB
Juiced 2: Hot Import Nights,7.3,Juice Games,THQ,Juiced 2 - Hot Import Nights (USA) (v1.02).iso,1.1 GiB,261.2 GiB
ModNation Racers,7.3,United Front Games,SCEA,"ModNation Racers (USA) (En,Fr,Es).iso",1.5 GiB,262.7 GiB
NBA Live 08,7.3,EA Canada,EA Sports,NBA Live 08 (USA).iso,1.5 GiB,264.2 GiB
Need for Speed: Most Wanted (2005),7.3,EA Canada,Electronic Arts,Need for Speed - Most Wanted 5-1-0 (USA).iso,883.7 MiB,265.1 GiB
NFL Street 2 Unleashed,7.3,EA Tiburon,EA Sports Big,NFL Street 2 Unleashed (USA) (v1.02).iso,663.6 MiB,265.7 GiB
Pinball Hall of Fame: The Gottlieb Collection,7.3,Farsight Studios,Crave,Pinball Hall of Fame - The Gottlieb Collection (USA).iso,251.9 MiB,266.0 GiB
Untold Legends: The Warrior's Code,7.3,Sony Online Entertainment,Sony Online Entertainment,Untold Legends - The Warrior's Code (USA) (v1.02).iso,1004.9 MiB,267.0 GiB
Wild ARMs XF,7.3,Media.Vision,XSEED Games,Wild Arms XF (USA).iso,1.6 GiB,268.5 GiB
Yu-Gi-Oh! 5D's Tag Force 5,7.3,Konami,Konami,"Yu-Gi-Oh! 5D's - Tag Force 5 (USA) (En,Fr,De,Es,It).iso",1.6 GiB,270.1 GiB
Alien Syndrome (2007),7.2,Totally Games,Sega,Alien Syndrome (USA).iso,471.9 MiB,270.6 GiB
Carol Vorderman's Sudoku,7.2,Empire Interactive,Eidos Interactive,"Carol Vorderman's Sudoku (USA) (En,Fr,De,Es,It) (v1.01).iso",409.8 MiB,271.0 GiB
Dead or Alive Paradise,7.2,Team Ninja,Tecmo,Dead or Alive - Paradise (USA) (v1.01).iso,829.7 MiB,271.8 GiB
Despicable Me: The Game,7.2,Monkey Bar Games,D3Publisher,"Despicable Me - The Game (USA) (En,Fr,Es).iso",495.2 MiB,272.3 GiB
FIFA World Cup: Germany 2006,7.2,EA Canada,Electronic Arts,FIFA World Cup - Germany 2006 (USA) (v1.01).iso,1.2 GiB,273.5 GiB
Jak and Daxter: The Lost Frontier,7.2,High Impact Games,SCEA,"Jak and Daxter - The Lost Frontier (USA) (En,Fr,Es).iso",1.4 GiB,274.8 GiB
Justice League Heroes,7.2,Snowblind Studios,Warner Bros. Interactive Entertainment,Justice League Heroes (USA) (v1.01).iso,1.3 GiB,276.2 GiB
Lord of Arcana,7.2,Access Games,Square Enix,"Lord of Arcana (USA) (En,Fr).iso",767.7 MiB,276.9 GiB
Medal of Honor Heroes,7.2,Team Fusion,EA Games,Medal of Honor - Heroes (USA).iso,1.3 GiB,278.3 GiB
Monster Hunter Freedom 2,7.2,Capcom,Capcom,Monster Hunter Freedom 2 (USA) (v1.01).iso,798.4 MiB,279.1 GiB
Monsters (Probably) Stole My Princess,7.2,Mediatonic,Mediatonic,Monsters (Probably) Stole My Princess (USA) (minis) (PSN).iso,205.5 MiB,279.3 GiB
NBA 06,7.2,SCEA Sports Studio,SCEA,NBA 06 (USA).iso,296.2 MiB,279.6 GiB
Pro Evolution Soccer 2010,7.2,Konami,Konami,"Pro Evolution Soccer 2010 (USA) (En,Fr,Es,Pt).iso",972.8 MiB,280.5 GiB
SOCOM: U.S. Navy SEALs Tactical Strike,7.2,Slant Six,SCEA,SOCOM - U.S. Navy SEALs - Tactical Strike (USA).iso,1.3 GiB,281.8 GiB
The Bigs,7.2,Blue Castle Games,2K Sports,"Bigs, The (USA) (v1.01).iso",825.3 MiB,282.6 GiB
The Silent Hill Experience,7.2,Konami,Konami,Silent Hill Origins (USA) (PSN).iso,767.4 MiB,283.3 GiB
Thrillville,7.2,Frontier Developments,LucasArts,Thrillville (USA) (v1.01).iso,689.7 MiB,284.0 GiB
Thrillville: Off the Rails,7.2,Frontier Developments,LucasArts,Thrillville - Off the Rails (USA) (v1.01).iso,742.6 MiB,284.7 GiB
Tiger Woods PGA Tour 08,7.2,EA Salt Lake,EA Sports,Tiger Woods PGA Tour 08 (USA).iso,1.3 GiB,286.0 GiB
Tokobot,7.2,Tecmo,Tecmo,Tokobot (USA) (v1.02).iso,313.3 MiB,286.3 GiB
Vibes,7.2,Laughing Jackal,Laughing Jackal,Vibes (USA) (v2) (minis) (PSN).iso,184.3 MiB,286.5 GiB
World Tour Soccer 06,7.2,SCEE London Studio,SCEA,World Tour Soccer 06 (USA).iso,864.4 MiB,287.3 GiB
WWE SmackDown vs. Raw 2009,7.2,Yuke's,THQ,WWE SmackDown vs. Raw 2009 (Korea).iso,1.4 GiB,288.7 GiB
Ace Combat: Joint Assault,7.1,Project Aces ,Namco Bandai Games,Ace Combat - Joint Assault (USA).iso,1.6 GiB,290.4 GiB
Cubixx (2010),7.1,Laughing Jackal,Laughing Jackal,Cubixx (USA) (minis) (PSN).iso,133.0 MiB,290.5 GiB
Driver '76,7.1,Sumo Digital,Ubisoft,Driver 76 (USA).iso,1.0 GiB,291.5 GiB
Dungeons & Dragons Tactics,7.1,Kuju Entertainment,Atari SA,Dungeons & Dragons Tactics (USA) (v1.01).iso,462.4 MiB,292.0 GiB
LEGO Harry Potter: Years 1-4,7.1,Traveller's Tales,Warner Bros. Interactive Entertainment,LEGO Harry Potter - Years 1-4 (USA).iso,1.3 GiB,293.3 GiB
Monster Hunter Freedom,7.1,Capcom,Capcom,Monster Hunter Freedom (USA) (v1.01).iso,706.9 MiB,294.0 GiB
Rocky Balboa,7.1,Ubisoft,Ubisoft,Rocky Balboa (USA) (v1.02).iso,864.3 MiB,294.8 GiB
The 3rd Birthday,7.1,HexaDrive,Square Enix,"3rd Birthday, The (USA).iso",1.4 GiB,296.2 GiB
The Red Star,7.1,XS Games,XS Games,"Red Star, The (USA) (PSN).iso",509.5 MiB,296.7 GiB
The Sims 2: Castaway,7.1,Maxis,Electronic Arts,"Sims 2, The - Castaway (USA) (En,Fr,De,Es,It,Nl,Pt).iso",986.2 MiB,297.7 GiB
UEFA Champions League 2006-2007,7.1,EA Canada,EA Games,UEFA Champions League 2006-2007 (USA) (v1.01).iso,1.2 GiB,298.8 GiB
Young Thor,7.1,Frima Studio,Frima Studio,Young Thor (USA) (minis) (PSN).iso,201.7 MiB,299.0 GiB
Atari Classics Evolved,7.0,Stainless Games,Atari SA,Atari Classics Evolved (USA) (v1.02).iso,80.1 MiB,299.1 GiB
Ben 10: Alien Force,7.0,Monkey Bar Games,D3Publisher,"Ben 10 - Alien Force (USA) (En,Fr,De,Es,It) (v1.01).iso",1.2 GiB,300.3 GiB
Call of Duty 3,7.0,Treyarch,Activision,Tales of Destiny 2 (Japan).iso,1.3 GiB,301.6 GiB
flOw,7.0,ThatGameCompany,SCEA,flOw (USA) (PSP) (PSN).iso,132.1 MiB,301.8 GiB
GripShift,7.0,Sidhe Interactive,Sony Platform Publishing,Gripshift (USA).iso,789.2 MiB,302.5 GiB
Harry Potter and the Goblet of Fire,7.0,Electronic Arts,Electronic Arts,Harry Potter and the Goblet of Fire (USA).iso,391.3 MiB,302.9 GiB
Hungry Giraffe,7.0,Laughing Jackal,Laughing Jackal,Hungry Giraffe (USA) (minis) (PSN).iso,141.9 MiB,303.1 GiB
Kenka Bancho: Badass Rumble,7.0,Bullets,Atlus,Kenka Bancho - Badass Rumble (USA).iso,499.9 MiB,303.6 GiB
Naruto: Ultimate Ninja Heroes,7.0,CyberConnect2,Namco Bandai Games,Naruto - Ultimate Ninja Heroes (USA).iso,242.3 MiB,303.8 GiB
Naruto: Ultimate Ninja Heroes 2: The Phantom Fortress,7.0,CyberConnect2,Namco Bandai Games,Naruto - Ultimate Ninja Heroes 2 - The Phantom Fortress (USA).iso,1.1 GiB,304.9 GiB
Shaun White Snowboarding,7.0,Ubisoft Montreal,Ubisoft,Shaun White Snowboarding (USA) (v1.01).iso,468.7 MiB,305.4 GiB
Spider-Man: Friend or Foe,7.0,Next Level Games,Activision,Spider-Man - Friend or Foe (USA).iso,552.0 MiB,305.9 GiB
The Legend of Heroes II: Prophecy of the Moonlight Witch,7.0,Microvision,Namco Bandai Games,"Legend of Heroes II, The - Prophecy of the Moonlight Witch (USA).iso",1.7 GiB,307.6 GiB
Tiger Woods PGA Tour 10,7.0,EA Tiburon,Electronic Arts,Tiger Woods PGA Tour 10 (USA).iso,1.4 GiB,308.9 GiB
World Series of Poker: Tournament of Champions,7.0,Left Field Productions,Activision,World Series of Poker - Tournament of Champions - 2007 Edition (USA).iso,722.7 MiB,309.7 GiB
World Tour Soccer,7.0,SCEE,SCEA,"World Tour Soccer (USA) (En,Fr,Es,It) (v1.01).iso",496.0 MiB,310.1 GiB
Worms: Open Warfare,7.0,Team17,Team17,Worms - Open Warfare (USA) (v1.02).iso,225.7 MiB,310.4 GiB
WWE SmackDown vs. Raw 2011,7.0,Yuke's,THQ,WWE SmackDown vs. Raw 2011 (Korea).iso,1.6 GiB,312.0 GiB
Yu-Gi-Oh! GX Tag Force,7.0,Konami,Konami,Yu-Gi-Oh! GX - Tag Force (USA) (v1.03).iso,669.2 MiB,312.6 GiB
2010 FIFA World Cup South Africa,6.9,Electronic Arts,EA Sports,"2010 FIFA World Cup South Africa (Canada) (En,Fr).iso",1.6 GiB,314.3 GiB
Arctic Adventures: Polar's Puzzles,6.9,Eiconic Games,Eiconic Games,Arctic Adventures - Polar's Puzzles (USA) (minis) (PSN).iso,138.7 MiB,314.4 GiB
Assassin's Creed: Bloodlines,6.9,Griptonite Games,Ubisoft,"Assassin's Creed - Bloodlines (USA) (En,Fr,De,Es,It).iso",772.1 MiB,315.2 GiB
Ben 10 Ultimate Alien: Cosmic Destruction,6.9,Papaya Studio,D3Publisher,Ben 10 - Ultimate Alien - Cosmic Destruction (USA).iso,1.2 GiB,316.4 GiB
Crash: Mind Over Mutant,6.9,Radical Entertainment,Activision,"Crash - Mind Over Mutant (USA) (En,Fr) (v1.01).iso",1.5 GiB,317.9 GiB
Crash Tag Team Racing,6.9,Radical Entertainment,VU Games,Crash Tag Team Racing (USA) (v1.01).iso,1.4 GiB,319.3 GiB
Football Manager 2010,6.9,Sports Interactive,Sega,"Football Manager Handheld 2010 (USA) (En,Fr,Es,It) (PSP) (PSN).iso",208.8 MiB,319.5 GiB
Gravity Crash,6.9,Just Add Water,SCEA,Gravity Crash (USA) (minis) (PSN).iso,174.6 MiB,319.7 GiB
Harvest Moon: Boy & Girl,6.9,Marvelous Entertainment,Natsume,Harvest Moon - Boy & Girl (USA).iso,325.7 MiB,320.0 GiB
Major League Baseball 2K6,6.9,Kush Games,2K Sports,Major League Baseball 2K6 (USA) (v1.01).iso,1.5 GiB,321.5 GiB
Medal of Honor Heroes 2,6.9,EA Canada,Electronic Arts,Medal of Honor - Heroes 2 (USA).iso,1.1 GiB,322.6 GiB
Metal Gear Solid: Portable Ops Plus,6.9,Kojima Productions,Konami,Metal Gear Solid - Portable Ops Plus (USA) (v1.01).iso,1.2 GiB,323.8 GiB
MotoGP (2006),6.9,Namco Bandai Games,Namco Bandai Games,"MotoGP (Europe) (En,Fr,De,It,Nl).iso",402.8 MiB,324.2 GiB
Myst (1995),6.9,Hoplite Research,Empire Interactive,Myst (USA) (PSP) (PSN).iso,835.5 MiB,325.0 GiB
NBA 10 The Inside,6.9,SCEA San Diego Studios,SCEA,NBA 10 - The Inside (USA).iso,1.0 GiB,326.0 GiB
NBA Ballers: Rebound,6.9,Backbone Entertainment,Midway,NBA Ballers Rebound (USA) (v1.05).iso,846.9 MiB,326.9 GiB
Need for Speed: Shift,6.9,Slightly Mad Studios,EA Games,"Need for Speed - Shift (USA) (En,Fr,Es).iso",1.7 GiB,328.5 GiB
PQ: Practical Intelligence Quotient,6.9,Now Production,D3Publisher,PQ - Practical Intelligence Quotient (USA) (v1.01).iso,170.4 MiB,328.7 GiB
R-Type Command,6.9,Irem,Atlus,R-Type Command (USA).iso,318.1 MiB,329.0 GiB
Sky Force,6.9,Infinite Dreams,Infinite Dreams,Sky Force (USA) (minis) (PSN).iso,143.7 MiB,329.2 GiB
Super Stardust Portable,6.9,Housemarque,SCEA,"Super Stardust Portable (USA) (En,Fr,De,Es,It,Nl,Pt,Ru) (PSP) (PSN).iso",188.1 MiB,329.3 GiB
The Eye of Judgment: Legends,6.9,SCEJ,SCEA,"Eye of Judgment, The - Legends (USA) (PSP) (PSN).iso",853.5 MiB,330.2 GiB
Tom Clancy's Rainbow Six: Vegas,6.9,Ubisoft Montreal,Ubisoft,"Tom Clancy's Rainbow Six - Vegas (USA) (En,Fr,Es) (v1.02).iso",812.8 MiB,331.0 GiB
Unchained Blades,6.9,FuRyu,XSEED Games,Unchained Blades (USA) (PSN).iso,504.0 MiB,331.5 GiB
Bloons,6.8,Bloober Team,Hands-On Mobile,Bloons (USA) (minis) (PSN).iso,131.5 MiB,331.6 GiB
BreakQuest: Extra Evolution,6.8,Beatshapers,Beatshapers,BreakQuest - Extra Evolution (USA) (minis) (PSN).iso,181.8 MiB,331.8 GiB
Buzz! Master Quiz,6.8,Relentless Software,SCEA,Buzz! Master Quiz (USA).iso,864.4 MiB,332.6 GiB
Crash of the Titans,6.8,Radical Entertainment,Sierra Entertainment,Crash of the Titans (USA) (v1.01).iso,779.3 MiB,333.4 GiB
Disney/Pixar Ratatouille,6.8,Asobo Studio,THQ,Disney-Pixar Ratatouille (Denmark).iso,864.4 MiB,334.2 GiB
Everyday Shooter,6.8,Backbone Entertainment,SCEA,Everyday Shooter (USA) (PSP) (PSN).iso,160.2 MiB,334.4 GiB
F1 2009,6.8,Sumo Digital,Codemasters,F1 2009 (USA).iso,652.7 MiB,335.0 GiB
FIFA Soccer 11,6.8,EA Sports,Electronic Arts,"FIFA Soccer 11 (USA) (En,Es) (v2.00).iso",1.6 GiB,336.6 GiB
Fighting Fantasy: The Warlock of Firetop Mountain (2011),6.8,Laughing Jackal,Laughing Jackal,Fighting Fantasy - The Warlock of Firetop Mountain (USA) (minis) (PSN).iso,151.8 MiB,336.8 GiB
Hysteria Project,6.8,Bulkypix,Sanuk Games,Hysteria Project (USA) (minis) (PSN).iso,188.3 MiB,337.0 GiB
Madden NFL 09,6.8,EA Tiburon,Electronic Arts,Madden NFL 09 (USA).iso,1.3 GiB,338.2 GiB
MX vs. ATV Unleashed,6.8,Rainbow Studios,THQ,MX vs. ATV Untamed (USA).iso,290.2 MiB,338.5 GiB
N.O.V.A. - Near Orbit Vanguard Alliance,6.8,Gameloft,Gameloft,,,
NBA 07,6.8,SCEA,SCEA,NBA 07 (USA).iso,595.0 MiB,339.1 GiB
NFL Street 3,6.8,EA Tiburon,EA Sports,NFL Street 3 (USA).iso,859.9 MiB,339.9 GiB
Puyo Pop Fever,6.8,Sonic Team,Atlus,Puyo Pop Fever (Europe) (v1.01).iso,174.4 MiB,340.1 GiB
DreamWorks Shrek the Third,6.8,7 Studios,Activision,Shrek the Third (USA) (v1.01).iso,485.8 MiB,340.6 GiB
Smash Court Tennis 3,6.8,Bandai Namco Games,Atari SA,Smash Court Tennis 3 (USA).iso,1.4 GiB,342.0 GiB
SNK Arcade Classics Vol. 1,6.8,SNK Playmore,SNK Playmore,SNK Arcade Classics Vol. 1 (USA) (v1.02).iso,1.3 GiB,343.3 GiB
Split/Second,6.8,Black Rock Studio,Disney Interactive Studios,"Split-Second (USA) (En,Fr,Es).iso",1.5 GiB,344.8 GiB
Tenchu: Shadow Assassins,6.8,Acquire,Ubisoft,Tenchu - Shadow Assassins (USA) (v1.01).iso,776.2 MiB,345.5 GiB
UEFA EURO 2008,6.8,EA Canada,Electronic Arts,UEFA Euro 2008 (USA) (v1.01).iso,1.4 GiB,346.9 GiB
World Poker Tour (2005),6.8,Coresoft,2K Sports,World Poker Tour (USA) (v1.06).iso,579.7 MiB,347.5 GiB
Zombie Tycoon,6.8,Frima Studio,Frima Studio,Zombie Tycoon (USA) (v3) (minis) (PSN).iso,190.0 MiB,347.6 GiB
Bust-A-Move Deluxe,6.7,Taito Corporation,Majesco,Bust-A-Move - Deluxe (USA).iso,67.0 MiB,347.7 GiB
I Must Run!,6.7,Gamelion Studios,Gamelion Studios,I Must Run! (USA) (minis) (PSN).iso,113.7 MiB,347.8 GiB
MTX Mototrax,6.7,Left Field Productions,Activision,MTX Mototrax (USA).iso,1018.4 MiB,348.8 GiB
MVP Baseball,6.7,EA Canada,Electronic Arts,MVP Baseball (USA) (v1.02).iso,1.3 GiB,350.1 GiB
PaRappa the Rapper,6.7,Epics,SCEA,PaRappa the Rapper (USA).iso,359.8 MiB,350.5 GiB
Pilot Academy,6.7,Kuju Entertainment,Marvelous Entertainment,"Pilot Academy (Europe) (En,Ja,Fr,De,Es,It) (v1.01).iso",313.1 MiB,350.8 GiB
Spider-Man 2 (2005),6.7,Vicarious Visions,Activision,Spider-Man 2 (USA) (v1.01).iso,556.5 MiB,351.3 GiB
Tales of the World: Radiant Mythology,6.7,Alfa System,Namco Bandai Games,Tales of the World - Radiant Mythology (USA).iso,419.3 MiB,351.8 GiB
The Bigs 2,6.7,Blue Castle Games,2K Sports,"Bigs 2, The (USA).iso",742.9 MiB,352.5 GiB
WRC: FIA World Rally Championship (2006),6.7,Traveller's Tales,Namco Bandai Games,WRC - FIA World Rally Championship (USA) (v1.01).iso,1.2 GiB,353.7 GiB
Armored Core: Formula Front - Extreme Battle,6.6,From Software,Agetec,Armored Core - Formula Front - Extreme Battle (USA) (v1.02).iso,777.1 MiB,354.5 GiB
Cabela's North American Adventures,6.6,FUN Labs,Activision,Cabela's North American Adventures (USA).iso,817.5 MiB,355.3 GiB
Coded Arms,6.6,Konami,Konami,Coded Arms (USA) (v1.01).iso,175.1 MiB,355.4 GiB
DiRT 2,6.6,Codemasters,Codemasters,,,
Final Fantasy II,6.6,TOSE,Square Enix,"Final Fantasy II (Japan, Asia) (En,Ja).iso",274.0 MiB,355.7 GiB
Football Manager Handheld 2012,6.6,Sega,Sega,"Football Manager Handheld 2012 (Europe) (En,Fr,Es,It).iso",206.8 MiB,355.9 GiB
Frogger Helmet Chaos,6.6,Konami Computer Entertainment Hawaii,Konami,Frogger - Helmet Chaos (USA).iso,431.6 MiB,356.3 GiB
Monster Kingdom: Jewel Summoner,6.6,Gaia (Sony),Atlus,Monster Kingdom - Jewel Summoner (USA).iso,507.1 MiB,356.8 GiB
NASCAR (2006),6.6,EA Tiburon,EA Sports,NASCAR (USA) (v1.01).iso,703.8 MiB,357.5 GiB
NBA 2K13,6.6,Visual Concepts,2K Sports,NBA 2K13 (USA).iso,1.6 GiB,359.1 GiB
Neopets Petpet Adventures: The Wand of Wishing,6.6,SCEA,SCEA,Neopets - Petpet Adventures - The Wand of Wishing (USA).iso,823.3 MiB,359.9 GiB
Supermarket Mania,6.6,G5 Entertainment,G5 Entertainment,Supermarket Mania (USA) (minis) (PSN).iso,141.2 MiB,360.1 GiB
The Legend of Heroes III: Song of the Ocean,6.6,Microvision,Namco Bandai Games,"Legend of Heroes III, The - Song of the Ocean (USA) (v1.01).iso",834.4 MiB,360.9 GiB
Vempire,6.6,impressionware,impressionware,Vempire (USA) (minis) (PSN).iso,136.8 MiB,361.0 GiB
Army of Two: The 40th Day,6.5,EA Montreal,Electronic Arts,Army of Two - The 40th Day (USA).iso,858.6 MiB,361.9 GiB
Brothers in Arms: D-Day,6.5,Ubisoft Shanghai,Ubisoft,Brothers in Arms - D-Day (USA) (v1.01).iso,1.4 GiB,363.2 GiB
Capcom Puzzle World,6.5,Capcom,Capcom,Capcom Puzzle World (USA) (v1.02).iso,489.3 MiB,363.7 GiB
