title,score,developer,publisher,rom_name,size,running_total
Fighting Fantasy: Talisman of Death,6.5,Laughing Jackal,SCEA,Fighting Fantasy - Talisman of Death (USA) (minis) (PSN).iso,150.9 MiB,363.8 GiB
Gretzky NHL 06,6.5,Page 44 Studios,SCEA,Gretzky NHL 06 (USA) (v1.02).iso,834.3 MiB,364.7 GiB
Halfbrick Rocket Racing,6.5,Halfbrick Studios,Halfbrick Studios,Rocket Racing (USA) (PSN).iso,178.7 MiB,364.8 GiB
Juiced: Eliminator,6.5,Juice Games,THQ,Juiced Eliminator (USA).iso,1.2 GiB,366.0 GiB
Marvel Nemesis: Rise of the Imperfects,6.5,EA Canada,EA Games,Marvel Nemesis - Rise of the Imperfects (USA).iso,864.3 MiB,366.9 GiB
No Gravity: The Plague Of Mind,6.5,Realtech VR,Anozor SARL,No Gravity - The Plague of Mind (USA) (PSP) (PSN).iso,165.6 MiB,367.0 GiB
Puzzle Guzzle,6.5,Irem,Agetec,Puzzle Guzzle (USA) (v1.02).iso,117.5 MiB,367.1 GiB
Spider-Man: Web of Shadows,6.5,Shaba Games,Activision,"Spider-Man - Web of Shadows (USA) (En,Fr) (v1.01).iso",416.6 MiB,367.5 GiB
World Championship Poker 2: Featuring Howard Lederer,6.5,Point of View,Crave,World Championship Poker 2 featuring Howard Lederer (USA) (v1.01).iso,197.5 MiB,367.7 GiB
Astonishia Story,6.4,Sonnori,Ubisoft,Astonishia Story (USA) (v1.02).iso,110.2 MiB,367.8 GiB
Chessmaster: Grandmaster Edition,6.4,Ubisoft,Ubisoft,,,
Crazy Taxi: Fare Wars,6.4,Sega,Sega,"Crazy Taxi - Fare Wars (USA) (En,Fr,De,Es,It) (v2.01).iso",530.2 MiB,368.4 GiB
Disney*Pixar WALL-E,6.4,Heavy Iron Studios,THQ,"Disney-Pixar WALL-E (United Arab Emirates) (En,Ar).iso",826.8 MiB,369.2 GiB
Hot Brain,6.4,Creat Studios,Midway,"Hot Brain (USA) (En,Fr,De,Es,It).iso",522.4 MiB,369.7 GiB
NBA Live 07,6.4,EA Sports,EA Sports,NBA Live 07 (USA) (v1.01).iso,1.4 GiB,371.1 GiB
NBA Live 10,6.4,EA Canada,EA Sports,NBA Live 10 (USA) (v1.01).iso,1.6 GiB,372.7 GiB
Samurai Warriors: State of War,6.4,Omega Force,Koei,Samurai Warriors - State of War (USA) (v1.01).iso,312.4 MiB,373.0 GiB
Star Trek: Tactical Assault,6.4,Quicksilver Software,Bethesda Softworks,Star Trek - Tactical Assault (USA) (v1.01).iso,243.4 MiB,373.2 GiB
Star Wars The Clone Wars: Republic Heroes,6.4,Krome Studios,LucasArts,Star Wars - The Clone Wars - Republic Heroes (USA).iso,1.4 GiB,374.6 GiB
Tom Clancy's Splinter Cell Essentials,6.4,Ubisoft,Ubisoft,Tom Clancy's Splinter Cell - Essentials (USA) (v1.02).iso,1.7 GiB,376.3 GiB
ATV Offroad Fury: Blazin' Trails,6.3,Climax Studios,SCEA,ATV Offroad Fury - Blazin' Trails (USA) (v1.01).iso,861.6 MiB,377.1 GiB
Bounty Hounds,6.3,Xpec,Namco Bandai Games,Bounty Hounds (USA).iso,1.1 GiB,378.2 GiB
Go! Sudoku,6.3,Sumo Digital,Ubisoft,"Go! Sudoku (USA) (En,Fr,De,Es,It).iso",297.5 MiB,378.5 GiB
LEGO Star Wars III: The Clone Wars,6.3,Traveller's Tales,LucasArts,"LEGO Star Wars III - The Clone Wars (USA) (En,Fr,Es).iso",1.6 GiB,380.1 GiB
Major League Baseball 2K8,6.3,Kush Games,2K Sports,Major League Baseball 2K8 (USA) (v1.02).iso,1.5 GiB,381.7 GiB
Marvel Trading Card Game,6.3,Vicious Cycle,Konami,Marvel Trading Card Game (USA) (v1.02).iso,891.1 MiB,382.5 GiB
Miami Vice: The Game (2006),6.3,Rebellion,Sierra Entertainment,Miami Vice - The Game (USA) (v1.01).iso,330.6 MiB,382.9 GiB
Midway Arcade Treasures: Extended Play,6.3,Digital Eclipse,Midway,Midway Arcade Treasures - Extended Play (USA).iso,618.2 MiB,383.5 GiB
Need for Speed: Undercover,6.3,EA Vancouver,Electronic Arts,Need for Speed - Undercover (USA).iso,1.2 GiB,384.7 GiB
Stacked with Daniel Negreanu,6.3,5000ft Inc.,Myelin Media,Stacked with Daniel Negreanu (USA) (v1.02).iso,864.2 MiB,385.5 GiB
Star Wars: Lethal Alliance,6.3,Ubisoft Montreal,Ubisoft,"Star Wars - Lethal Alliance (USA) (En,Fr,De,Es,It) (v1.02).iso",857.9 MiB,386.4 GiB
The Con,6.3,SCEA,SCEA,"Con, The (USA).iso",818.5 MiB,387.2 GiB
WTF: Work Time Fun,6.3,SCEJ,D3Publisher,WTF - Work Time Fun (USA) (v1.01).iso,419.2 MiB,387.6 GiB
Aedis Eclipse: Generation of Chaos,6.2,Idea Factory,NIS America,Aedis Eclipse - Generation of Chaos (USA).iso,638.0 MiB,388.2 GiB
Arcade Darts,6.2,Icon Games,Icon Games,Arcade Darts (USA) (minis) (PSN).iso,138.2 MiB,388.3 GiB
Buzz! Quiz World,6.2,Relentless Software,SCEA,Buzz! Quiz World (USA) (PSP) (PSN).iso,1015.1 MiB,389.3 GiB
Dynasty Warriors (PSP),6.2,Omega Force,Koei,Dynasty Warriors (USA).iso,153.1 MiB,389.5 GiB
Fading Shadows,6.2,Ivolgamus,Agetec,"Fading Shadows (USA) (En,Fr,De,Es,It,Nl,Ru) (v1.03).iso",702.8 MiB,390.1 GiB
Gunpey DS,6.2,Q Entertainment,Namco Bandai Games,Gunpey (USA).iso,697.6 MiB,390.8 GiB
Harvey Birdman: Attorney at Law,6.2,High Voltage Software,Capcom,Harvey Birdman - Attorney at Law (USA).iso,1.6 GiB,392.4 GiB
Mana Khemia: Alchemists of Al-Revis,6.2,Gust,NIS America,,,
Naruto Shippuden: Ultimate Ninja Heroes 3,6.2,CyberConnect2,Namco Bandai Games,Naruto Shippuden - Ultimate Ninja Heroes 3 (USA).iso,1.3 GiB,393.7 GiB
Puzzle Chronicles,6.2,Konami,Konami,Puzzle Chronicles (USA).iso,384.3 MiB,394.1 GiB
Warriors Orochi,6.2,Omega Force,Koei,Warriors Orochi (USA).iso,864.3 MiB,394.9 GiB
300: March to Glory,6.1,Collision Studios,Warner Bros. Interactive Entertainment,"300 - March to Glory (USA) (En,Fr,De,Es,It) (v1.01).iso",909.8 MiB,395.8 GiB
Blood Bowl,6.1,Cyanide,Focus Home Interactive,"Blood Bowl (USA) (En,Fr,De,Es,It) (v1.01).iso",222.9 MiB,396.0 GiB
Class of Heroes,6.1,Zerodiv,Atlus,Class of Heroes (USA) (v1.01).iso,324.9 MiB,396.3 GiB
Disney Pirates of the Caribbean: At World's End,6.1,Eurocom,Disney Interactive Studios,"Disney Pirates of the Caribbean - At World's End (Europe) (En,Fr,De,Es,It,Nl).iso",1.7 GiB,398.0 GiB
From Russia With Love,6.1,EA Redwood Shores,Electronic Arts,007 - From Russia with Love (USA).iso,698.6 MiB,398.7 GiB
Gretzky NHL,6.1,Page 44 Studios,SCEA,Gretzky NHL (USA).iso,146.1 MiB,398.8 GiB
Major League Baseball 2K7,6.1,Kush Games,2K Sports,Major League Baseball 2K7 (USA) (v1.01).iso,1.6 GiB,400.4 GiB
Micro Machines V4,6.1,Supersonic Software,Codemasters,Micro Machines V4 (USA) (v1.01).iso,574.1 MiB,401.0 GiB
The King of Fighters Collection: The Orochi Saga,6.1,M2,SNK Playmore,"King of Fighters Collection, The - The Orochi Saga (USA).iso",1.4 GiB,402.4 GiB
Tom Clancy's Ghost Recon Advanced Warfighter 2,6.1,Red Storm Entertainment,Ubisoft,"Tom Clancy's Ghost Recon - Advanced Warfighter 2 (USA) (En,Fr,De,Es,It).iso",724.6 MiB,403.1 GiB
Astro Boy: The Video Game,6.0,High Voltage Software,D3Publisher,"Astro Boy - The Video Game (USA) (En,Fr,Es,It,Nl).iso",1.1 GiB,404.2 GiB
Blade Dancer: Lineage of Light,6.0,Hit Maker,NIS America,Blade Dancer - Lineage of Light (USA) (v1.01).iso,370.6 MiB,404.5 GiB
Cube (2007),6.0,Metia Interactive,D3Publisher,Cube (USA) (v1.01).iso,412.5 MiB,404.9 GiB
Generation of Chaos,6.0,Idea Factory,NIS America,Generation of Chaos (USA) (v1.02).iso,1.1 GiB,406.0 GiB
Hot Wheels: Ultimate Racing,6.0,Raylight Studios,DSI Games,"Hot Wheels Ultimate Racing (USA) (En,Fr,De,Es,It) (v1.02).iso",826.3 MiB,406.8 GiB
Jikandia: The Timeless Land,6.0,Opus Studio,Aksys Games,Jikandia - The Timeless Land (USA).iso,161.3 MiB,407.0 GiB
Luxor: The Wrath of Set,6.0,MumboJumbo,MumboJumbo,Luxor - The Wrath of Set (USA).iso,864.3 MiB,407.8 GiB
Naruto Shippuden: Legends: Akatsuki Rising,6.0,Racjin,Namco Bandai Games,Naruto Shippuden - Legends - Akatsuki Rising (USA).iso,728.4 MiB,408.5 GiB
Online Chess Kingdoms,6.0,Leviathan Games,Konami,"Online Chess Kingdoms (USA) (En,Fr,De,Es,It) (v1.02).iso",254.6 MiB,408.8 GiB
ProStroke Golf - World Tour 2007,6.0,Gusto Games,Oxygen Interactive,Pro Stroke Golf - World Tour 2007 (USA) (v1.01).iso,771.9 MiB,409.5 GiB
Puzzle Scape,6.0,Farmind Ltd,Got Game Entertainment,Puzzle Scape (USA) (v1.04).iso,330.1 MiB,409.8 GiB
Spider-Man 3,6.0,Treyarch,Activision,Spider-Man 3 (USA).iso,1.6 GiB,411.4 GiB
Brainpipe: A Plunge to Unhumanity,5.9,Hands-On Mobile,Hands-On Mobile,,,
Eragon,5.9,Stormfront Studios,Sierra Entertainment,Eragon (USA) (v1.03).iso,237.3 MiB,411.6 GiB
Family Guy,5.9,High Voltage Software,2K Games,Family Guy (USA).iso,1.1 GiB,412.8 GiB
Frantix: A Puzzle Adventure,5.9,Killer Game,Sony Online Entertainment,Frantix - A Puzzle Adventure (USA) (v1.01).iso,382.7 MiB,413.1 GiB
Gang Wars (1989),5.9,Alpha Denshi,SNK Playmore,Gang Wars (USA) (minis) (PSN).iso,128.6 MiB,413.3 GiB
MX vs. ATV Untamed,5.9,Rainbow Studios,THQ,MX vs. ATV Untamed (USA).iso,290.2 MiB,413.5 GiB
Platypus,5.9,Squashy Software,MumboJumbo,Platypus (USA) (v1.01).iso,72.5 MiB,413.6 GiB
Xiaolin Showdown,5.9,BottleRocket Entertainment,Konami,Xiaolin Showdown (USA) (v1.02).iso,864.4 MiB,414.5 GiB
BreakQuest,5.8,Beatshapers,Beatshapers,BreakQuest (USA) (v2) (minis) (PSN).iso,194.8 MiB,414.6 GiB
DreamWorks Over the Hedge: Hammy Goes Nuts,5.8,Amaze Entertainment,Activision,Over the Hedge - Hammy Goes Nuts! (USA) (v1.01).iso,310.2 MiB,414.9 GiB
Fortix,5.8,Nemesys,Nemesys,Fortix (USA) (v3) (minis) (PSN).iso,151.6 MiB,415.1 GiB
Hero of Sparta,5.8,Gameloft,Gameloft,Hero of Sparta (USA) (minis) (PSN).iso,172.1 MiB,415.3 GiB
Jackass the Game,5.8,Sidhe Interactive,Red Mile Entertainment,Jackass - The Game (USA) (v1.02).iso,1.7 GiB,416.9 GiB
Scarface: Money. Power. Respect.,5.8,Farsight Studios,Sierra Entertainment,Scarface - Money. Power. Respect. (USA) (v1.01).iso,551.7 MiB,417.5 GiB
The Fast and the Furious (2006),5.8,Eutechnyx,Namco Bandai Games,"Fast and The Furious, The (USA) (v1.01).iso",863.2 MiB,418.3 GiB
Avatar: The Last Airbender,5.7,AWE Games,THQ,Avatar - The Last Airbender (USA).iso,169.9 MiB,418.5 GiB
BattleZone (2006),5.7,Paradigm Entertainment,Atari SA,"BattleZone (USA) (En,Fr,De,Es,It) (v1.02).iso",864.4 MiB,419.3 GiB
Dynasty Warriors Vol. 2,5.7,Omega Force,Koei,Dynasty Warriors Vol. 2 (USA).iso,266.2 MiB,419.6 GiB
EyePet,5.7,SCEE London Studio,SCEA,"EyePet (USA) (En,Fr,Es,Pt).iso",659.7 MiB,420.2 GiB
KAO Challengers,5.7,Tate Interactive,Atari SA,Kao Challengers (USA) (v1.01).iso,585.8 MiB,420.8 GiB
MiniSquadron,5.7,MrFungFung,MrFungFung,MiniSquadron (USA) (minis) (PSN).iso,168.1 MiB,421.0 GiB
Naruto Shippuden: Kizuna Drive,5.7,Premium Agency ,Namco Bandai Games,"Naruto Shippuden - Kizuna Drive (USA) (En,Fr,Es).iso",1.1 GiB,422.1 GiB
NBA,5.7,989 Sports,SCEA,NBA (USA).iso,185.6 MiB,422.3 GiB
Neverland Card Battles,5.7,Idea Factory,Yuke's,Neverland Card Battles (USA).iso,399.8 MiB,422.6 GiB
The Sims 2: Pets,5.7,Maxis,EA Games,"Sims 2, The (USA).iso",1.0 GiB,423.7 GiB
Ultimate Board Game Collection,5.7,Jack of All Games,Valcon Games,Ultimate Board Game Collection (USA) (v1.02).iso,121.2 MiB,423.8 GiB
Coded Arms: Contagion,5.6,Creat Studios,Konami,Coded Arms - Contagion (USA) (v1.04).iso,521.9 MiB,424.3 GiB
Dragoneer's Aria,5.6,Hit Maker,NIS America,Dragoneer's Aria (USA).iso,370.1 MiB,424.7 GiB
Dungeon Explorer: Warriors of Ancient Arts,5.6,Hudson Soft,Hudson Entertainment,Dungeon Explorer - Warriors of Ancient Arts (USA) (v1.01).iso,539.2 MiB,425.2 GiB
EA Replay,5.6,Team Fusion,Electronic Arts,EA Replay (USA) (v1.01).iso,850.4 MiB,426.0 GiB
Peter Jackson's King Kong: The Official Game of the Movie,5.6,Ubisoft Montpellier,Ubisoft,Peter Jackson's King Kong (USA) (v1.02).iso,472.2 MiB,426.5 GiB
Super Monkey Ball Adventure,5.6,Traveller's Tales,Sega,Super Monkey Ball Adventure (USA) (v1.02).iso,404.0 MiB,426.9 GiB
Unbound Saga,5.6,Vogster,"Vogster Entertainment, LLC",Unbound Saga (USA) (PSP) (PSN).iso,414.0 MiB,427.3 GiB
World Championship Poker: Featuring Howard Lederer - All In,5.6,Point of View,Crave,World Championship Poker featuring Howard Lederer - All In (USA) (v1.01).iso,1.7 GiB,429.0 GiB
Bomberman Land Portable,5.5,Racjin,Hudson Entertainment,Bomberman Land Portable (Japan).iso,394.1 MiB,429.4 GiB
Disney/Pixar Cars 2,5.5,Avalanche Software,Disney Interactive Studios,"Disney-Pixar Cars 2 (Europe) (En,Fr,De,Es,It,Nl,Pt,Pl,Ru).iso",697.3 MiB,430.0 GiB
Diner Dash,5.5,Climax Studios,Eidos Interactive,"Diner Dash (Europe) (En,Fr,De,Es,It) (v1.01).iso",130.9 MiB,430.2 GiB
DJ Max Portable 3,5.5,Pentavision Entertainment,PM Studios Inc.,DJ Max Portable 3 (USA) (v1.01).iso,1.7 GiB,431.8 GiB
Hot Pixel,5.5,zSlide,Atari SA,Hot Pixel (USA) (v1.02).iso,321.0 MiB,432.1 GiB
L.A. Rush,5.5,Midway,Midway,"L.A. Rush (Europe) (En,Fr,De,Es,It) (v1.01).iso",1.3 GiB,433.4 GiB
Ninjamurai,5.5,Open Emotion Studios,Open Emotion Studios,Ninjamurai (USA) (v2.02) (minis) (PSN).iso,171.4 MiB,433.6 GiB
Warhammer: Battle for Atluma,5.5,Sabertooth Games,Namco Bandai Games,Warhammer - Battle for Atluma (USA) (v1.03).iso,229.5 MiB,433.8 GiB
Duael Invaders,5.4,Laughing Jackal,Laughing Jackal,Duael Invaders (USA) (minis) (PSN).iso,152.2 MiB,434.0 GiB
Ghostbusters: The Video Game,5.4,Terminal Reality,Atari SA,Ghostbusters - The Video Game (USA).iso,1.1 GiB,435.1 GiB
International Athletics,5.4,The Code Monkeys,Ghostlight,"International Athletics (Europe) (En,Fr,De,Es,It) (v1.01).iso",132.1 MiB,435.2 GiB
Payout Poker & Casino,5.4,Bits Studios,Namco,Payout Poker & Casino (USA) (v1.02).iso,192.9 MiB,435.4 GiB
Scooby Doo!  Who's Watching Who?,5.4,Human Soft,THQ,Scooby-Doo! - Who's Watching Who (USA) (v1.01).iso,589.2 MiB,436.0 GiB
Steambot Chronicles: Battle Tournament,5.4,Irem,Atlus,Steambot Chronicles - Battle Tournament (USA).iso,256.4 MiB,436.2 GiB
Tom Clancy's Ghost Recon Predator,5.4,Virtuos,Ubisoft,"Tom Clancy's Ghost Recon - Predator (USA) (En,Fr,Es).iso",864.4 MiB,437.1 GiB
Alien Havoc,5.3,Creat Studios,Creat Studios,Alien Havoc (USA) (minis) (PSN).iso,118.7 MiB,437.2 GiB
Full Auto 2: Battlelines,5.3,Pseudo Interactive,Sega,Full Auto 2 - Battlelines (USA) (v1.01).iso,455.0 MiB,437.6 GiB
Strikers 1945 Plus,5.3,Arc System Works,PM Studios Inc.,Strikers 1945 Plus (USA) (PSN).iso,216.5 MiB,437.8 GiB
Tiger Woods PGA Tour 09,5.3,EA Tiburon,Electronic Arts,Tiger Woods PGA Tour 09 (USA).iso,1.5 GiB,439.3 GiB
50 Cent: Bulletproof,5.2,High Voltage Software,Vivendi Games,50 Cent - Bulletproof - G-Unit Edition (USA) (v1.02).iso,1.6 GiB,440.9 GiB
Ford Bold Moves Street Racing,5.2,Razorworks,Eidos Interactive,Ford Bold Moves Street Racing (USA) (v1.01).iso,700.0 MiB,441.6 GiB
Gangs of London,5.2,SCEE London Studio,SCEA,Gangs of London (USA) (v1.01).iso,1.0 GiB,442.6 GiB
Harry Potter and the Order of the Phoenix,5.2,EA Games,EA Games,Harry Potter and the Order of the Phoenix (USA).iso,728.1 MiB,443.3 GiB
Pirates of the Caribbean: Dead Man's Chest,5.2,Griptonite Games,Buena Vista Games,Pirates of the Caribbean - Dead Man's Chest (USA) (v1.01).iso,449.8 MiB,443.7 GiB
Warriors of the Lost Empire,5.2,Platinum Egg,UFO Interactive,"Warriors of the Lost Empire (USA) (En,Fr,Es) (v1.03).iso",1.7 GiB,445.4 GiB
7 Wonders of the Ancient World,5.1,Hot Lava Games,MumboJumbo,7 Wonders of the Ancient World (USA) (v1.01).iso,73.8 MiB,445.5 GiB
Ape Escape Academy,5.1,Shift,SCEA,Ape Escape Academy (USA) (v1.01).iso,370.9 MiB,445.8 GiB
Blokus Portable: Steambot Championship,5.1,Irem,Majesco,Blokus Portable - Steambot Championship (USA).iso,63.1 MiB,445.9 GiB
Brooktown High,5.1,Backbone Entertainment,Konami,Brooktown High (USA).iso,1.2 GiB,447.1 GiB
Marvel Super Hero Squad,5.1,Blue Tongue Entertainment,THQ,Marvel Super Hero Squad (USA).iso,1.5 GiB,448.6 GiB
Pac-Man World Rally,5.1,Smart Bomb Interactive,Namco Bandai Games,Pac-Man World Rally (USA) (v1.02).iso,412.7 MiB,449.0 GiB
Rengoku II: The Stairway to H.E.A.V.E.N.,5.1,Hudson Soft,Konami,Rengoku II - The Stairway to H.E.A.V.E.N. (USA) (v1.02).iso,479.1 MiB,449.5 GiB
The Hustle: Detroit Streets,5.1,Blade Interactive,Activision Value,"Hustle, The - Detroit Streets (USA) (v1.01).iso",942.6 MiB,450.4 GiB
B-Boy,5.0,FreeStyleGames,Evolved Games,B-Boy (USA) (v1.01).iso,1.5 GiB,451.9 GiB
SWAT: Target Liberty,5.0,3G Studios,Sierra Entertainment,SWAT - Target Liberty (USA) (v1.01).iso,838.1 MiB,452.7 GiB
TNA Impact: Cross the Line,5.0,Point of View,SouthPeak Games,"TNA Impact! Cross the Line (USA) (En,Fr).iso",1.1 GiB,453.8 GiB
Valhalla Knights 2,5.0,K2,XSEED Games,Valhalla Knights 2 (USA).iso,1.5 GiB,455.3 GiB
Heatseeker,4.9,IR Gurus,Codemasters,Heatseeker (USA) (v1.01).iso,385.8 MiB,455.6 GiB
Iron Man 2,4.9,Sega Studios San Francisco,Sega,"Iron Man (USA) (En,Fr,Es).iso",864.4 MiB,456.5 GiB
SpongeBob Squarepants: The Yellow Avenger,4.8,Tantalus,THQ,SpongeBob SquarePants - The Yellow Avenger (USA) (v1.01).iso,166.2 MiB,456.6 GiB
Bubble Bobble Evolution,4.7,Digital Whip,Codemasters,Bubble Bobble - Evolution (USA) (v1.01).iso,595.9 MiB,457.2 GiB
Ford Racing: Off Road,4.7,Razorworks,Empire Interactive,Ford Racing - Off Road (USA).iso,700.0 MiB,457.9 GiB
James Cameron's Avatar: The Game,4.7,Ubisoft Montreal,Ubisoft,"James Cameron's Avatar - The Game (USA) (En,Fr,Es).iso",662.9 MiB,458.6 GiB
Rainbow Islands Evolution,4.7,Digital Whip,Ignition Entertainment,"Rainbow Islands Evolution (USA) (En,Fr,Es).iso",807.8 MiB,459.3 GiB
Transformers: The Game,4.7,Traveller's Tales,Activision,Transformers - The Game (USA).iso,778.8 MiB,460.1 GiB
Mimana Iyar Chronicle,4.5,GungHo,Aksys Games,Mimana - Iyar Chronicle (USA) (v1.01).iso,632.1 MiB,460.7 GiB
Smart Bomb,4.5,Core Design Ltd.,Eidos Interactive,Smart Bomb (USA) (v1.03).iso,113.9 MiB,460.8 GiB
TMNT,4.5,Ubisoft Montreal,Ubisoft,"TMNT (USA) (En,Fr,De,Es,It) (v1.01).iso",909.1 MiB,461.7 GiB
Hard Rock Casino,4.4,Farsight Studios,Crave,Hard Rock Casino (USA) (v1.02).iso,586.4 MiB,462.3 GiB
Iron Man (2008),4.4,Secret Level,Sega,"Iron Man (USA) (En,Fr,Es).iso",864.4 MiB,463.1 GiB
Armored Core 3,4.3,From Software,Agetec,Armored Core 3 Portable (USA) (PSP) (PSN).iso,459.7 MiB,463.6 GiB
PDC World Championship Darts 2008,4.3,Oxygen Interactive,O-Games,"PDC World Championship Darts 2008 (Europe) (En,Fr,De,Es,It,Nl) (v1.02).iso",325.3 MiB,463.9 GiB
Rengoku: The Tower of Purgatory,4.3,Neverland,Konami,Rengoku - The Tower of Purgatory (USA) (v1.01).iso,170.7 MiB,464.1 GiB
Asphalt: Urban GT 2,4.2,Virtuos,Ubisoft,"Asphalt - Urban GT 2 (Europe) (En,Fr,De,Es,It) (v1.01).iso",843.2 MiB,464.9 GiB
Funky Punch,4.2,Solus Games,Solus Games,Funky Punch (USA) (v2) (minis) (PSN).iso,134.1 MiB,465.0 GiB
Hellboy: The Science of Evil,4.2,Krome Studios,Konami,Hellboy - The Science of Evil (USA).iso,864.3 MiB,465.9 GiB
CID The Dummy,4.1,Twelve Games,Oxygen Interactive,CID The Dummy (USA) (v1.02).iso,500.2 MiB,466.4 GiB
Street Supremacy,4.1,Genki,Konami,Street Supremacy (USA).iso,466.6 MiB,466.8 GiB
Taito Legends Power-Up,4.1,Empire Oxford,Destineer,Taito Legends Power-Up (USA) (v1.01).iso,301.8 MiB,467.1 GiB
FIFA 14,4.0,EA Canada,EA Sports,"FIFA 14 (USA) (En,Es) (PSP) (PSN).iso",1.6 GiB,468.7 GiB
Pocket Racers,3.9,Blade Interactive,Konami,Pocket Racers (USA) (v1.01).iso,255.8 MiB,468.9 GiB
Legend of the Dragon,3.8,Neko Entertainment,The Game Factory,Legend of the Dragon (USA) (v1.03).iso,788.9 MiB,469.7 GiB
Napoleon Dynamite: The Game,3.7,7 Studios,Crave,Napoleon Dynamite - The Game (USA) (v1.03).iso,627.4 MiB,470.3 GiB
Pocket Pool (2007),3.7,Conspiracy Entertainment,Eidos Interactive,Pocket Pool (USA) (v1.01).iso,672.3 MiB,471.0 GiB
Transformers: Revenge of the Fallen The Mobile Game,3.7,"Luxoflux, Inc.",Activision,Transformers - Revenge of the Fallen (USA).iso,1.6 GiB,472.6 GiB
World Series of Poker,3.7,Activision,Activision,World Series of Poker (USA).iso,329.2 MiB,472.9 GiB
Air Conflicts: Aces of World War II,3.6,Cowboy Rodeo,Graffiti Entertainment,Air Conflicts - Aces of World War II (USA).iso,859.1 MiB,473.7 GiB
Dave Mirra BMX Challenge,3.2,Left Field Productions,Crave,Dave Mirra BMX Challenge (USA).iso,696.0 MiB,474.4 GiB
FIFA Soccer 13,3.2,Electronic Arts,EA Sports,"FIFA Soccer 13 (USA) (En,Es).iso",1.6 GiB,476.0 GiB
Winx Club: Join the Club,3.0,n-Space,Konami,Winx Club - Join the Club (USA) (v1.05).iso,1.2 GiB,477.2 GiB
Dragon Ball: Evolution,2.8,Dimps Corporation,Namco Bandai Games,Dragon Ball Evolution (USA).iso,376.5 MiB,477.6 GiB
The Golden Compass,2.8,Shiny Entertainment,Sega,"Golden Compass, The (USA).iso",1.2 GiB,478.8 GiB
